course_code,name,units,desc,prereq1,prereq2,prereq3,prereq4,prereq5,prereq6,prereq7,prereq8,prereq9,misc_prereq
BENG 294C,Clinical Experience in Bioengineering,4,"Capstone experiential learning course where students are to integrate bioengineering training and clinical medicine through lectures and rotations with clinical faculty. Students will identify problems with diagnostics, clinical practice, and/or treatment, and use engineering principles to design solutions. May be coscheduled with BENG 193.",BENG 294B,,,,,,,,,Bioengineering MS medicine majors only or consent of department.
BENG 295,Bioengineering Design Project and Industrial Training,4,"Independent work by graduate students focused on design, applied research, and professional experience. ",,,,,,,,,,"Consent of instructor and department approval. (F,W,S)"
BENG 296,Independent Study,4,,,,,,,,,,,"Consent of instructor. (F,W,S)"
BENG 298,Directed Group Study,1–4,"Directed group study on a topic or in a field not included in regular department curriculum, by special arrangement with a faculty member. (S/U grades only.) ",,,,,,,,,,"Consent of instructor. (F,W,S)"
BENG 298L,Laboratory Research Rotation,4,Laboratory research rotation for first-year BENG PhD students. Students will write a final paper. (S/U grades only.) ,,,,,,,,,,"PhD student in bioengineering. (F,W,S)"
BENG 299,Graduate Research,1–12,Independent work by graduate students engaged in research and writing theses. (S/U grades only.) ,,,,,,,,,,"Consent of instructor. (F,W,S)"
BENG 500,Apprentice Teaching for Specialization in Multi-Scale Biology,"2, 4",Teaching experience in one of the six bioengineering lab courses designated as a part of the BENG PhD Specialization in Multi-Scale Biology. Student is under the direction of the faculty member in charge of the course. (S/U grades only.) ,,,,,,,,,,"Consent of instructor and department approval. (F,W,S)"
BENG 501,Teaching Experience,"2, 4",Teaching experience in an appropriate bioengineering undergraduate course under direction of the faculty member in charge of the course. Lecturing one to two hours per week in either a problem-solving section or regular lecture. (S/U grades only.) ,,,,,,,,,,"Consent of instructor and department approval. (F,W,S)"