course_code,name,units,desc,prereq1,prereq2,prereq3,prereq4,prereq5,prereq6,prereq7,prereq8,prereq9,misc_prereq
MATH 200C,Algebra III,4,"Third course in graduate algebra. Topics may include group actions, Sylow theorems, solvable and nilpotent groups, free groups and presentations, semidirect products, polynomial rings, unique factorization, chain conditions, modules over principal ideal domains, rational and Jordan canonical forms, tensor products, projective and flat modules, Galois theory, solvability by radicals, localization, primary decomposition, Hilbert Nullstellensatz, integral extensions, Dedekind domains, Krull dimension. ",MATH 200B,,,,,,,,,Students who have not completed MATH 200B may enroll with consent of instructor.
MATH 201A,Basic Topics in Algebra I,4,"Recommended for all students specializing in algebra. Basic topics include categorical algebra, commutative algebra, group representations, homological algebra, nonassociative algebra, ring theory. May be taken for credit six times with consent of adviser as topics vary. ",MATH 200C,,,,,,,,,Students who have not taken MATH 200C may enroll with consent of instructor.
MATH 202A,Applied Algebra I,4,"Introduction to algebra from a computational perspective. Groups, rings, linear algebra, rational and Jordan forms, unitary and Hermitian matrices, matrix decompositions, perturbation of eigenvalues, group representations, symmetric functions, fast Fourier transform, commutative algebra, Grobner basis, finite fields. ",,,,,,,,,,Graduate standing or consent of instructor.
MATH 202B,Applied Algebra II,4,"Second course in algebra from a computational perspective. Groups, rings, linear algebra, rational and Jordan forms, unitary and Hermitian matrices, matrix decompositions, perturbation of eigenvalues, group representations, symmetric functions, fast Fourier transform, commutative algebra, Grobner basis, finite fields. ",MATH 202A or consent of instructor,,,,,,,,,
MATH 202C,Applied Algebra III,4,"Third course in algebra from a computational perspective. Groups, rings, linear algebra, rational and Jordan forms, unitary and Hermitian matrices, matrix decompositions, perturbation of eigenvalues, group representations, symmetric functions, fast Fourier transform, commutative algebra, Grobner basis, finite fields. ",MATH 202B or consent of instructor,,,,,,,,,
MATH 203A,Algebraic Geometry I,4,"Introduction to algebraic geometry. Topics chosen from: varieties and their properties, sheaves and schemes and their properties. May be taken for credit up to three times. ",MATH 200C,,,,,,,,,Students who have not taken MATH 200C may enroll with consent of instructor.
MATH 203B,Algebraic Geometry II,4,"Second course in algebraic geometry. Continued exploration of varieties, sheaves and schemes, divisors and linear systems, differentials, cohomology. May be taken for credit up to three times. ",MATH 203A,,,,,,,,,Students who have not taken MATH 203A may enroll with consent of instructor.
MATH 203C,Algebraic Geometry III,4,"Third course in algebraic geometry. Continued exploration of varieties, sheaves and schemes, divisors and linear systems, differentials, cohomology, curves, and surfaces. May be taken for credit up to three times. ",MATH 203B,,,,,,,,,Students who have not taken MATH 203B may enroll with consent of instructor.
MATH 204A,Number Theory I,4,First course in graduate-level number theory. Local fields: valuations and metrics on fields; discrete valuation rings and Dedekind domains; completions; ramification theory; main statements of local class field theory. ,MATH 200C,,,,,,,,,Students who have not taken MATH 200C may enroll with consent of instructor.
MATH 204B,Number Theory II,4,Second course in graduate-level number theory. Global fields: arithmetic properties and relation to local fields; ideal class groups; groups of units; ramification theory; adèles and idèles; main statements of global class field theory. ,MATH 204A,,,,,,,,,Students who have not taken MATH 204A may enroll with consent of instructor.
MATH 204C,Number Theory III,4,Third course in graduate-level number theory. Zeta and L-functions; Dedekind zeta functions; Artin L-functions; the class-number formula and generalizations; density theorems. ,MATH 204B,,,,,,,,,Students who have not taken MATH 204B may enroll with consent of instructor.
MATH 205,Topics in Number Theory,4,"Topics in algebraic and analytic number theory, such as: L-functions, sieve methods, modular forms, class field theory, p-adic L-functions and Iwasawa theory, elliptic curves and higher dimensional abelian varieties, Galois representations and the Langlands program, p-adic cohomology theories, Berkovich spaces, etc. May be taken for credit nine times. ",,,,,,,,,,Graduate standing.
MATH 206A,Topics in Algebraic Geometry,4,"Introduction to varied topics in algebraic geometry. Topics will be drawn from current research and may include Hodge theory, higher dimensional geometry, moduli of vector bundles, abelian varieties, deformation theory, intersection theory. Nongraduate students may enroll with consent of instructor. May be taken for credit six times with consent of adviser as topics vary. ",,,,,,,,,,Graduate standing.
MATH 206B,Further Topics in Algebraic Geometry,4,"Continued development of a topic in algebraic geometry. Topics will be drawn from current research and may include Hodge theory, higher dimensional geometry, moduli of vector bundles, abelian varieties, deformation theory, intersection theory. May be taken for credit three times with consent of adviser as topics vary. ",MATH 206A,,,,,,,,,Students who have not completed MATH 206A may enroll with consent of instructor.
MATH 207A,Topics in Algebra,4,"Introduction to varied topics in algebra. In recent years, topics have included number theory, commutative algebra, noncommutative rings, homological algebra, and Lie groups. May be taken for credit six times with consent of adviser as topics vary. ",MATH 200C,,,,,,,,,Students who have not completed MATH 200C may enroll with consent of instructor.
MATH 208,Seminar in Algebraic Geometry,1,Various topics in algebraic geometry. May be taken for credit nine times. ,,,,,,,,,,Graduate standing. Nongraduate students may enroll with consent of instructor. (S/U grade only.)
MATH 209,Seminar in Number Theory,1,Various topics in number theory. ,,,,,,,,,,Graduate standing or consent of instructor. (S/U grade only.)
MATH 210A,Mathematical Methods in Physics and Engineering,4,"Complex variables with applications. Analytic functions, Cauchy’s theorem, Taylor and Laurent series, residue theorem and contour integration techniques, analytic continuation, argument principle, conformal mapping, potential theory, asymptotic expansions, method of steepest descent. ","MATH 20D-E-F, 140A/142A, or consent of instructor",,,,,,,,,
MATH 210B,Mathematical Methods in Physics and Engineering,4,"Linear algebra and functional analysis. Vector spaces, orthonormal bases, linear operators and matrices, eigenvalues and diagonalization, least squares approximation, infinite-dimensional spaces, completeness, integral equations, spectral theory, Green’s functions, distributions, Fourier transform. ",MATH 210A or consent of instructor,,,,,,,,,
MATH 210C,Mathematical Methods in Physics and Engineering,4,"Calculus of variations: Euler-Lagrange equations, Noether’s theorem. Fourier analysis of functions and distributions in several variables. Partial differential equations: Laplace, wave, and heat equations; fundamental solutions (Green’s functions); well-posed problems. ",MATH 210B or consent of instructor,,,,,,,,,(S)
MATH 211A,Seminar in Algebra,1,Various topics in algebra. ,,,,,,,,,,Graduate standing. Nongraduate students may enroll with consent of instructor. May be taken for credit nine times. (S/U grades only.)
MATH 211B,Seminar in Group Actions,1,Various topics in group actions. ,,,,,,,,,,Graduate standing. Nongraduate students may enroll with consent of instructor. May be taken for credit nine times. (S/U grades only.)
MATH 212A,Introduction to Mathematical Biology I,4,"Part one of a two-course introduction to the use of mathematical theory and techniques in analyzing biological problems. Topics include differential equations, dynamical systems, and probability theory applied to a selection of biological problems from population dynamics, biochemical reactions, biological oscillators, gene regulation, molecular interactions, and cellular function. May be coscheduled with MATH 112A. Recommended preparation: Probability Theory and Differential Equations.",,,,,,,,,,Graduate standing.
MATH 212B,Introduction to Mathematical Biology II,4,"Part two of a two-course introduction to the use of mathematical theory and techniques in analyzing biological problems. Topics include partial differential equations and stochastic processes applied to a selection of biological problems, especially those involving spatial movement such as molecular diffusion, bacterial chemotaxis, tumor growth, and biological patterns. May be coscheduled with MATH 112B. Recommended preparation: Probability Theory and Stochastic Processes.",MATH 212A,,,,,,,,,Graduate standing.
MATH 214,Introduction to Computational Stochastics,4,"Topics include random number generators, variance reduction, Monte Carlo (including Markov Chain Monte Carlo) simulation, and numerical methods for stochastic differential equations. Methods will be illustrated on applications in biology, physics, and finance. May be coscheduled with MATH 114. Recommended preparation: Probability Theory and basic computer programming.",,,,,,,,,,Graduate standing.
MATH 216A,Mathematical Methods in Data Science I,4,"This is the first course in a three-course sequence in mathematical methods in data science, and will serve as an introduction to the rest of the sequence. Topics include principal component analysis and the singular value decomposition, sparse representation, dictionary learning, the Johnson Lindenstrauss Lemma and its applications, compressed sensing, kernel methods, nearest neighbor searches, and spectral and subspace clustering. Some scientific programming experience is recommended. ",,,,,,,,,,Graduate standing.
MATH 216B,Mathematical Methods in Data Science II,4,"This is the second course in a three-course sequence in mathematical methods in data science. Topics include analysis on graphs, random walks and diffusion geometry for uniform and non-uniform sampling, eigenvector perturbation, multi-scale analysis of data, concentration of measure phenomenon, binary embeddings, quantization, topic modeling, and geometric machine learning, as well as scientific applications. Some scientific programming experience is recommended. ",MATH 216A,,,,,,,,,Students who have not completed MATH 216A may enroll with consent of instructor.
MATH 216C,Mathematical Methods in Data Science III,4,"This is the third course in the sequence for mathematical methods in data science. Topics include non-linear signal processing, compressed sensing and its extensions, phase retrieval, blind deconvolution, neural networks, non-convex optimization, and optimal transport distances. Some scientific programming experience is recommended. ",MATH 216B,,,,,,,,,Students who have not completed MATH 216B may enroll with consent of instructor.
MATH 217,Topics in Applied Mathematics,4,"In recent years, topics have included applied complex analysis, special functions, and asymptotic methods. May be repeated for credit with consent of adviser as topics vary. ",,,,,,,,,,Graduate standing. Nongraduate students may enroll with consent of instructor.
MATH 218,Seminar in Mathematics of Biological Systems,1,Various topics in the mathematics of biological systems. May be taken for credit nine times. ,,,,,,,,,,Graduate standing. (S/U grades only.)
MATH 220A-B-C,Complex Analysis,4-4-4,"Complex numbers and functions. Cauchy theorem and its applications, calculus of residues, expansions of analytic functions, analytic continuation, conformal mapping and Riemann mapping theorem, harmonic functions. Dirichlet principle, Riemann surfaces. ",MATH 140A-B or consent of instructor,,,,,,,,,
MATH 221A,Topics in Several Complex Variables,4,"Introduction to varied topics in several complex variables. In recent years, topics have included formal and convergent power series, Weierstrass preparation theorem, Cartan-Ruckert theorem, analytic sets, mapping theorems, domains of holomorphy, proper holomorphic mappings, complex manifolds and modifications. May be taken for credit six times with consent of adviser as topics vary. ",MATH 200A,MATH 220C,,,,,,,,Students who have not completed MATH 200A and 220C may enroll with consent of instructor.
MATH 221B,Further Topics in Several Complex Variables,4,"Continued development of a topic in several complex variables. Topics include formal and convergent power series, Weierstrass preparation theorem, Cartan-Ruckert theorem, analytic sets, mapping theorems, domains of holomorphy, proper holomorphic mappings, complex manifolds and modifications. May be taken for credit three times with consent of adviser as topics vary. ",MATH 221A,,,,,,,,,Students who have not completed MATH 221A may enroll with consent of instructor.
MATH 231A,Partial Differential Equations I,4,"First course in graduate partial differential equations. Laplace, heat, and wave equations. Non-linear first order equations, including Hamilton-Jacobi theory. Sobolev spaces and initial/boundary value problems for linear elliptic, parabolic, and hyperbolic equations. Non-linear second order equations, including calculus of variations. ",MATH 210B or 240C,,,,,,,,,Students who have not completed MATH 210B or 240C may enroll with consent of instructor.
MATH 231B,Partial Differential Equations II,4,"Second course in graduate partial differential equations. Laplace, heat, and wave equations. Non-linear first order equations, including Hamilton-Jacobi theory. Sobolev spaces and initial/boundary value problems for linear elliptic, parabolic, and hyperbolic equations. Non-linear second order equations, including calculus of variations. ",MATH 231A,,,,,,,,,Students who have not completed MATH 231A may enroll with consent of instructor.
MATH 231C,Partial Differential Equations III,4,"Third course in graduate partial differential equations. Laplace, heat, and wave equations. Non-linear first order equations, including Hamilton-Jacobi theory. Sobolev spaces and initial/boundary value problems for linear elliptic, parabolic, and hyperbolic equations. Non-linear second order equations, including calculus of variations. ",MATH 231B,,,,,,,,,Students who have not completed MATH 231B may enroll with consent of instructor.
MATH 237A,Topics in Differential Equations,4,"Introduction to varied topics in differential equations. In recent years, topics have included Riemannian geometry, Ricci flow, and geometric evolution. May be taken for credit six times with consent of adviser as topics vary. ",,,,,,,,,,Graduate standing. Nongraduate students may enroll with consent of instructor.
MATH 237B,Further Topics in Differential Equations,4,"Continued development of a topic in differential equations. Topics include Riemannian geometry, Ricci flow, and geometric evolution. May be taken for credit three times with consent of adviser as topics vary. ",MATH 237A,,,,,,,,,Students who have not completed MATH 237A may enroll with consent of instructor.
MATH 240A,Real Analysis I,4,"First course in graduate real analysis. Abstract measure and integration theory, integration on product spaces. Lebesgue measure and integral, Lebesgue-Stieltjes integrals, functions of bounded variation, differentiation of measures. Locally compact Hausdorff spaces, Banach and Hilbert spaces, linear functionals. Lebesgue spaces and interpolation, elements of Fourier analysis and distribution theory. ",,,,,,,,,,"Graduate standing in MA75, MA76, MA77, MA80, MA81. All other students may enroll with consent of instructor."
MATH 240B,Real Analysis II,4,"Second course in graduate real analysis. Abstract measure and integration theory, integration on product spaces. Lebesgue measure and integral, Lebesgue-Stieltjes integrals, functions of bounded variation, differentiation of measures. Locally compact Hausdorff spaces, Banach and Hilbert spaces, linear functionals. Lebesgue spaces and interpolation, elements of Fourier analysis and distribution theory. ",MATH 240A,,,,,,,,,Students who have not completed MATH 240A may enroll with consent of instructor.
MATH 240C,Real Analysis III,4,"Third course in graduate real analysis. Abstract measure and integration theory, integration on product spaces. Lebesgue measure and integral, Lebesgue-Stieltjes integrals, functions of bounded variation, differentiation of measures. Locally compact Hausdorff spaces, Banach and Hilbert spaces, linear functionals. Lebesgue spaces and interpolation, elements of Fourier analysis and distribution theory. ",MATH 240B,,,,,,,,,Students who have not completed MATH 240B may enroll with consent of instructor.
MATH 241A,Functional Analysis I,4,"First course in graduate functional analysis. Locally convex spaces, weak topologies. Convexity and fixed point theorems. Banach algebras and C*-algebras. Operators on Hilbert spaces (bounded, unbounded, compact, normal). Spectral theory of operators, semigroups of operators. Fredholm theory. ",MATH 240C,,,,,,,,,Students who have not completed MATH 240C may enroll with consent of instructor.
MATH 241B,Functional Analysis II,4,"Second course in graduate functional analysis. Locally convex spaces, weak topologies. Convexity and fixed point theorems. Banach algebras and C*-algebras. Operators on Hilbert spaces (bounded, unbounded, compact, normal). Spectral theory of operators, semigroups of operators. Fredholm theory. ",MATH 241A,,,,,,,,,Students who have not completed MATH 241A may enroll with consent of instructor.
MATH 242,Topics in Fourier Analysis,4,"In recent years, topics have included Fourier analysis in Euclidean spaces, groups, and symmetric spaces. May be repeated for credit with consent of adviser as topics vary. ",MATH 240C,,,,,,,,,Students who have not completed MATH 240C may enroll with consent of instructor
MATH 243,Seminar in Functional Analysis,1,Various topics in functional analysis. May be taken for credit nine times. ,,,,,,,,,,Graduate standing or consent of instructor. (S/U grades only.)
MATH 245A,Convex Analysis and Optimization I,4,"Convex sets and functions, convex and affine hulls, relative interior, closure, and continuity, recession and existence of optimal solutions, saddle point and min-max theory, subgradients and subdifferentials. Recommended preparation: course work in linear algebra and real analysis. ",,,,,,,,,,Graduate standing.
MATH 245B,Convex Analysis and Optimization II,4,"Optimality conditions, strong duality and the primal function, conjugate functions, Fenchel duality theorems, dual derivatives and subgradients, subgradient methods, cutting plane methods. ",MATH 245A or consent of instructor,,,,,,,,,
MATH 245C,Convex Analysis and Optimization III,4,"Convex optimization problems, linear matrix inequalities, second-order cone programming, semidefinite programming, sum of squares of polynomials, positive polynomials, distance geometry. ",MATH 245B or consent of instructor,,,,,,,,,
MATH 247A,Topics in Real Analysis,4,"Introduction to varied topics in real analysis. In recent years, topics have included Fourier analysis, distribution theory, martingale theory, operator theory. May be taken for credit six times with consent of adviser. ",,,,,,,,,,Graduate standing. Nongraduate students may enroll with consent of instructor.
MATH 247B,Further Topics in Real Analysis,4,"Continued development of a topic in real analysis. Topics include Fourier analysis, distribution theory, martingale theory, operator theory. May be taken for credit three times with consent of adviser as topics vary. ",MATH 247A,,,,,,,,,Students who have not completed MATH 247A may enroll with consent of instructor.
MATH 248,Seminar in Real Analysis,1,Various topics in real analysis. ,,,,,,,,,,Graduate standing or consent of instructor. (S/U grade only.)
MATH 250A-B-C,Differential Geometry,4-4-4,"Differential manifolds, Sard theorem, tensor bundles, Lie derivatives, DeRham theorem, connections, geodesics, Riemannian metrics, curvature tensor and sectional curvature, completeness, characteristic classes. Differential manifolds immersed in Euclidean space. ",,,,,,,,,,Consent of instructor.
MATH 251A-B-C,Lie Groups,4-4-4,"Lie groups, Lie algebras, exponential map, subgroup subalgebra correspondence, adjoint group, universal enveloping algebra. Structure theory of semisimple Lie groups, global decompositions, Weyl group. Geometry and analysis on symmetric spaces. ",MATH 200,MATH 250 or consent of instructor,,,,,,,,
MATH 256,Seminar in Lie Groups and Lie Algebras,1,"Various topics in Lie groups and Lie algebras, including structure theory, representation theory, and applications. ",,,,,,,,,,Graduate standing or consent of instructor. (S/U grade only.)
MATH 257A,Topics in Differential Geometry,4,"Introduction to varied topics in differential geometry. In recent years, topics have included Morse theory and general relativity. May be taken for credit six times with consent of adviser. ",,,,,,,,,,Graduate standing. Nongraduate students may enroll with consent of instructor.
MATH 257B,Further Topics in Differential Geometry,4,Continued development of a topic in differential geometry. Topics include Morse theory and general relativity. May be taken for credit three times with consent of adviser. ,MATH 257A,,,,,,,,,Students who have not completed MATH 257A may enroll with consent of instructor.
MATH 258,Seminar in Differential Geometry,1,Various topics in differential geometry. May be taken for credit nine times. ,,,,,,,,,,Graduate standing or consent of instructor. (S/U grade only.)
MATH 259A-B-C,Geometrical Physics,4-4-4,"Manifolds, differential forms, homology, deRham’s theorem. Riemannian geometry, harmonic forms. Lie groups and algebras, connections in bundles, homotopy sequence of a bundle, Chern classes. Applications selected from Hamiltonian and continuum mechanics, electromagnetism, thermodynamics, special and general relativity, Yang-Mills fields. ",,,,,,,,,,"Graduate standing in mathematics, physics, or engineering, or consent of instructor."
MATH 260A,Mathematical Logic I,4,"Propositional calculus and first-order logic. Theorem proving, Model theory, soundness, completeness, and compactness, Herbrand’s theorem, Skolem-Lowenheim theorems, Craig interpolation. ",,,,,,,,,,Graduate standing or consent of instructor.
MATH 260B,Mathematical Logic II,4,"Theory of computation and recursive function theory, Church’s thesis, computability and undecidability. Feasible computability and complexity. Peano arithmetic and the incompleteness theorems, nonstandard models. ",MATH 260A or consent of instructor,,,,,,,,,
MATH 261A,Probabilistic Combinatorics and Algorithms,4,"Introduction to the probabilistic method. Combinatorial applications of the linearity of expectation, second moment method, Markov, Chebyschev, and Azuma inequalities, and the local limit lemma. Introduction to the theory of random graphs. ",,,,,,,,,,Graduate standing or consent of instructor.
MATH 261B,Probabilistic Combinatorics and Algorithms II,4,"Introduction to probabilistic algorithms. Game theoretic techniques. Applications of the probabilistic method to algorithm analysis. Markov Chains and Random walks. Applications to approximation algorithms, distributed algorithms, online and parallel algorithms. MATH 261A must be taken before MATH 261B.",MATH 261A,,,,,,,,,
MATH 261C,Probabilistic Combinatorics and Algorithms III,4,Advanced topics in the probabilistic combinatorics and probabilistic algorithms. Random graphs. Spectral Methods. Network algorithms and optimization. Statistical learning. MATH 261B must be taken before MATH 261C.,MATH 261B,,,,,,,,,
MATH 262A,Topics in Combinatorial Mathematics,4,"Introduction to varied topics in combinatorial mathematics. In recent years topics have included problems of enumeration, existence, construction, and optimization with regard to finite sets. Recommended preparation: some familiarity with computer programming desirable but not required. May be taken for credit six times with consent of adviser as topics vary. ",,,,,,,,,,Graduate standing. Nongraduate students may enroll with consent of instructor.
MATH 262B,Further Topics in Combinatorial Mathematics,4,"Continued development of a topic in combinatorial mathematics. Topics include problems of enumeration, existence, construction, and optimization with regard to finite sets. Recommended preparation: some familiarity with computer programming desirable but not required. May be taken for credit three times with consent of adviser as topics vary. ",MATH 262A,,,,,,,,,Students who have not completed MATH 262A may enroll with consent of instructor.
MATH 264A-B-C,Combinatorics,4-4-4,"Topics from partially ordered sets, Mobius functions, simplicial complexes and shell ability. Enumeration, formal power series and formal languages, generating functions, partitions. Lagrange inversion, exponential structures, combinatorial species. Finite operator methods, q-analogues, Polya theory, Ramsey theory. Representation theory of the symmetric group, symmetric functions and operations with Schur functions.",,,,,,,,,,
MATH 267A,Topics in Mathematical Logic,4,"Introduction to varied topics in mathematical logic. Topics chosen from recursion theory, model theory, and set theory. May be taken for credit six times with consent of adviser as topics vary. ",,,,,,,,,,Graduate standing or consent of instructor. Nongraduate students may enroll with consent of instructor.
