course_code,name,units,desc,prereq1,prereq2,prereq3,prereq4,prereq5,prereq6,prereq7,prereq8,prereq9,misc_prereq
MATH 2,Introduction to College Mathematics,4,A highly adaptive course designed to build on students’ strengths while increasing overall mathematical understanding and skill. This multimodality course will focus on several topics of study designed to develop conceptual understanding and mathematical relevance: linear relationships; exponents and polynomials; rational expressions and equations; models of quadratic and polynomial functions and radical equations; exponential and logarithmic functions; and geometry and trigonometry. Workload credit only—not for baccalaureate credit. ,,,,,,,,,,Math Placement Exam qualifying score.
MATH 3B,Foundations of Precalculus,4,Introduction to functions and their properties. Polynomial and rational functions. Exponential and logarithmic functions. Trigonometric functions and their properties. ,MATH 2,,,,,,,,,Math Placement Exam qualifying score.
MATH 3C,Precalculus,4,"Functions and their graphs. Linear and polynomial functions, zeroes, inverse functions, exponential and logarithmic, trigonometric functions and their inverses. Emphasis on understanding algebraic, numerical, and graphical. (No credit given if taken after MATH 4C, 1A/10A, or 2A/20A.) Three or more years of high school mathematics or equivalent recommended.",MATH 3B,,,,,,,,,Math Placement Exam qualifying score.
MATH 4C,Precalculus for Science and Engineering,4,"Review of polynomials. Graphing functions and relations: graphing rational functions, effects of linear changes of coordinates. Circular functions and right triangle trigonometry. Reinforcement of function concept: exponential, logarithmic, and trigonometric functions. Vectors. Conic sections. Polar coordinates. (No credit given if taken after MATH 1A/10A or 2A/20A. Two units of credit given if taken after MATH 3C.) Three or more years of high school mathematics or equivalent recommended.",MATH 3C,,,,,,,,,"Math Placement Exam qualifying score or ACT Math score of 25 or higher, or AP Calculus AB score (or subscore) of 2."
MATH 10A,Calculus I,4,"Differential calculus of functions of one variable, with applications. Functions, graphs, continuity, limits, derivatives, tangent lines, optimization problems. (No credit given if taken after or concurrent with MATH 20A.)",MATH 3C or 4C,,,,,,,,,"Math Placement Exam qualifying score, or AP Calculus AB score of 2, or SAT II Math Level 2 score of 600 or higher."
MATH 10B,Calculus II,4,"Integral calculus of functions of one variable, with applications. Antiderivatives, definite integrals, the Fundamental Theorem of Calculus, methods of integration, areas and volumes, separable differential equations. (No credit given if taken after or concurrent with MATH 20B.)","MATH 10A, or MATH 20A",,,,,,,,,"AP Calculus AB score of 3, 4, or 5 (or equivalent AB subscore on BC exam)"
MATH 10C,Calculus III,4,"Introduction to functions of more than one variable. Vector geometry, partial derivatives, velocity and acceleration vectors, optimization problems. (No credit given if taken after or concurrent with 20C.)","MATH 10B, or MATH 20B",,,,,,,,,"AP Calculus BC score of 3, 4, or 5"
MATH 11,Calculus-Based Introductory Probability and Statistics,5,"Events and probabilities, conditional probability, Bayes’ formula. Discrete and continuous random variables: mean, variance; binomial, Poisson distributions, normal, uniform, exponential distributions, central limit theorem. Sample statistics, confidence intervals, hypothesis testing, regression. Applications. Introduction to software for probabilistic and statistical analysis. Emphasis on connections between probability and statistics, numerical results of real data, and techniques of data analysis. ",MATH 10B or MATH 20B,,,,,,,,,"AP Calculus BC score of 3, 4, or 5"
MATH 15A,Introduction to Discrete Mathematics,4,"Basic discrete mathematical structure: sets, relations, functions, sequences, equivalence relations, partial orders, and number systems. Methods of reasoning and proofs: propositional logic, predicate logic, induction, recursion, and pigeonhole principle. Infinite sets and diagonalization. Basic counting techniques; permutation and combinations. Applications will be given to digital logic design, elementary number theory, design of programs, and proofs of program correctness. Students who have completed MATH 109 may not receive credit for MATH 15A. Credit not offered for both MATH 15A and CSE 20. Equivalent to CSE 20.",CSE 8B or CSE 11,,,,,,,,,Prerequisite courses must be completed with a grade of C– or better.
MATH 18,Linear Algebra,4,"Matrix algebra, Gaussian elimination, determinants. Linear and affine subspaces, bases of Euclidean spaces. Eigenvalues and eigenvectors, quadratic forms, orthogonal matrices, diagonalization of symmetric matrices. Applications. Computing symbolic and graphical solutions using MATLAB. Students may not receive credit for both MATH 18 and 31AH.",MATH 4C or 10A or 20A,,,,,,,,,"Math Placement Exam qualifying score, or AP Calculus AB score of 3 (or equivalent AB subscore on BC exam), or SAT II Math Level 2 score of 650 or higher. Students who have not completed listed prerequisites may enroll with consent of instructor."
MATH 20A,Calculus for Science and Engineering,4,"Foundations of differential and integral calculus of one variable. Functions, graphs, continuity, limits, derivative, tangent line. Applications with algebraic, exponential, logarithmic, and trigonometric functions. Introduction to the integral. (Two credits given if taken after MATH 1A/10A and no credit given if taken after MATH 1B/10B or MATH 1C/10C. Formerly numbered MATH 2A.)",MATH 4C or 10A,,,,,,,,,"Math Placement Exam qualifying score, or AP Calculus AB score of 3 (or equivalent AB subscore on BC exam), or SAT II MATH 2C score of 650 or higher."
MATH 20B,Calculus for Science and Engineering,4,"Integral calculus of one variable and its applications, with exponential, logarithmic, hyperbolic, and trigonometric functions. Methods of integration. Infinite series. Polar coordinates in the plane and complex exponentials. (Two units of credits given if taken after MATH 1B/10B or MATH 1C/10C.)",MATH 20A  or MATH 10B or MATH 10C,,,,,,,,,"AP Calculus AB score of 4 or 5, or AP Calculus BC score of 3. Prerequisite courses must be completed with a grade of C– or better."
MATH 20C,Calculus and Analytic Geometry for Science and Engineering,4,"Vector geometry, vector functions and their derivatives. Partial differentiation. Maxima and minima. Double integration. (Two units of credit given if taken after MATH 10C. Credit not offered for both MATH 20C and 31BH. Formerly numbered MATH 21C.)",MATH 20B,,,,,,,,,"AP Calculus BC score of 4 or 5, or C- or better."
MATH 20D,Introduction to Differential Equations,4,"Ordinary differential equations: exact, separable, and linear; constant coefficients, undetermined coefficients, variations of parameters. Systems. Series solutions. Laplace transforms. Techniques for engineering sciences. Computing symbolic and graphical solutions using MATLAB. (Formerly numbered MATH 21D.) May be taken as repeat credit for MATH 21D.",MATH 20C or MATH 31BH,,,,,,,,,Complete with C- or better.
MATH 20E,Vector Calculus,4,"Change of variable in multiple integrals, Jacobian, Line integrals, Green’s theorem. Vector fields, gradient fields, divergence, curl. Spherical/cylindrical coordinates. Taylor series in several variables. Surface integrals, Stoke’s theorem. Gauss’ theorem. Conservative fields. ",MATH 18 or MATH 20F or MATH 31AH,MATH 20C or MATH 31BH,,,,,,,,Complete with C- or better.
MATH 31AH,Honors Linear Algebra,4,"First quarter of three-quarter honors integrated linear algebra/multivariable calculus sequence for well-prepared students. Topics include real/complex number systems, vector spaces, linear transformations, bases and dimension, change of basis, eigenvalues, eigenvectors, diagonalization. (Credit not offered for both MATH 31AH and 20F.)",,,,,,,,,,AP Calculus BC score of 5 or consent of instructor
MATH 31BH,Honors Multivariable Calculus,4,"Second quarter of three-quarter honors integrated linear algebra/multivariable calculus sequence for well-prepared students. Topics include derivative in several variables, Jacobian matrices, extrema and constrained extrema, integration in several variables. (Credit not offered for both MATH 31BH and 20C.)",MATH 31AH or consent of instructor,,,,,,,,,Complete with B- or better.
MATH 31CH,Honors Vector Calculus,4,"Third quarter of honors integrated linear algebra/multivariable calculus sequence for well-prepared students. Topics include change of variables formula, integration of differential forms, exterior derivative, generalized Stoke’s theorem, conservative vector fields, potentials. ",MATH 31BH or consent of instructor,,,,,,,,,Complete with B- or better.
MATH 87,First-year Student Seminar,1,"The First-year Student Seminar Program is designed to provide new students with the opportunity to explore an intellectual topic with a faculty member in a small seminar setting. First-year student seminars are offered in all campus departments and undergraduate colleges, and topics vary from quarter to quarter. Enrollment is limited to fifteen to twenty students, with preference given to entering first-year students. ",,,,,,,,,,
MATH 95,Introduction to Teaching Math,2,(Cross-listed with EDS 30.) Revisit students’ learning difficulties in mathematics in more depth to prepare students to make meaningful observations of how K–12 teachers deal with these difficulties. Explore how instruction can use students’ knowledge to pose problems that stimulate students’ intellectual curiosity.,,,,,,,,,,
MATH 96,Putnam Seminar,1,"Students will develop skills in analytical thinking as they solve and present solutions to challenging mathematical problems in preparation for the William Lowell Putnam Mathematics Competition, a national undergraduate mathematics examination held each year. Students must sit for at least one half of the Putnam exam (given the first Saturday in December) to receive a passing grade. P/NP grades only. May be taken for credit up to four times. ",MATH 20A,,,,,,,,,"AP Calculus AB score of 4 or more, or AP Calculus BC score of 3 or more."
MATH 99R,Independent Study,1,Independent study or research under direction of a member of the faculty. ,,,,,,,,,,Must be of first-year standing and a Regent’s Scholar.
MATH 100A,Abstract Algebra I,4,"First course in a rigorous three-quarter introduction to the methods and basic structures of higher algebra. Topics include groups, subgroups and factor groups, homomorphisms, rings, fields. (Students may not receive credit for both MATH 100A and MATH 103A.)",MATH 31CH or MATH 109 or consent of instructor,,,,,,,,,
MATH 100B,Abstract Algebra II,4,"Second course in a rigorous three-quarter introduction to the methods and basic structures of higher algebra. Topics include rings (especially polynomial rings) and ideals, unique factorization, fields; linear algebra from perspective of linear transformations on vector spaces, including inner product spaces, determinants, diagonalization. (Students may not receive credit for both MATH 100B and MATH 103B.)",MATH 100A or consent of instructor,,,,,,,,,
MATH 100C,Abstract Algebra III,4,"Third course in a rigorous three-quarter introduction to the methods and basic structures of higher algebra. Topics include linear transformations, including Jordan canonical form and rational canonical form; Galois theory, including the insolvability of the quintic. ",MATH 100B or consent of instructor,,,,,,,,,
MATH 102,Applied Linear Algebra,4,"Second course in linear algebra from a computational yet geometric point of view. Elementary Hermitian matrices, Schur’s theorem, normal matrices, and quadratic forms. Moore-Penrose generalized inverse and least square problems. Vector and matrix norms. Characteristic and singular values. Canonical forms. Determinants and multilinear algebra. ",MATH 18 or MATH 20F or MATH 31AH,MATH 20C,,,,,,,,Students who have not completed listed prerequisites may enroll with consent of instructor.
MATH 103A,Modern Algebra I,4,"First course in a two-quarter introduction to abstract algebra with some applications. Emphasis on group theory. Topics include definitions and basic properties of groups, properties of isomorphisms, subgroups. (Students may not receive credit for both MATH 100A and MATH 103A.)",MATH 31CH or MATH 109 or consent of instructor,,,,,,,,,
MATH 103B,Modern Algebra II,4,"Second course in a two-quarter introduction to abstract algebra with some applications. Emphasis on rings and fields. Topics include definitions and basic properties of rings, fields, and ideals, homomorphisms, irreducibility of polynomials. (Students may not receive credit for both MATH 100B and MATH 103B.)",MATH 103A or MATH 100A or consent of instructor,,,,,,,,,
MATH 104A,Number Theory I,4,"Elementary number theory with applications. Topics include unique factorization, irrational numbers, residue systems, congruences, primitive roots, reciprocity laws, quadratic forms, arithmetic functions, partitions, Diophantine equations, distribution of primes. Applications include fast Fourier transform, signal processing, codes, cryptography. ",MATH 100B or MATH 103B,,,,,,,,,Students who have not completed the listed prerequisite(s) may enroll with consent of instructor.
MATH 104B,Number Theory II,4,"Topics in number theory such as finite fields, continued fractions, Diophantine equations, character sums, zeta and theta functions, prime number theorem, algebraic integers, quadratic and cyclotomic fields, prime ideal theory, class number, quadratic forms, units, Diophantine approximation, p-adic numbers, elliptic curves. ",MATH 104A or consent of instructor,,,,,,,,,
MATH 105,Basic Number Theory,4,"The course will cover the basic arithmetic properties of the integers, with applications to Diophantine equations and elementary Diophantine approximation theory. ",MATH 31CH or MATH 109,,,,,,,,,Students who have not completed the listed prerequisites may enroll with consent of instructor.
MATH 106,Introduction to Algebraic Geometry,4,"Plane curves, Bezout’s theorem, singularities of plane curves. Affine and projective spaces, affine and projective varieties. Examples of all the above. Instructor may choose to include some commutative algebra or some computational examples. ",MATH 100B or MATH 103B,,,,,,,,,Students who have not completed the listed prerequisites may enroll with consent of instructor.
MATH 109,Mathematical Reasoning,4,"This course uses a variety of topics in mathematics to introduce the students to rigorous mathematical proof, emphasizing quantifiers, induction, negation, proof by contradiction, naive set theory, equivalence relations and epsilon-delta proofs. Required of all departmental majors. ","MATH 18 or MATH 20F or MATH 31AH,",MATH 20C,,,,,,,,Students who have not completed listed prerequisites may enroll with consent of instructor.
MATH 110,Introduction to Partial Differential Equations,4,"An introduction to partial differential equations focusing on equations in two variables. Topics include the heat and wave equation on an interval, Laplace’s equation on rectangular and circular domains, separation of variables, boundary conditions and eigenfunctions, introduction to Fourier series, software methods for solving equations. Formerly MATH 110A. (Students may not receive credit for MATH 110 and MATH 110A.)",MATH 18 or MATH 20F or MATH 31AH,MATH 20D,MATH 20E or MATH 31CH,,,,,,,Students who have not completed listed prerequisites may enroll with consent of instructor.
MATH 111A,Mathematical Modeling I,4,"An introduction to mathematical modeling in the physical and social sciences. Topics vary, but have included mathematical models for epidemics, chemical reactions, political organizations, magnets, economic mobility, and geographical distributions of species. May be taken for credit two times when topics change. ","MATH 20D, MATH 18 or MATH 20F or MATH 31AH,",MATH 109 or MATH 31CH,,,,,,,,Students who have not completed listed prerequisites may enroll with consent of instructor.
MATH 111B,Mathematical Modeling II,4,"Continued study on mathematical modeling in the physical and social sciences, using advanced techniques that will expand upon the topics selected and further the mathematical theory presented in MATH 111A.",MATH 111A or consent of instructor,,,,,,,,,
MATH 112A,Introduction to Mathematical Biology I,4,"Part one of a two-course introduction to the use of mathematical theory and techniques in analyzing biological problems. Topics include differential equations, dynamical systems, and probability theory applied to a selection of biological problems from population dynamics, biochemical reactions, biological oscillators, gene regulation, molecular interactions, and cellular function. May be coscheduled with MATH 212A. Recommended preparation: MATH 130 and MATH 180A.","MATH 11 or MATH 180A or MATH 183 or MATH 186,","MATH 18 or MATH 31AH,","MATH 20D,",BILD 1,,,,,,Students who have not completed listed prerequisites may enroll with consent of instructor.
MATH 112B,Introduction to Mathematical Biology II,4,"Part two of an introduction to the use of mathematical theory and techniques in analyzing biological problems. Topics include partial differential equations and stochastic processes applied to a selection of biological problems, especially those involving spatial movement, such as molecular diffusion, bacterial chemotaxis, tumor growth, and biological patterns. May be coscheduled with MATH 212B. Recommended preparation: MATH 180B.",MATH 112A,MATH 110,MATH 180A,,,,,,,Students who have not completed listed prerequisites may enroll with consent of instructor.
MATH 114,Introduction to Computational Stochastics,4,"Topics include random number generators, variance reduction, Monte Carlo (including Markov Chain Monte Carlo) simulation, and numerical methods for stochastic differential equations. Methods will be illustrated on applications in biology, physics, and finance. May be coscheduled with MATH 214. Recommended preparation: CSE 5A, CSE 8A, CSE 11, or ECE 15. Students should complete a computer programming course before enrolling in MATH 114.",MATH 180A,,,,,,,,,Students who have not completed listed prerequisites may enroll with consent of instructor.
MATH 120A,Elements of Complex Analysis,4,"Complex numbers and functions. Analytic functions, harmonic functions, elementary conformal mappings. Complex integration. Power series. Cauchy’s theorem. Cauchy’s formula. Residue theorem. ","MATH 20E or MATH 31CH, or consent of instructor",,,,,,,,,
MATH 120B,Applied Complex Analysis,4,"Applications of the residue theorem. Conformal mapping and applications to potential theory, flows, and temperature distributions. Fourier transformations. Laplace transformations, and applications to integral and differential equations. Selected topics such as Poisson’s formula, Dirichlet’s problem, Neumann’s problem, or special functions. ",MATH 120A or consent of instructor,,,,,,,,,
MATH 121A,Foundations of Teaching and Learning Mathematics I,4,"(Cross-listed with EDS 121A.) Develop teachers’ knowledge base (knowledge of mathematics content, pedagogy, and student learning) in the context of advanced mathematics. This course builds on the previous courses where these components of knowledge were addressed exclusively in the context of high-school mathematics.","EDS 30/MATH 95, MATH 10C or 20C",,,,,,,,,
MATH 121B,Foundations of Teaching and Learning Math II,4,(Cross-listed with EDS 121B.) Examine how learning theories can consolidate observations about conceptual development with the individual student as well as the development of knowledge in the history of mathematics. Examine how teaching theories explain the effect of teaching approaches addressed in the previous courses.,EDS 121A/MATH 121A,,,,,,,,,
MATH 130,Differential Equations and Dynamical Systems,4,"An introduction to ordinary differential equations from the dynamical systems perspective. Topics include flows on lines and circles, two-dimensional linear systems and phase portraits, nonlinear planar systems, index theory, limit cycles, bifurcation theory, applications to biology, physics, and electrical engineering. Formerly MATH 130A. (Students may not receive credit for MATH 130 and MATH 130A.)",MATH 18 or MATH 20F or MATH 31AH,MATH 20D,,,,,,,,Students who have not completed listed prerequisites may enroll with consent of instructor.
MATH 140A,Foundations of Real Analysis I,4,"First course in a rigorous three-quarter sequence on real analysis. Topics include the real number system, basic topology, numerical sequences and series, continuity. (Students may not receive credit for both MATH 140A and MATH 142A.)",MATH 31CH or MATH 109,,,,,,,,,Students who have not completed listed prerequisites may enroll with consent of instructor.
MATH 140B,Foundations of Real Analysis II,4,"Second course in a rigorous three-quarter sequence on real analysis. Topics include differentiation, the Riemann-Stieltjes integral, sequences and series of functions, power series, Fourier series, and special functions. (Students may not receive credit for both MATH 140B and MATH 142B.)",MATH 140A or consent of instructor,,,,,,,,,
MATH 140C,Foundations of Real Analysis III,4,"Third course in a rigorous three-quarter sequence on real analysis. Topics include differentiation of functions of several real variables, the implicit and inverse function theorems, the Lebesgue integral, infinite-dimensional normed spaces. ",MATH 140B or consent of instructor,,,,,,,,,
MATH 142A,Introduction to Analysis I,4,"First course in an introductory two-quarter sequence on analysis. Topics include the real number system, numerical sequences and series, infinite limits, limits of functions, continuity, differentiation. Students may not receive credit for MATH 142A if taken after or concurrently with MATH 140A.",MATH 31CH or MATH 109,,,,,,,,,Students who have not completed listed prerequisites may enroll with consent of instructor.
MATH 142B,Introduction to Analysis II,4,"Second course in an introductory two-quarter sequence on analysis. Topics include the Riemann integral, sequences and series of functions, uniform convergence, Taylor series, introduction to analysis in several variables. Students may not receive credit for MATH 142B if taken after or concurrently with MATH 140B.",MATH 142A or MATH 140A,,,,,,,,,Students who have not completed listed prerequisites may enroll with consent of instructor.
MATH 144,Introduction to Fourier Analysis,4,"Rigorous introduction to the theory of Fourier series and Fourier transforms. Topics include basic properties of Fourier series, mean square and pointwise convergence, Hilbert spaces, applications of Fourier series, the Fourier transform on the real line, inversion formula, Plancherel formula, Poisson summation formula, Heisenberg uncertainty principle, applications of the Fourier transform. ",MATH 140B or MATH 142B,,,,,,,,,Students who have not completed listed prerequisite(s) may enroll with the consent of instructor.
MATH 146,Analysis of Ordinary Differential Equations,4,"A rigorous introduction to systems of ordinary differential equations. Topics include linear systems, matrix diagonalization and canonical forms, matrix exponentials, nonlinear systems, existence and uniqueness of solutions, linearization, and stability. ",MATH 140B or MATH 142B,,,,,,,,,Students who have not completed listed prerequisite(s) may enroll with the consent of instructor.
MATH 148,Analysis of Partial Differential Equations,4,"A rigorous introduction to partial differential equations. Topics include initial and boundary value problems; first order linear and quasilinear equations, method of characteristics; wave and heat equations on the line, half-line, and in space; separation of variables for heat and wave equations on an interval and for Laplace’s equation on rectangles and discs; eigenfunctions of the Laplacian and heat, wave, Poisson’s equations on bounded domains; and Green’s functions and distributions. ",MATH 140B or MATH 142B,,,,,,,,,Students who have not completed listed prerequisite(s) may enroll with the consent of instructor.
MATH 150A,Differential Geometry,4,"Differential geometry of curves and surfaces. Gauss and mean curvatures, geodesics, parallel displacement, Gauss-Bonnet theorem. ",MATH 20E or MATH 31CH,either MATH 18 or MATH 20F or MATH 31AH,,,,,,,,Students who have not completed listed prerequisites may enroll with consent of instructor.
MATH 150B,Calculus on Manifolds,4,"Calculus of functions of several variables, inverse function theorem. Further topics may include exterior differential forms, Stokes’ theorem, manifolds, Sard’s theorem, elements of differential topology, singularities of maps, catastrophes, further topics in differential geometry, topics in geometry of physics. ",MATH 150A or consent of instructor,,,,,,,,,
MATH 152,Applicable Mathematics and Computing,4,"This course will give students experience in applying theory to real world applications such as internet and wireless communication problems. The course will incorporate talks by experts from industry and students will be helped to carry out independent projects. Topics include graph visualization, labelling, and embeddings, random graphs and randomized algorithms. May be taken for credit three times. ",MATH 20D,either MATH 18 or MATH 20F or MATH 31AH,,,,,,,,Students who have not completed listed prerequisites may enroll with consent of instructor.
