course_code,name,units,desc,prereq1,prereq2,prereq3,prereq4,prereq5,prereq6,prereq7,prereq8,prereq9,misc_prereq
WARR 1,First Year Experience,2,"This course facilitates academic success at a leading research university by helping students understand and embrace academic and curricular expectations, engage and map cocurricular opportunities, and strengthen critical thinking and organizational, interpersonal, and wellness skills. P/NP grades only. ",,,,,,,,,,Open to Warren NFRS students only.
WARR 2,Transfer Year Experience,2,"This course facilitates academic success at a leading research university by helping students understand and embrace academic and curricular expectations, engage and map cocurricular opportunities, and strengthen critical thinking and organizational, interpersonal, and wellness skills. P/NP grades only. ",,,,,,,,,,Open to Warren College transfer students only.
WCWP 10A,The Writing Course A,4,A seminar-style course in reading and writing required of all Warren College students. The course emphasizes argumentation and critical writing based on sources. Letter grades only. ,,,,,,,,,,Satisfaction of the UC Entry Level Writing Requirement and must be a Warren College student.
WCWP 10B,The Writing Course B,4,A seminar-style course in reading and writing required of all Warren College students who have completed WCWP 10A. The course continues the emphasis on argumentation and critical writing based on sources. Letter grades only. ,,,,,,,,,,Satisfaction of WCWP 10A and must be a Warren College student.
WCWP 100,Academic Writing,4,"An upper-division workshop course in argumentation and research with particular attention to analyzing and constructing academic arguments. A course specially designed for and required of transfer students who enter Warren College through the TAG, IGETC, or another articulation agreement. The course must be taken for a letter grade to fulfill this requirement. Letter grades only. ",,,,,,,,,,Junior/senior standing and must be a Warren College student.
WCWP 160,Technical Writing for Scientists and Engineers,4,"An upper-division workshop-style writing course focused on the principles and practices of scientific and technical writing and communication. Emphasis on the analysis, evaluation, design, and production of technical writing projects in science and engineering courses and context. Open to students from all colleges. ",,,,,,,,,,Junior/senior standing.
WARR 189,Academic Mentoring and the Writing Process,2,Students will gain a fundamental understanding of all stages of the writing process and will develop the necessary skills to serve as productive mentors for their peers. P/NP grades only. May be taken for credit three times. ,,,,,,,,,,Permission of instructor is required to enroll.
WCWP 198,Group Study,2,"A directed group study involving research and analysis of activities and services in writing, public and civic writing, publishing, and other areas that are not covered by the present curriculum. The course involves reading, writing, and discussion by a small group of students under supervision of a faculty member.",,,,,,,,,,
WCWP 500,Apprentice Teaching in WCWP,2 or 4,"Consideration of pedagogical methods appropriate to undergraduate teaching in Warren College Writing courses, under the supervision of the program director. (S/U grade only.) ",,,,,,,,,,Graduate standing.
