course_code,name,units,desc,prereq1,prereq2,prereq3,prereq4,prereq5,prereq6,prereq7,prereq8,prereq9,misc_prereq
CSE 3,Fluency in Information Technology,4,Introduces the concepts and skills necessary to effectively use information technology. Includes basic concepts and some practical skills with computer and networks. ,,,,,,,,,,
CSE 4GS,Mathematical Beauty in Rome,4,"Exploration of topics in mathematics and engineering as they relate to classical architecture in Rome, Italy. In depth geometrical analysis and computer modeling of basic structures (arches, vaults, domes), and on-site studies of the Colosseum, Pantheon, Roman Forum, and St. Peter’s Basilica. ",MATH 10A or MATH 20A,,,,,,,,,"Department approval, and corequisite of CSE 6GS."
CSE 6GS,Mathematical Beauty in Rome Lab,4,"Companion course to CSE 4GS where theory is applied and lab experiments are carried out “in the field” in Rome, Italy. For final projects, students will select a complex structure (e.g., the Colosseum, the Pantheon, St. Peter’s, etc.) to analyze and model, in detail, using computer-based tools. ",MATH 10A or MATH 20A,,,,,,,,,"Department approval, and corequisite of CSE 4GS."
CSE 6R,Introduction to Computer Science and Object-Oriented Programming: Python,4,"An introduction to computer science and programming using the Python language. The course will cover topics such as basic data types (e.g., integer, float, string), loops and iteration, basic data structures (e.g., list, set, dictionary), memory models, conditional statements, recursion, basic algorithm time complexity analysis, class design, and inheritance.",,,,,,,,,,
CSE 8A,Introduction to Programming and Computational Problem-Solving I,4,"Introductory course for students interested in computer science and programming. Basics of programming including variables, conditionals, loops, functions/methods. Structured data storage such as arrays/lists and dictionaries, including data mutation. Hands-on experience with designing, writing, hand-tracing, compiling or interpreting, executing, testing, and debugging programs. Students solve relevant computational problems using a high-level programming language. CSE 8A is part of a two-course sequence (CSE 8A-B) that is equivalent to CSE 11. Students should take CSE 8B to complete the CSE 8A-B track. Students who have taken CSE 8B or CSE 11 may not take or receive credit for CSE 8A. Students may only receive credit for one of the following: BILD 62, COGS 18, CSE 8A, or CSE 6R. Recommended preparation: No prior programming experience is assumed, but comfort using computers is helpful. Students should consult the “CSE Course Placement Advice” web page for assistance in choosing which CSE course to take first. ",,,,,,,,,,Restricted to undergraduates. Graduate students will be allowed as space permits.
CSE 8B,Introduction to Programming and Computational Problem-Solving II,4,"Introductory programming using an object-oriented approach with the Java programming language. Builds on basic programming constructs introduced in CSE 8A to introduce class design and use, interfaces, basic class hierarchies, recursion, event-based programming, error reporting with exceptions, and file I/O. Basics of command-line navigation for file management and running programs. Development, testing, and debugging of more complex programs. CSE 8B is part of a two-course sequence (CSE 8A-B) that is equivalent to CSE 11. No credit offered for CSE 8B if CSE 11 taken previously. Students may not receive credit for CSE 8B and CSE 11. Students should consult the “CSE Course Placement Advice” web page for assistance in choosing which CSE course to take first ",CSE 8A,,,,,,,,,Restricted to undergraduates. Graduate students will be allowed as space permits.
CSE 11,Introduction to Programming and Computational Problem-Solving: Accelerated Pace,4,"Accelerated introductory programming including an object-oriented approach. Covers basic programming topics from CSE 8A including variables, conditionals, loops, functions/methods, structured data storage, and mutation. Also covers topics from CSE 8B including the Java programming language, class design, interfaces, basic class hierarchies, recursion, event-based programming, and file I/O. Basics of command-line navigation for file management and running programs. Zero units of credit offered for CSE 11 if CSE 8B taken previously or concurrently. Recommended preparation: Significant prior programming experience (for example, high school AP CSA). Students should consult the “CSE Course Placement Advice” web page for assistance in choosing a first CSE course. ",,,,,,,,,,Restricted to undergraduates. Graduate students will be allowed as space permits.
CSE 12,Basic Data Structures and Object-Oriented Design,4,"Use and implementation of basic data structures including linked lists, stacks, and queues. Use of advanced structures such as binary trees and hash tables. Object-oriented design including interfaces, polymorphism, encapsulation, abstract data types, pre-/post-conditions. Recursion. Uses Java and Java Collections. ",CSE 8B or CSE 11,,,,,,,,,Restricted to undergraduates. Graduate students will be allowed as space permits.
CSE 15L,Software Tools and Techniques Laboratory,2,"Hands-on exploration of software development tools and techniques. Investigation of the scientific process as applied to software development and debugging. Emphasis is on weekly hands-on laboratory experiences, development of laboratory notebooking techniques as applied to software design. ",CSE 8B or CSE 11 or CSE 12 or DSC 30,,,,,,,,,Restricted to undergraduates. Graduate students will be allowed as space permits.
CSE 20,Discrete Mathematics,4,"This course will introduce the ways logic is used in computer science: for reasoning, as a language for specifications, and as operations in computation. Concepts include sets, relations, functions, equivalence relations, partial orders, number systems, and proof methods (especially induction and recursion). Propositional and predicate logic will be introduced and applied to various computer science domains such as circuit design, databases, cryptography, and program correctness. Students who have completed MATH 109 may not receive credit for CSE 20. Credit not offered for both MATH 15A and CSE 20. Equivalent to MATH 15A. ",CSE 11 or CSE 6R or CSE 8A or CSE 8B or ECE 15. Prerequisite courses must have been completed with a grade of C– or better,,,,,,,,,Restricted to undergraduates. Graduate students will be allowed as space permits.
CSE 21,Mathematics for Algorithms and Systems,4,"This course will cover mathematical concepts used to model and analyze algorithms and computer systems. Topics include counting techniques (inclusion-exclusion; recursive counting; permutations and combinations), data representations, analysis of algorithms (order notation; time complexities; loop invariants), recurrence relations, graphs and trees (data structure representations; basic graph algorithms; special classes of graphs), and basic probability and its applications. ",CSE 20 or MATH 15A or MATH 31CH,,,,,,,,,Students who have completed MATH 154 or MATH 184 or MATH 188 previously or concurrently may not receive credit for CSE 21; restricted to undergraduates. Graduate students will be allowed as space permits.
CSE 30,Computer Organization and Systems Programming,4,Introduction to organization of modern digital computers—understanding the various components of a computer and their interrelationships. Study of a specific architecture/machine with emphasis on systems programming in C and Assembly languages in a UNIX environment. ,CSE 12,CSE 15L,,,,,,,,Restricted to undergraduates. Graduate students will be allowed as space permits.
CSE 42,Building and Programming Electronic Devices,2,"This course allows students to use what they learned in introductory programming courses to make things happen in the real world. Working in teams, students will first learn to program Arduino-based devices. Teams of students will design a custom device and program it to do their bidding. This course is targeted to first-year students and sophomores in engineering and science disciplines who want to practice applying what they have learned in a programming class and to have the chance to program things other than computers. Program or materials fees may apply. ",,,,,,,,,,Restricted to first-year and sophomore students; instructor approval required.
CSE 86,C++ for Java Programmers,2,"Helps the Java programmer to be productive in the C++ programming environment. Topics include the similarities and differences between Java and C++ with special attention to pointers, operator overloading, templates, the STL, the preprocessor, and the C++ Runtime Environment. ",CSE 12 or consent of instructor,,,,,,,,,
CSE 87,First-year Student Seminar,1,"The First-year Student Seminar Program is designed to provide new students with the opportunity to explore an intellectual topic with a faculty member in a small seminar setting. First-year student seminars are offered in all campus departments and undergraduate colleges, and topics vary from quarter to quarter. Enrollment is limited to fifteen to twenty students, with preference given to entering first-year students. ",,,,,,,,,,
CSE 89,Introduction to Computer Science and Engineering Seminar,2,"A seminar format discussion led by CSE faculty on topics in central areas of computer science, concentrating on the relation among them, recent developments, and future directions. This seminar introduces incoming students to resources and opportunities in the CSE department. May be taken for credit up to three times. Restricted to students in the CSE-PACE program. ",,,,,,,,,,
CSE 90,Undergraduate Seminar,1,A seminar providing an overview of a topic of current research interest to the instructor. The goal is to present a specialized topic in computer science and engineering students. May be taken for credit three times when topics vary. ,,,,,,,,,,
CSE 91,Perspectives in Computer Science and Engineering,2,"A seminar format discussion led by CSE faculty on topics in central areas of computer science, concentrating on the relation among them, recent developments, and future directions. ",,,,,,,,,,Majors only.
CSE 95,Tutor Apprenticeship,2,Students assigned to tutor for a CSE course for the first time receive individual and group mentoring and training on how to be effective tutors to help them develop the skills and tools needed to be effective in their tutor role. Students must have a concurrent tutor appointment in a CSE course. See CSE website for application information.,,,,,,,,,,
CSE 99,Independent Study in Computer Science and Engineering,4,Independent reading or research by special arrangement with a faculty member. ,,,,,,,,,,Lower-division standing. Completion of thirty units at UC San Diego with a UC San Diego GPA of 3.0. Special Studies form required. Department stamp required. Consent of instructor and approval of the department.
CSE 100,Advanced Data Structures,4,"High-performance data structures and supporting algorithms. Use and implementation of data structures like (un)balanced trees, graphs, priority queues, and hash tables. Also, memory management, pointers, recursion. Theoretical and practical performance analysis, both average case and amortized. Uses C++ and STL. Recommended preparation: background in C or C++ programming. ",CSE 21 or MATH 154 or MATH 158 or MATH 184 or MATH 188,CSE 12,CSE 15L,CSE 30 or ECE 15,,,,,,Restricted to undergraduates. Graduate students will be allowed as space permits. Students may not receive credit for both CSE 100R and CSE 100.
CSE 100R,Advanced Data Structures,4,"High-performance data structures and supporting algorithms. Use and implementation of data structures like (un)balanced trees, graphs, priority queues, and hash tables. Also memory management, pointers, recursion. Theoretical and practical performance analysis, both average case and amortized. Uses C++ and STL. ",CSE 21 or MATH 154 or MATH 158 or MATH 184 or MATH 188,CSE 12,CSE 15L,CSE 30 or ECE 15,,,,,,This course is a distance education course. Students may not receive credit for both CSE 100R and CSE 100.
CSE 101,Design and Analysis of Algorithms,4,"Design and analysis of efficient algorithms with emphasis of nonnumerical algorithms such as sorting, searching, pattern matching, and graph and network algorithms. Measuring complexity of algorithms, time and storage. NP-complete problems. ",CSE 21 or MATH 154 or MATH 158 or MATH 184 or MATH 188,CSE 12 or DSC 30,,,,,,,,Restricted to undergraduates. Graduate students will be allowed as space permits.
CSE 103,A Practical Introduction to Probability and Statistics,4,"Distributions over the real line. Independence, expectation, conditional expectation, mean, variance. Hypothesis testing. Learning classifiers. Distributions over R^n, covariance matrix. Binomial, Poisson distributions. Chernoff bound. Entropy. Compression. Arithmetic coding. Maximal likelihood estimation. Bayesian estimation. CSE 103 is not duplicate credit for ECE 109, ECON 120A, or MATH 183. ",MATH 20B,CSE 21 or MATH 154 or MATH 158 or MATH 184 or MATH 188,,,,,,,,"Restricted to CS25, CS26, CS27, and CS28 majors. Other students will be allowed as space permits."
CSE 105,Theory of Computability,4,"An introduction to the mathematical theory of computability. Formal languages. Finite automata and regular expressions. Push-down automata and context-free languages. Computable or recursive functions: Turing machines, the halting problem. Undecidability. ",CSE 12,CSE 15L,CSE 20 or MATH 109 or MATH 15A or MATH 31CH,CSE 21 or MATH 100A or MATH 103A or MATH 154 or MATH 158 or MATH 184 or MATH 188,,,,,,Graduate students will be allowed as space permits.
CSE 106,Discrete and Continuous Optimization,4,"One frequently deals with problems in engineering, data science, business, economics, and other disciplines for which algorithmic solutions that optimize a given quantity under constraints are desired. This course is an introduction to the models, theory, methods, and applications of discrete and continuous optimization. Topics include shortest paths, flows, linear, integer, and convex programming, and continuous optimization techniques such as steepest descent and Lagrange multipliers. ",MATH 18 or MATH 31AH,MATH 20C or MATH 31BH,CSE 21 or DSC 40B or MATH 154 or MATH 158 or MATH 184 or MATH 188,,,,,,,
CSE 107,Introduction to Modern Cryptography,4,"Topics include private and public-key cryptography, block ciphers, data encryption, authentication, key distribution and certification, pseudorandom number generators, design and analysis of protocols, zero-knowledge proofs, and advanced protocols. Emphasizes rigorous mathematical approach including formal definitions of security goals and proofs of protocol security. ",CSE 21 or MATH 154 or MATH 158 or MATH 184 or MATH 188,CSE 101,CSE 105,,,,,,,"Restricted to students within the CS25, CS26, CS27, CS28, and EC26 majors. All other students will be allowed as space permits."
CSE 109,Introduction to Programming Contests,2,"This course introduces the algorithms and concepts necessary to compete in programming contests like ACM International Collegiate Programming Contest (ICPC). The course requires weekly completion of short problem sets. Topics covered include standard library classes and data structures useful for programming contest problems, basic complexity analysis, dynamic programming, graph algorithms, number theory, combinatorics, computational geometry, combinatorial games, and contest strategy. ",CSE 30 or permission of instructor,,,,,,,,,
CSE 110,Software Engineering,4,"Introduction to software development and engineering methods, including specification, design, implementation, testing, and process. An emphasis on team development, agile methods, and use of tools such as IDE’s, version control, and test harnesses. ",CSE 100 or CSE 100R,,,,,,,,,"Restricted to students within the CS25, CS26, CS27, CS28, and EC26 majors. All other students will be allowed as space permits."
CSE 112,Advanced Software Engineering,4,"This course will cover software engineering topics associated with large systems development such as requirements and specifications, testing and maintenance, and design. Specific attention will be given to development tools and automated support environments. ",CSE 110,,,,,,,,,"Restricted to students within the CS25, CS26, CS27, and EC26 majors. All other students will be allowed as space permits."
CSE 118,Ubiquitous Computing,4,"Explores emerging opportunities enabled by cheap sensors and networked computing devices. Small research projects will be conducted in teams, culminating in project presentations at the end of the term. Section will cover material relevant to the project, such as research methods, software engineering, teamwork, and project management. ",,,,,,,,,,"Any course from the following: CSE 131, CSE 132B, COGS 102C, COGS 121, COGS 184, COMT 111B, COMT 115, ECE 111, ECE 118, ECE 191, ECE 192, or ICAM 160B; or consent of instructor."
CSE 120,Principles of Computer Operating Systems,4,"Basic functions of operating systems; basic kernel structure, concurrency, memory management, virtual memory, file systems, process scheduling, security and protection. ",CSE 30,CSE 101,CSE 110,,,,,,,"Restricted to students within the CS25, CS26, CS27, and EC26 majors. All other students will be allowed as space permits."
CSE 121,Real-World Operating Systems,4,"Case study of architecture and implementation of a modern operating system or parts of multiple operating systems. In-depth analysis through detailed study of deployed source code. Topics vary based on OS understudy each term. Emphasis on emerging concerns and the new techniques and technologies used to address them. Recommended preparation: Knowledge of programming languages and paradigms, the components that comprise them, and the principles of language design are strongly recommended but not required. ",CSE 120,,,,,,,,,
CSE 122,Wireless Networks,4,"This course covers the design, operation, and use of wireless technologies, with emphasis on how physical resource constraints and application constraints meet to affect link, network, system, and application design, with hands-on experience in multiple technologies. May be coscheduled with CSE 222C. Recommended preparation: Basics of software engineering, modular design, data structures, physical (in-memory) representation of data structures, code compilation, build systems, version control, debuggers, C code, and pointer manipulation in C. ",CSE 30 or ECE 30,CSE 101 or ECE 141A,CSE 110 or ECE 141B,,,,,,,
CSE 123,Computer Networks,4,"Introduction to concepts, principles, and practice of computer communication networks with examples from existing architectures, protocols, and standards with special emphasis on the internet protocols. Layering and the OSI model; physical and data link layers; local and wide area networks; datagrams and virtual circuits; routing and congestion control; internetworking. Transport protocols. Credit may not be received for both CSE 123 and ECE 158A. ",CSE 30,CSE 101,CSE 110,,,,,,,"Restricted to students within the CS25, CS26, CS27, CS28, and EC26 majors. All other students will be allowed as space permits."
CSE 124,Networked Services,4,"(Renumbered from CSE 123B.) The architecture of modern networked services, including data center design, enterprise storage, fault tolerance, and load balancing. Protocol software structuring, the Transmission Control Protocol (TCP), remote procedure calls, protocols for digital audio and video communication, overlay and peer-to-peer systems, secure communication. Credit may not be received for both CSE 124 and ECE 158B. Students may not receive credit for both CSE 123B and CSE 124. ",CSE 30,CSE 101,CSE 110,,,,,,,"Restricted to students within the CS25, CS26, CS27, CS28, and EC26 majors. All other students will be allowed as space permits."
CSE 125,Software System Design and Implementation,4,"Design and implementation of large, complex software systems involving multiple aspects of CSE curriculum. Emphasis is on software system design applied to a single, large group project with close interaction with instructor. ",,,,,,,,,,"Senior standing with substantial programming experience, and consent of instructor. Department stamp required."
CSE 127,Introduction to Computer Security,4,"Topics include basic cryptography, security/threat analysis, access control, auditing, security models, distributed systems security, and theory behind common attack and defense techniques. The class will go over formal models as well as the bits and bytes of security exploits. ",CSE 21 or MATH 154 or MATH 158 or MATH 184 or MATH 188,CSE 120 or CSE 123 or CSE 124,,,,,,,,"Restricted to students within the CS25, CS26, CS27, CS28, and EC26 majors. All other students will be allowed as space permits."
CSE 130,Programming Languages: Principles and Paradigms,4,"(Formerly CSE 173.) Introduction to programming languages and paradigms, the components that comprise them, and the principles of language design, all through the analysis and comparison of a variety of languages (e.g., Pascal, Ada, C++, PROLOG, ML.) Will involve programming in most languages studied. ",CSE 12,CSE 100 or CSE 100R,CSE 105,,,,,,,"Restricted to students within the CS25, CS26, CS27, and EC26 majors. All other students will be allowed as space permits."
CSE 131,Compiler Construction,4,"(Formerly CSE 131B.) Introduction to the compilation of programming languages, practice of syntax-directed translation, type checking, code generation, optimization, interpretation, and compiler structure. Students may receive repeat credit for CSE 131A and CSE 131B by completing CSE 131. May be coscheduled with CSE 231. ",CSE 100 or CSE 100R,CSE 105,CSE 130,,,,,,,"Restricted to CS25, CS26, CS27, and EC26 majors. All other students will be allowed as space permits."
CSE 132A,Database System Principles,4,"Basic concepts of databases, including data modeling, relational databases, query languages, optimization, dependencies, schema design, and concurrency control. Exposure to one or several commercial database systems. Advanced topics such as deductive and object-oriented databases, time allowing. ",CSE 100 or CSE 100R,,,,,,,,,"Restricted to students within the CS25, CS26, CS27, and EC26 majors. All other students will be allowed as space permits."
CSE 132B,Database Systems Applications,4,"Design of databases, transactions, use of trigger facilities and datablades. Performance measuring, organization of index structures. ",CSE 132A,,,,,,,,,"Restricted to CS25, CS26, CS27, and EC26 majors. All other students will be allowed as space permits."
CSE 132C,Database System Implementation,4,"This is a systems-focused course on the internals of a relational database management system (RDBMS). RDBMSs power large-scale structured data management in most digital applications. The topics span data storage, buffer management, indexing, sorting, relational operator implementations, query processing and optimization, parallel RDBMSs, and “Big Data” systems. Two C++ programming projects require implementation of a buffer manager and a B+ tree index using a given RDBMS skeleton. Recommended preparation: C++ programming knowledge is required; CSE 132B is recommended. ",CSE 132A or DSC 102,,,,,,,,,"Restricted to CS25, CS26, CS27, CS28, and EC26 majors. All other students will be allowed as space permits."
CSE 134B,Web Client Languages,4,Design and implementation of interactive World Wide Web clients using helper applications and plug-ins. The main language covered will be Java. ,CSE 100 or CSE 100R,,,,,,,,,"Restricted to CS25, CS26, CS27, and EC26 majors. All other students will be allowed as space permits."
CSE 135,Online Database Analytics Applications,4,"Database, data warehouse, and data cube design; SQL programming and querying with emphasis on analytics; online analytics applications, visualizations, and data exploration; performance tuning. ",CSE 100 or CSE 100R,,,,,,,,,"Restricted to students within the CS25, CS26, CS27, CS28, and EC26 majors. All other students will be allowed as space permits."
CSE 136,Enterprise-Class Web Applications,4,"Design and implementation of very large-scale, web-based applications. Topics covered typically include modeling organizational needs, design and revision management, J2EE or similar software platforms, web server and application server functionality, reuse of object-oriented components, model-view-controller and other design patterns, clustering, load-balancing, fault-tolerance, authentication, and usage accounting. ",CSE 135,,,,,,,,,
CSE 140,Components and Design Techniques for Digital Systems,4,"Design of Boolean logic and finite state machines; two-level, multilevel combinational logic design, combinational modules and modular networks, Mealy and Moore machines, analysis and synthesis of canonical forms, sequential modules. ",CSE 20 or MATH 109 or MATH 15A or MATH 31CH,CSE 30,,,,,,,,"CSE 140L must be taken concurrently; restricted to CS25, CS26, CS27, and EC26 majors. All other students will be allowed as space permits."
CSE 140L,Digital Systems Laboratory,2,Implementation with computer-aided design tools for combinational logic minimization and state machine synthesis. Hardware construction of a small digital system. ,CSE 20 or MATH 109 or MATH 15A or MATH 31CH,CSE 30,,,,,,,,"CSE 140 must be taken concurrently; restricted to CS25, CS26, CS27, and EC26 majors. All other students will be allowed as space permits."
