course_code,name,units,desc,prereq1,prereq2,prereq3,prereq4,prereq5,prereq6,prereq7,prereq8,prereq9,misc_prereq
MAE 165,Fatigue and Failure Analysis of Engineering Components,4,"The engineering and scientific aspects of crack nucleation, slow crack growth, and unstable fracture in crystalline and amorphous solids. Microstructural effects on crack initiation, fatigue crack growth and fracture toughness. Methods of fatigue testing and fracture toughness testing. Fractography and microfractography. Design safe methodologies and failure prevention. Failure analysis of real engineering structures. ",,,,,,,,,,Consent of instructor. (Not offered every year.)
MAE 166,Modern Concepts in Nanotechnology,4,"(Cross-listed with NANO 156.) This course offers a worm’s eye perspective on recent developments on nanomaterials through case studies building on basic principles of synthesis techniques, processing, microstructural control, and unique physical properties of materials in nanoscale dimensions. Particular focus will be given to physical properties and technological applications of nanowires, quantum dots, and thin films. Students may not receive credit for both NANO 156 and MAE 166. ",,,,,,,,,,Upper-division standing. (Not offered every year.)
MAE 167,Wave Dynamics in Materials,4,Pressure and shear waves in infinite solids. Reflection and diffraction. Rayleigh and Love waves in semi-infinite space. Impulse load on a half space. Waveguides and group velocity. ,,,,,,,,,,Consent of instructor. (Not offered every year.)
MAE 170,Experimental Techniques,4,"Principles and practice of measurement and control and the design and conduct of experiments. Technical report writing. Lectures relate to dimensional analysis, error analysis, signal-to-noise problems, filtering, data acquisition and data reduction, as well as background of experiments and statistical analysis. Experiments relate to the use of electronic devices and sensors. ",PHYS 2C or PHYS 4B,PHYS 2CL or MAE 140 or MAE 40,,,,,,,,"Enrollment restricted to MC 25, MC 27, MC 29, MC 30–34, BE 25, BE 27."
MAE 171A,Mechanical Engineering Laboratory I,4,"Design and analysis of experiments in fluid mechanics, solid mechanics, and control engineering. Experiments in wind tunnel, water tunnel, vibration table and material testing machines, and refined electromechanical systems. Laboratory report writing; error analysis; engineering ethics. ","MAE 101A, MAE 143B,",MAE 170,,,,,,,,Enrollment restricted to MC 27 and MC 30–34 majors only.
MAE 171B,Mechanical Engineering Laboratory II,4,"Design and analysis of original experiments in mechanical engineering. Students research projects using experimental facilities in undergraduate laboratories: wind tunnel, water channel, vibration table, and testing machine and control systems. Students propose and design experiments, obtain data, complete engineering analysis and write a major report. ",MAE 171A,,,,,,,,,(Not offered every year.)
MAE 175A,Aerospace Engineering Laboratory I,4,"Analysis of aerospace engineering systems using experimental facilities in undergraduate laboratories: wind tunnel, water channel, vibration table, and testing machine. Students operate facilities, obtain data, complete engineering analysis and write major reports. ",,,,,,,,,,"Senior standing; MAE 101C or CENG 101B; MAE 143B or CENG 120; and MAE 170, or consent of instructor."
MAE 180,Orbital Mechanics,4,"Students perform analyses based on mission requirements. Selected topics include astrodynamics, orbital motion, perturbations, coordinate systems and frames of reference, ground tracks and classification of common orbits, orbit determination, orbital maneuvers, station keeping, orbit injection and launch geometry, and interplanetary and lunar trajectories.",,,,,,,,,,
MAE 180A,Spacecraft Guidance I,4,"Astrodynamics, orbital motion, perturbations, coordinate systems and frames of reference. Geosynchronous orbits, station keeping. Orbital maneuvers, fuel consumption, guidance systems. Observation instrument point, tracking, control. Basic rocket dynamics. Navigation, telemetry, re-entry, and aero-assisted maneuvers. Mission design. Students perform analyses based on mission requirements. ",,,,,,,,,,"Upper-division standing in physics, mathematics, or engineering department."
MAE 181,Space Mission Analysis and Design,4,"Space mission concepts, architectures, and analysis. Mission geometry. Astrodynamics. Orbit and constellation design. Space environment. Payload and spacecraft design and sizing. Power sources and distribution. Thermal management. Structural design. Guidance and navigation. Space propulsion. Orbital debris and survivability. Cost modeling and risk analysis. ",,,,,,,,,,Upper-division standing or consent of instructor.
MAE 182,Spacecraft Guidance and Navigation,4,"Navigational and guidance requirements for orbital, planetary, and atmospheric entry missions. Guidance systems. Observation instrument point, tracking, control. Celestial, radio, and inertial navigation schemes. Link budgets, antennas, and telemetry systems. ",MAE 180,,,,,,,,,
MAE 184,Flight Simulation Techniques,4,"Students will develop software and methods to simulate the motion characteristics of flight vehicles. Six degree-of-freedom equations of motion will be reviewed with emphasis on computer implementation. Algorithms for data modeling, numerical integration, equilibrium, and linearization will be introduced. Three-dimensional visualization techniques will be explored for representing operator and observer viewpoints. Applications include aircraft, automobiles, and marine vessels. ",,,,,,,,,,Upper-division standing or consent of instructor.
MAE 185,Computational Fluid Mechanics,4,This course will cover numerical solutions of the compressible and incompressible Navier-Stokes equations using finite difference and finite volume discretization with a primary emphasis on programming and a secondary emphasis on application of commercial tools. Introduction to flow visualization will also be covered. ,MAE 101B,MAE 107,,,,,,,,
MAE 190,Topics in Mechanical and Aerospace Engineering,4,Topics of special interest in mechanical and aerospace engineering. May be repeated for credit as topics vary. ,,,,,,,,,,Upper-division standing.
MAE 191,Topics in Mechanical and Aerospace Engineering with Laboratory,4,Topics of special interest in mechanical and aerospace engineering with laboratory. May be repeated for credit as topics vary. ,,,,,,,,,,Upper-division standing.
MAE 197,Engineering Internship,1–12,Students work in local industry or hospitals under faculty supervision. Units may not be applied toward graduation requirements. Salaried or unsalaried. Number of units determined by enrollment frequency. First quarter up to four units. Subsequent quarters cannot exceed one unit. ,,,,,,,,,,"Consent of instructor and department stamp, 2.50 overall GPA minimum, at least ninety units."
MAE 198,Directed Group Study,1–4,"Directed group study on a topic or in a field not included in the regular department curriculum, by special arrangement with a faculty member. May be taken P/NP only. ",,,,,,,,,,Consent of instructor.
MAE 199,Independent Study for Undergraduates,1–4,Independent reading or research on a problem by special arrangement with a faculty member. P/NP grades only. ,,,,,,,,,,Consent of instructor.
MAE 200,Controls,4,"This course covers topics in probability and stochastic processes, linear control and estimation including optimal linear control, nonlinear stabilization, and optimal control and estimation for nonlinear systems. ",,,,,,,,,,Nongraduate students may enroll with consent of instructor.
MAE 201,Mechanics of Fluids,4,"This course covers topics in kinematics, equations of motion, dimensional analysis, laminar and irrotational flow, vorticity dynamics, and boundary layers. ",,,,,,,,,,Nongraduate students may enroll with consent of instructor.
MAE 202,Thermal Processes,4,"This course covers topics in energy conservation, heat conduction, convection, radiation, heat transfer in ducts, external boundary layer, and heat exchangers. ",,,,,,,,,,Nongraduate students may enroll with consent of instructor.
MAE 203,Solid Mechanics and Materials,4,"This course covers topics in kinematics, conservation laws, constitutive equation of linear elastic solids, plasticity, and viscoelasticity. ",,,,,,,,,,Nongraduate students may enroll with consent of instructor.
MAE 204,Robotics,4,"This course covers topics in robotics, dynamics, kinematics, mechatronics, control, locomotion, and manipulation. ",,,,,,,,,,Nongraduate students may enroll with consent of instructor.
MAE 205,Graduate Seminar,1,"Each graduate student in MAE is expected to attend one seminar per quarter, of his or her choice, dealing with current topics in fluid mechanics, solid mechanics, applied plasma physics and fusion, chemical engineering, applied ocean sciences, energy and combustion, environmental engineering, or materials science, and dynamics and controls. Topics will vary. (S/U grades only)",,,,,,,,,,
MAE 206,Energy Systems,4,"This course covers topics in primary energy sources, availability and variability, fossil fuels, renewables and nuclear, energy dependent energy sources, heat engine, energy conservation, exergy, transportation, air pollution, and climate change. ",,,,,,,,,,Nongraduate students may enroll with consent of instructor.
MAE 207,Topics in Engineering Science,4,A course to be given at the discretion of the faculty in which topics of current interest in engineering will be presented. ,,,,,,,,,,Consent of instructor.
MAE 208,Mathematics for Engineers,4,"This course will reintroduce the mathematics fundamentals necessary for success in the engineering graduate program in MAE. Topics will include calculus, ODE’s, vector calculus, linear algebra, probability and PDE’s. ",,,,,,,,,,Nongraduate students can enroll with consent of instructor.
MAE 209,Continuum Mechanics Applied to Medicine/Biology,4,(Cross-listed with BENG 209.) Introduction to the basic definitions of continuum mechanics and their mathematical formulation at the graduate level with applications to problems in medicine and biology. This course is intended for students with little or no background in mechanics; it is an introduction to the Biomechanics courses BENG 250 A–B in the Department of Bioengineering and to Solid and Fluid Mechanics courses MAE 210A and MAE 231A in the Department of Mechanical and Aerospace Engineering. This course should NOT be taken concurrently with MAE 210A or MAE 231A. ,BENG 226 or MAE 201,BENG 227 or MAE 201 or MAE 210A,BENG 221 or MAE 208 or consent of instructor,,,,,,,
MAE 210A,Fluid Mechanics I,4,"Basic conservation laws. Flow kinematics. The Navier-Stokes equations and some of its exact solutions. Nondimensional parameters and different flow regimes, vorticity dynamics.",,,,,,,,,,
MAE 210B,Fluid Mechanics II,4,"Potential flows, boundary layers, low-Reynolds number flows. ",BENG 209 or MAE 209 or MAE 210A,,,,,,,,,"MAE 101A and B; and MAE 110A, or consent of instructor."
MAE 210C,Fluid Mechanics III,4,"Flow instabilities, linear stability theory; introduction to turbulent flows. ",MAE 210A–B or consent of instructor,,,,,,,,,
MAE 211,Introduction to Combustion,4,"Fundamental aspects of flows of reactive gases, with emphasis on processes of combustion, including the relevant thermodynamics, chemical kinetics, fluid mechanics, and transport processes. Topics may include deflagrations, detonations, diffusion flames, ignition, extinction, and propellant combustion. ",,,,,,,,,,Graduate standing.
MAE 212,Introductory Compressible Flow,4,"Equations of motion for compressible fluids; one-dimensional gas dynamics and wave motion, waves in supersonic flow, including oblique shock waves; flow in ducts, nozzles, and wind tunnels; methods of characteristics. Nongraduate students may enroll with consent of instructor.",,,,,,,,,,
MAE 213,Mechanics of Propulsion,4,"Fluid mechanics, thermodynamics and combustion processes involved in propulsion of aircraft and rockets by air breathing engines, and solid and liquid propellant rocket engines characteristics and matching of engine components; diffusers, compressors, combustors, turbines, pumps, nozzles. ",,,,,,,,,,Graduate standing.
MAE 214A,Introduction to Turbulence and Turbulent Mixing,4,"Basic features of turbulent flows. Analytical description of turbulence: random variables, correlations, spectra, Reynolds-averaging, coherent structures. Length and time scales. Kolomogorov similarity theory. Turbulence transport equations. Free shear flows. Homogeneous turbulence. Wall-bounded flows. Mixing of velocity and scalar fields. ",,,,,,,,,,Graduate standing.
MAE 215,Multiphase Flow and Heat Transfer,4,"This course is designed to teach the fundamentals and some applications of multiphase systems. The first part of the course introduces the basics of thermodynamics and transport processes in generalized multiphase systems, along with the description of interfacial transport mechanisms. In the second part, the course focuses on the analyses of transport processes and interfacial instabilities in specific systems, including droplets, bubbles, and sprays.",,,,,,,,,,
MAE 217A,Introduction to Gas Discharge Plasma Physics,4,"Charged particle motion in electromagnetic field, atomic processes in plasmas, electric breakdown of the gases, plasma quasi-neutrality, sheath, probes. Electron kinetics in low-temperature plasma, particle and energy fluxes, DC and RF driven discharges, instabilities of gas discharge plasmas. ",,,,,,,,,,Consent of instructor.
MAE 217B,Introduction to Nonmagnetized Hot Plasma Physics,4,"Coulomb collisions, collisionless approximation for hot plasma dynamics, Vlasov equation, waves in nonmagnetized plasma, dispersion equation, WKB approximation, Landau dumping, plasma instabilities, quasi-linear theory. ",MAE 217A or consent of instructor,,,,,,,,,
MAE 217C,Introduction to Magnetized Hot Plasma Physics,4,"Drifts of magnetized charged particles, charged particle motion in different magnetic configurations, toroidal plasma equilibrium, Grad-Shafranov equation, neoclassical plasma transport in tokamak, waves in homogeneous magnetized plasma, waves in inhomogeneous magnetized plasma, instabilities of magnetized plasma. ",MAE 217A,"B, or consent of instructor",,,,,,,,
MAE 218A,Introduction to High Energy Density Physics,MHD and Pinches,"Equation of state, Saha equilibrium. Shock rarefaction, and blast waves, self-similar motion. Rayleigh-Taylor, Kelvin-Helmholtz, and Richtmyer-Meshkov instabilities. Z-pinch, Bennett equilibrium, radiation collapse, and radiation sources. ","MAE 217A, B,","C, or consent of instructor",,,,,,,,
MAE 218B,Introduction to High Energy Density Physics,Laser-Plasma Interactions,"Propagation and absorption of laser beam in plasma, ablation pressure. Laser scattering and laser-plasma instabilities (stimulated Raman and Brillouin scattering, filamentation and decay instabilities). Electron heat transport, mechanisms of magnetic field generation. ","MAE 217A, B,","C, or consent of instructor",,,,,,,,
MAE 219,Design and Control of Haptic Systems,4,"Course provides an introduction to the design and control of haptic systems, which provide touch feedback to human users interacting with virtual environments and teleoperated robots. Topics include haptic-focused mechatronic design, system modeling and analysis (kinematics and dynamics), human-in-the-loop feedback control, and haptic feedback evaluation. Course topics including mechatronic system design, as well as system modeling, analysis, and control reinforce many fundamental MAE topics.",,,,,,,,,,
MAE 220A,Physics of Gases,4,"Thermodynamics of gases for use in gas dynamics. Derivation of thermodynamic functions from statistical mechanics. Applications of classical and quantum statistical mechanics to chemical, thermal, and radiative properties of gases. Equilibrium and nonequilibrium radiation, chemical equilibrium, and elements of chemical kinetics. Laser and reacting-flow applications. ",,,,,,,,,,Graduate standing.
MAE 220B,Physical Gas Dynamics,4,"Velocity distribution functions, the Boltzmann equation, moment equations and the Navier-Stokes equations. The dynamics of molecular collisions. The Chapman-Enskog expansion and transport coefficients: shear and bulk viscosity, heat conduction, molecular and thermal diffusion. Linearizations about equilibrium: applications to acoustics and supersonic flows with relaxation. ",MAE 220A,graduate standing,,,,,,,,
MAE 221A,Conduction Heat Transfer,4,"Fourier’s Law, the heat conduction equation, multidimensional conduction, unsteady conduction, moving boundary problems, conduction on slabs, cylindrical and spherical shells, multidimensional fins, numerical solution methods. ",,,,,,,,,,Graduate standing.
MAE 221B,Mass Transfer,4,Fundamentals of diffusive and convective mass transfer and mass transfer with chemical reaction. Development of mass conservation equations. Analytical and numerical solutions to mass transport problems. Specific topics and applications will vary. Students may not receive credit for MAE 221B and CENG 221B. ,,,,,,,,,,Graduate standing.
MAE 221C,Convection Heat Transfer,4,"Classical introduction to convection analysis and fundamentals, including detailed treatment of nested boundary layers, turbulent mixing, similarity ad modeling, scale analysis, and the use of general conservation equations. Special topics covered in this course may include high-speed flows, natural convection, viscous dissipation, micro-scale convection, convection on rotating surfaces, and/or convection applications to mechanical and aerospace engineering. ",,,,,,,,,,Graduate standing.
MAE 221D,Radiation Heat Transfer,4,"Physics of radiation, electromagnetic spectrum, spectral properties of gases, liquids, and solids, radiation exchange between surfaces, view factor algebra, transfer factors, radiation transfer through gases. Special topics covered may include near-field radiation, atmospheric radiation, solar radiation, etc. ",,,,,,,,,,Graduate standing.
MAE 223,Ocean Technology Design and Development,4,"Advances in open-source technology are catalyzing advances in environmental fluid mechanics and oceanography. In this course, we will combine lectures and hands-on experience to transition off-the-shelf technology into undersea sensors. Lectures include ocean sensing techniques, sensor characterization and calibration, pressure tolerance design, sensor deployment approaches. Students working in small groups will design and test using MAE and Scripps Institution of Oceanography facilities.",,,,,,,,,,
MAE 224A,Environmental Fluid Dynamics I,4,"Basics of stratified flows. Linear waves: surface waves, internal gravity waves, dispersion, reflection, mountain waves. Ray tracing. Gravity currents and intrusions. Hydraulic control. Stability of and mixing in stratified shear flows. Recommended preparation: MAE 210A.",,,,,,,,,,
MAE 224B,Environmental Fluid Dynamics II,4,Plumes and thermals. Application to building ventilation. Basics of rotating flows. Geostrophic flow. Thermal wind balance. Ekman boundary layer. Shallow water equations. Normal modes of a stratified fluid. Potential vorticity. Waves in a rotating fluid. Recommended preparation: MAE 210A. ,MAE 224A or consent of instructor,,,,,,,,,
MAE 225A,Nanoscale and Microscale Heat Transfer for Energy Conversion Applications I,4,"An advanced introduction to the principles underlying conduction, convection, and radiation phenomena at the atomic/molecular scale; overview of macroscopic thermal sciences, kinetic theory and fluidics, statistical thermodynamics and quantum theory, thermal properties as a function of dimensionality; experimental methods. ","MAE 221A, graduate standing",,,,,,,,,
MAE 225B,Nanoscale and Microscale Heat Transfer for Energy Conversion Applications II,4,"Energy conversion and coupled transport processes; electron and phonons, equilibrium and nonequilibrium energy transfer in nanostructures. Ballistic-diffusive treatment, thermal radiation issues in nanomaterials, near-field energy transfer, molecular dynamics, and experimental methods. ","MAE 221A, MAE 225A,",graduate standing,,,,,,,,
MAE 226,Advanced Dynamics,4,"This course covers advanced topics in Lagrange’s equations, rigid and flexible body dynamics, virtual power, non-holonomic dynamics, functional analysis, and integrals of motion. After taking this class, the student should be able to determine the equations of motion for even very complex dynamical systems; determine special invariants of the system helping to avoid detailed solution by computer and providing insight; and understand the basics of minimization and variational calculus.",,,,,,,,,,
MAE 227,Convex Optimization for Engineers,4,"This course focuses on convex optimization theory, convexification of non-convex problems, engineering applications, modeling and implementation in a programming language. This course covers convex sets and functions, convex optimization problems (LP, QP, SOCP, SDP), weak and strong duality, optimality conditions, and solution and shadow price interpretation. Some applications include design in mechanical engineering, optimal control problems, machine learning, energy, transportation, etc.",,,,,,,,,,
MAE 228,Selected Topics in Plasma Physics,4,"Collisionless magnetic reconnection, interactions of relativistic laser field with plasma, plasma in astrophysics, computational plasma physics. ",MAE 217A-B-C or consent of instructor,,,,,,,,,
MAE 231A,Foundations of Solid Mechanics,4,Specification of stress and strain; infinitesimal and finite deformation; conservation equations; typical constitutive equations; minimum potential energy principle. ,,,,,,,,,,Graduate standing.
MAE 231B,Elasticity,4,Basic field equations. Typical boundary value problems of classical linear elasticity. Problems of plane stress and plane strain. Variational principles. ,"MAE 209/BENG 209, or MAE 231A, or consent of instructor",,,,,,,,,
MAE 231C,Inelasticity,4,"(Cross-listed with SE 273.) Overview of inelastic behavior of materials. Models of plasticity, viscoplasticity, viscoelasticity. Micromechanics and modeling of damage. Fatigue phenomena. Fracture mechanics. Processes and models of the failure of materials. Students may not receive credit for both SE 273 and MAE 231C. ",,,,,,,,,,"Graduate standing and MAE 231A and 231B, or SE 271 and 272, or consent of instructor."
MAE 232A,Finite Element Methods in Solid Mechanics I,4,"(Cross-listed with SE 276A.) Finite element methods for linear problems in solid mechanics. Emphasis on the principle of virtual work, finite element stiffness matrices, various finite element formulations and their accuracy, and the numerical implementation required to solve problems in small strain, isotropic elasticity in solid mechanics. ",,,,,,,,,,Graduate standing.
MAE 232B,Finite Element Methods in Solid Mechanics II,4,"(Cross-listed with SE 276B.) Finite element methods for linear problems in structural dynamics. Beam, plate, and doubly curved shell elements are derived. Strategies for eliminating shear locking problems are introduced. Formulation and numerical solution of the equations of motion for structural dynamics are introduced and the effect of different mass matrix formulations on the solution accuracy is explored. ",,,,,,,,,,Graduate standing and MAE 232A or SE 276A.
MAE 232C,Finite Element Methods in Solid Mechanics III,4,(Cross-listed with SE 276C.) Finite element methods for problems with both material and geometrical (large deformations) nonlinearities. The total LaGrangian and the updated LaGrangian formulations are introduced. Basic solution methods for the nonlinear equations are developed and applied to problems in plasticity and hyperelasticity. ,,,,,,,,,,Graduate standing and MAE 232B or SE 276B.
MAE 233A,Fracture Mechanics,4,"Theoretical strength; stress concentration. Linear and nonlinear fracture mechanics: stress singularity, fracture modes, crack tip plastic zone, dugdale model, the R-curve; power-law materials, the J-integral; fatigue; special topics. ","MAE 231A, MAE 231B, or consent of instructor",,,,,,,,,
MAE 233B,Micromechanics,4,"General theory of transformation strains and corresponding elastic fields; Green’s functions and other solution methods; dislocations; inclusions and inhomogeneities; micromechanics of plastic flow, microcracking, cavitation, and damage in crystalline and other solids. ",MAE 231A-B-C or consent of instructor,,,,,,,,,
MAE 235,Computational Techniques in Finite Elements,4,"(Cross-listed with SE 233.) Practical application of the finite element method to problems in solid mechanics. Elements of theory are presented as needed. Covered are static and dynamic heat transfer and stress analysis. Basic processing, solution methods, and postprocessing are practiced with commercial finite element software. Students may not receive credit for SE 233 and MAE 235. ",,,,,,,,,,Graduate standing.
MAE 238,Stress Waves in Solids,4,"Linear wave propagation; plane waves; reflection and refraction; dispersion induced by geometry and by material properties. Application of integral transform methods. Selected topics in nonlinear elastic, anelastic, and anisotropic wave propagation. ",,,,,,,,,,Graduate standing or consent of instructor.
MAE 240,Space Flight Mechanics,4,"Astrodynamics modeling within Newtonian, Lagrangian, and Hamiltonian frameworks with application to spacecraft motion in non-Keplerian and strongly perturbed environments. Topics include the gravitational n-body problem and reduced-order models, perturbation formulations and dynamical systems theory, and numerical methods.",,,,,,,,,,
