course_code,name,units,desc,prereq1,prereq2,prereq3,prereq4,prereq5,prereq6,prereq7,prereq8,prereq9,misc_prereq
MAE 242,Robot Motion Planning,4,"Modeling, solving, and analyzing planning problems for single robots or agents. Configuration space for motion planning, sampling-based motion planning, combinatorial motion planning, feedback motion planning, differential models, and nonholonomic constraints. Basic decision-theory and dynamic programming, sensor, and information spaces.",,,,,,,,,,
MAE 243,Electric Power Systems Modeling,4,"Formulate and solve canonical constrained optimization problems in electric power systems planning and operation, with applications to current and future low-carbon grids. Techno-economic assessment, implementations in a modern algebraic modeling language, and techniques to enhance computational tractability will be covered.",,,,,,,,,,
MAE 244,Renewable Energy Integration,4,"The objective of this course is to introduce students to the research field of integration of renewable energy (RE) in power systems. This course covers some relevant literature and the state of the art in the following subareas related to RE integration: capacity expansion models, optimal power flow, power dynamics, electricity markets, RE variability and forecasting, machine learning and AI for power systems, microgrids and islanded grids, electrical vehicles and demand response, among others.",,,,,,,,,,
MAE 247,Cooperative Control of Multi-agent Systems,4,"Tools for the design of cooperative control strategies for multi-agent systems are presented. Topics include continuous and discrete-time evolution models, proximity graphs, performance measures, invariance principles, and coordination algorithms for rendezvous, deployment, flocking, formation of autonomous vehicles and consensus.",,,,,,,,,,
MAE 248,Safety for Autonomous Systems,4,"This project-based course covers the mathematical foundations of dynamical system safety analysis and modern algorithmic approaches to decision-making in safety critical contexts. The focus is on safety analysis and safe learning for robots and other systems, paying special attention to uncertainty and the reality gap between mathematical models and the physical world. Class meetings combine whiteboard-style lecture, seminar-style discussion, and guest lectures from experts in the field. ",,,,,,,,,,Graduate standing.
MAE 249,Soft Robotics,4,"Roboticists have begun to explore the design of automated systems using soft materials (e.g., elastomers, gels, fluids) with the goal of achieving the versatility and robustness of biological organisms. This course provides a survey of topics important for the design, analysis, and control of soft robotics, including modeling (e.g., nonlinear elasticity), actuation (e.g., fluidic elastomer actuators), sensing (e.g., liquid metal sensors), and design optimization (e.g., using artificial evolution).",,,,,,,,,,
MAE 251,Structure and Analysis of Solids,4,"Cross-listed with NANO 227, MATS 227, and CHEM 222.) Key concepts in the atomic structure and bonding of solids such as metals, ceramics, and semiconductors. Symmetry operations, point groups, lattice types, space groups, simple and complex inorganic compounds, structure/property comparisons, structure determination with X-ray diffraction. Ionic, covalent, metallic bonding compared with physical properties. Atomic and molecular orbitals, bands vs. bonds, free electron theory. Students may only receive credit for one of the following: CHEM 222, MAE 251, MATS 227, or NANO 227. ",,,,,,,,,,Graduate standing.
MAE 253,Advanced Ceramics,4,"(Cross-listed with MATS 236.) Topics include phase equilibria and crystallography, defects and thermodynamics (Kröger-Vink notation), glass science, electrical and ionic transport behavior, Brouwer diagrams, powder synthesis and compaction, sintering theory and grain growth, mechanical, optical, magnetic, electrical properties, fuel cells. Students may not receive credit for MATS 236 and MAE 253. ",,,,,,,,,,Graduate standing.
MAE 254,Energy Materials and Applications,4,"(Cross-listed with MATS 256.) This class will cover the fundamentals/engineering aspects of various energy materials based on metallic, ceramic, semiconductor, and chemical structures, and their applications related to solar cells, fuel cells, batteries, fusion energy, and hydrogen storage will be discussed. Students may not receive credit for MATS 256 and MAE 254. ",,,,,,,,,,Graduate standing.
MAE 255,Boundary Layer and Renewable Energy Meteorology,4,"Radiative and convective heat transfer in the atmosphere. Surface energy balance and the urban heat island. Turbulence and dispersion in the atmospheric boundary layer. Solar and wind energy systems, resource assessment, and intermittency. ",MAE 210A or consent of instructor,,,,,,,,,
MAE 256,Radiative Transfer for Energy Applications,4,"Global insolation heat engine; solar-wind coupling; regional/seasonal insolation patterns; atmospheric radiation balance; RTE models; scattering; optical depth and transmittance of cloud layers; Schwarzschild’s equation; absorption/emission lines; rotational, vibrational and electronic transitions; Doppler/pressure broadening; Elsasser/Malkmus/Edwards models; solution methods. ",,,,,,,,,,Graduate standing or consent of instructor.
MAE 259,ODE Simulation Methods,4,"Orthogonality and norms. Reflection and rotation matrices. Solving systems of linear equations via LU and QR decompositions; least squares. Conditioning, sparsity, and parallelism. Iterative methods. Matrix subspaces. Eigen, Schur, and singular value decompositions. Pseudoinverses. Spectral representations, Fourier transforms, and the Dirac delta.",,,,,,,,,,
MAE 260,Fundamentals and Applications of Computational Materials Science,4,"(Cross-listed with MATS 260.) Computational methods for MatSci will be discussed, dealing with atomic scale empirical or semiempirical potentials. How and why to develop such potentials for metallic materials will be a focus of the course. Molecular dynamics and Monte Carlo methods will be covered in detail. Applications of these techniques to some example problems in materials science, mechanical deformation, dislocation interactions, nucleation/growth of phases, melting solidification structures, and point defects are presented.",,,,,,,,,,
MAE 261,Cardiovascular Fluid Mechanics,4,"Topics in the mechanics of blood flow including analytical solutions for flow in deformable vessels, one-dimensional equations, cardiovascular anatomy, lumped parameter models, vascular trees, scaling laws, and an introduction to the biomechanics and treatment of adult and congenital cardiovascular diseases. ",MAE 210A,"290A, or consent of instructor",,,,,,,,
MAE 262,Biological Fluid Mechanics,4,"Fluids phenomena relevant to the function, environment, and dynamics of biological cells. Topics include low-Reynolds number flows, cell motility, internal cellular flows, development and morphogenesis, hydrodynamics of suspensions and polymers, rheology, diffusion, hydrodynamics of deformable bodies (vesicles, membranes, filaments), cells under shear flow. ",MAE 209 or 210A,"graduate standing, or consent of instructor",,,,,,,,
MAE 263,Experimental Methods in Cell Mechanics,4,"Methods to measure mechanical aspects of cellular nature and behavior such as intracellular rheology, intracellular force distribution and propagation, cell adhesion strength, generation of propulsive forces during locomotion, interaction with the extracellular matrix, and response to external mechanical stimuli. ","MAE 209 or MAE 210A,",graduate standing,,,,,,,,
MAE 264,Mechanics and Thermodynamics of Biological Membranes,4,"This course will introduce the advanced graduate student to the topics of mechanical and thermodynamic analyses of cellular membranes, lipid bilayers, and the study of synthetic vesicles. ",MAE 209,"graduate standing, or consent of instructor",,,,,,,,
MAE 265A,Electronic and Photonic Properties of Materials,4,"(Cross-listed with MATS 251A.) The electronic and optical properties of metals, semiconductors, and insulators. The concept of the band structure. Electronic and lattice conductivity. Type I and Type II superconductivity. Optical engineering using photonic band gap crystals in one-, two-, and three-dimensions. Current research frontiers. Students may not receive credit for MATS 251A and MAE 265A. ",,,,,,,,,,Graduate standing.
MAE 265B,Magnetic Materials: Principles and Applications,4,"(Cross-listed with MATS 251B and NANO 251A and ECE 221.) The basis of magnetism: Classical and quantum mechanical points of view. Different kinds of magnetic materials. Magnetic phenomena including anisotropy, magnetostriction, domains, and magnetization dynamics. Current frontiers of nanomagnetics research including thin films and particles. Optical, data storage, and biomedical engineering applications of soft and hard magnetic materials. Letter grades only. Students may not receive credit for ECE 221 and MAE 265B and MATS 251B and NANO 251A. ",,,,,,,,,,Graduate standing; consent of instructor.
MAE 266,Biomaterials,4,"(Cross-listed with MATS 252.) This class will cover biomaterials and biomimetic materials. Metal, ceramic, and polymer biomaterials will be discussed. Emphasis will be on the structure-property relationships, biocompatibility/degradation issues and tissue/material interactions. Synthesis and mechanical testing of biomimetic materials will also be discussed. ",,,,,,,,,,Consent of instructor.
MAE 267,Nanomaterials and Properties,4,"(Cross-listed with MATS 253.) This course discusses synthesis techniques, processing, microstructural control and unique physical properties of materials in nanodimensions. Topics include nanowires, quantum dots, thin films, electrical transport, electron emission properties, optical behavior, mechanical behavior, and technical applications of nanomaterials. ",,,,,,,,,,Consent of instructor.
MAE 269,Bioinspired Mobile Robotics,4,"This course presents the field of bioinspired robotics and locomotion. Concepts include modes of bioinspired locomotion (walking, running, undulatory locomotion for example); limb kinematics; development of dynamic models from Euler-Lagrange, Newton’s laws, manipulator equations; stability analysis of oscillatory gaits; force and compliance control of robot legs; generation of rhythmic movement and coupled oscillators. ",MAE 204,,,,,,,,,
MAE 270,Multidisciplinary Design Optimization,4,"Introduction to engineering design optimization involving multidisciplinary models. Topics covered include local sensitivity analysis, gradient-based optimization, gradient-free optimization, surrogate models, discrete optimization, and multidisciplinary design optimization architectures. Students will apply these methods to a practical design problem of their choosing through a course project.",,,,,,,,,,
MAE 271A,Thermodynamics of Solids,4,"(Cross-listed with NANO 265, MATS 201A, and ECE 238A.) The thermodynamics and statistical mechanics of solids. Basic concepts, equilibrium properties of alloy systems, thermodynamic information from phase diagrams, surfaces and interfaces, crystalline defects. ",,,,,,,,,,Graduate standing.
MAE 271B,Solid State Diffusion and Reaction Kinetics,4,"(Cross-listed with MATS 201B.) Thermally activated processes, Boltzmann factor, homogenous and heterogeneous reactions, solid state diffusion, Fick’s laws, diffusion mechanisms, Kirkendall effect, Boltzmann-Matano analysis, high diffusivity paths. ",,,,,,,,,,Consent of instructor.
MAE 271C,Phase Transformations,4,"(Cross-listed with MATS 201C and ECE 238C.) Classification of phase transformations; displacive and reconstructive transformations; classical and nonclassical theories of nucleation; Becker-Doering, Volmer-Weber, lattice instabilities, spinodal decomposition. Growth theories; interface migration, stress effects, terrace-ledge mechanisms, epitaxial growth, kinetics and mechanics. Precipitation. Order-disorder transformations. Solidification. Amorphization. ",,,,,,,,,,Consent of instructor.
MAE 272,Imperfections in Solids,4,"(Cross-listed with MATS 205A.) Point, line, and planar defects in crystalline solids, including vacancies, self-interstitials, solute atoms, dislocations, stacking faults, and grain boundaries; effects of imperfections on mechanical properties; interactions of dislocations with point defects; strain hardening by micro-obstacles, precipitation, and alloying elements.",,,,,,,,,,
MAE 273A,Dynamic Behavior of Materials,4,"(Cross-listed with MATS 213A.) Elastic waves in continuum; longitudinal and shear waves. Surface waves. Plastic waves; shock waves, Rankine-Hugoniot relations. Method of characteristics, differential and difference form of conservation equations; dynamic plasticity and dynamic fracture. Shock wave reflection and interaction. ",,,,,,,,,,Consent of instructor.
MAE 274,Model Reduction,4,"Students will learn the mathematical tools, theory, and algorithms of model reduction so as to reproduce and predict behaviors in complex systems with low-dimensional models. Covers a wide range of methods and theory: system-theoretic (balanced truncation, transfer-function interpolation), data-driven and projection-based (proper orthogonal decomposition), and model learning approaches (dynamic mode decomposition, operator inference, Loewner-based system identification, eigensystem realization).",,,,,,,,,,
MAE 276,Mechanics of Soft Materials,4,"(Cross-listed with MATS 231.) Main focus is the large deformations and instabilities in soft materials, such as elastomers, gels, and biomaterials. Some contents in thermodynamics and finite deformation theory are reviewed and summarized. Fundamental theories are applied to study the mechanics of gels, electroactive polymers, and biomaterials. This course intends to use soft material as an example to illustrate how to study the interaction between mechanics and other fields in materials (e.g., electric field, chemical field). Students may not receive credit for both MAE 276 and MATS 231. ",,,,,,,,,,Graduate standing.
MAE 279,Uncertainty Quantification,4,"This course is an introduction to uncertainty quantification and will cover basic and advanced computational methods to quantify uncertainties in parameters, systems, and simulation. Covers basics in statistical and stochastic modeling, Monte Carlo sampling techniques including variance reduction and importance sampling, sensitivity analysis, Bayes’ theorem and related Bayesian inference methods (variants of Markov chain Monte Carlo).",,,,,,,,,,
MAE 280A,Linear Systems Theory,4,"Linear algebra: inner products, outer products, vector norms, matrix norms, least squares problems, Jordan forms, coordinate transformations, positive definite matrices, etc. Properties of linear dynamic systems described by ODEs: observability, controllability, detectability, stabilizability, trackability, optimality. Control systems design: state estimation, pole assignment, linear quadratic control.",,,,,,,,,,
MAE 280B,Linear Control Design,4,"Parameterization of all stabilizing output feedback controllers, covariance controllers, H-infinity controllers, and L-2 to L-infinity controllers. Continuous and discrete-time treatment. Alternating projection algorithms for solving output feedback problems. Model reduction. All control design problems reduced to one critical theorem in linear algebra. ",MAE 280A,,,,,,,,,
MAE 281A,Nonlinear Systems,4,"Existence and uniqueness of solutions of EDE’s, sensitivity equations. Stability, direct and converse Lyapunov theorems, LaSalle’s theorem, linearization, invariance theorems. Center manifold theorem. Stability of perturbed systems with vanishing and nonvanishing perturbations, input-to-state ability, comparison method. Input-output stability. Perturbation theory and averaging. Singular perturbations. Circle and Popov criteria. ",MAE 280A,,,,,,,,,
MAE 281B,Nonlinear Control,4,"Small gain theorem, passivity. Describing functions. Nonlinear controllability, feedback linearization, input-state and input-output linearization, zero dynamics. Stabilization, Brockett’s necessary conditions (local), control Lyapunov functions, Sontag’s formula (global). Integrator back stepping, forwarding. Inverse optimality, stability margins. Disturbance attenuation, deterministic and stochastic, nonlinear H-infinity. Nonlinear observers. ",MAE 281A,,,,,,,,,
MAE 283A,Parametric Identification: Theory and Methods,4,"Constructing dynamical models from experimental data. Deterministic and stochastic discrete time signals. Discrete time systems. Nonparametric identification: correlation and spectral analysis. Parametric identification: realization and prediction error methods, least squares estimation, approximate modeling. Experiment design. Frequency domain identification. Recommended preparation: MAE 143C.",,,,,,,,,,
MAE 283B,Approximate Identification and Control,4,"Identification for control: approximate identification, estimation of models via closed-loop experiments. Closed-loop identification techniques. Estimation of model uncertainty. Model invalidation techniques. Iterative techniques for model estimation and control design. ",MAE 283A,,,,,,,,,
MAE 284,Robust and Multivariable Control,4,"Multivariable feedback systems: transfer function matrices, Smith-McMillan form, poles, zeros, principal gains, operator norms, limits on performance. Model uncertainties, stability and performance robustness. Design of robust controllers, H_inf and mu synthesis. Controller reduction. ",MAE 141B or MAE 280A,,,,,,,,,
MAE 285,Design of Micro/Nanoacoustofluidic Devices,4,"Acoustofluidics is a burgeoning field reliant on high frequency acoustics and underpinning many new developments and devices at micro to nano scales. First the basics, piezoelectricity, microfluidics, acoustics, and device metrology. Then, new physics arising from the unusually large accelerations (10^7 to 10^9 m/s^2) induced by acoustic waves. Finally, how various phenomena of acoustofluidics at small scales can be used in designing practical devices. ","MAE 210A or CENG 210A,","MAE 210B, graduate standing, or consent of instructor",,,,,,,,
MAE 286,Hybrid Systems,4,"Definition of hybrid system. Examples in mechanics, vision, and multi-agent systems. Trajectories of hybrid systems. Chattering, Zeno phenomena. Stability analysis. Arbitrary switching: common Lyapunov functions. Slow switching: dwell time. State-dependent switching: multiple Lyapunov functions, Invariance Principle. Hybrid control design. Applications. ",MAE 281A or consent of instructor,,,,,,,,,
MAE 287,Control of Distributed Parameter Systems,4,Lyapunov stability; exact solutions to PDEs; boundary control of parabolic PDEs (reaction-advection-diffusion and other equations); boundary observer design; control of complex-valued PDEs (Schrodinger and Gunzburg-Landau equations); boundary control of hyperbolic PDEs (wave equations) and beam equations; control of first-order hyperbolic PDEs and delay equations; control of Navier-Stokes equations; motion planning for PDEs; elements of adaptive control for PDEs and control of nonlinear PDEs. ,,,,,,,,,,Graduate standing or consent of instructor.
MAE 288A,Optimal Control,4,"Deterministic methods: Pontryagin’s Maximum Principle, dynamic programming, calculus of variations. Stochastic methods: Gauss-Markov processes, Linear Quadratic control, Markov chains. Linear Quadratic Gaussian Control and the Separation Principle. ",,,,,,,,,,Graduate standing or consent of instructor.
MAE 288B,Optimal Estimation,4,"Least Squares and Maximum Likelihood Estimation methods, Gauss-Markov models, State Estimation and Kalman Filtering, prediction and smoothing. The extended Kalman filter. ","MAE 280A completed or concurrent, or consent of instructor",,,,,,,,,
MAE 289A,Mathematical Analysis for Applications,4,"Topics in mathematical analysis, with the emphasis on those of use in applications. The topics may include metric spaces, open and closed sets, compact sets, continuity, differentiation, series of functions and uniform convergence, convex sets and functions, transforms, and Stokes theorem. ",,,,,,,,,,Graduate standing or consent of instructor.
MAE 289B,Real Analysis for Applications,4,"Topics in real analysis, with the emphasis on those of use in applications. May include countable/uncountable, open and closed sets, topology, Borel sets, sigma algebras, measurable functions, integration (Lebesgue), absolute continuity, function spaces, and fixed-point theorems. ","MAE 289A, graduate standing, or consent of instructor",,,,,,,,,
MAE 289C,Functional Analysis and Applications,4,"Topics in functional analysis, with the emphasis on those of use in applications. May include function spaces, linear functionals, dual spaces, reflexivity, linear operators, strong and weak convergence, Hahn-Banach Theorem, nonlinear functionals, differential calculus of variations, Pontryagin Maximum Principle. Students cannot obtain credit for MAE 289C if they have taken MAE 289. ","MAE 289B, graduate standing, or consent of instructor",,,,,,,,,
MAE 290A,Numerical Linear Algebra,4,"Fundamental concepts in numerical linear algebra. Fundamental matrix decompositions: LU, Cholesky, QR, Eigen, Schur, Jordan, SVD; how to compute them. Solution of large linear systems via iterative methods (Lanczos, Arnoldi, CG, GMRES). Stability of algorithms and conditioning of mathematical problems. Finite precision arithmetic and roundoff issues. Additional topics may include randomized methods for computing SVD/QR and solution of Lyapunov/Riccati equations for high-dimensional systems. ",,,,,,,,,,Graduate standing or consent of instructor.
MAE 290B,Numerical Methods for Differential Equations,4,"Numerical solution of differential equations in mathematical physics and engineering, ordinary and partial differential equations. Linear and nonlinear hyperbolic parabolic, and elliptic equations, with emphasis on prototypical cases, the convection-diffusion equation, Laplace’s and Poisson equation. Finite difference methods. ",MAE 290A or consent of instructor,,,,,,,,,
MAE 290C,Computational Fluid Dynamics,4,"Numerical methods in fluid dynamics and convective transport processes. Numerical solution of the Euler and Navier-Stokes equation. Additional topics will vary according to instructor. Examples include eigenvalue problems in hydrodynamic stability, vortex methods, spectral and panel methods. Students may not receive credit for both MAE 290C and MAE 223. ","MAE 210A-B, 290A-B",,,,,,,,,
MAE 291,Design and Mechanics in Computer Technology,4,"Design and mechanics problems inherent in computer peripherals such as disk files, tape drives, and printers. Formulation and solution of problems involving mechanics, fluid mechanics, and materials; Reynolds equation, slider bearings; friction and wear; actuator design, impact printing; silicon fluid jets. ",,,,,,,,,,Consent of instructor. (Not offered every year.)
MAE 292,Computer-Aided Design and Analysis,4,"Introduction to 2-D and 3-D computer-aided design. Design problems may include ball bearing kinematics, Weibull statistics, nonrepeatable spindle run-out, four bar linkages, beam deflection and vibration, design of magnetic head suspension, hydrodynamic theory of lubrication, air bearings, heat transfer, optical servo, design of ink jet print head. ",,,,,,,,,,Consent of instructor. (Not offered every year.)
MAE 293,Flow Control,4,"Intersection of control theory and fluid mechanics. Applications: transition delay, turbulence mitigation, noise reduction, weather forecasting, shape optimization, and UAV’s (perching). Tractable feedback (Riccati-based) formulations via parallel and parabolic flow assumptions. Regularization of variational (adjoint-based) formulations for MPC and MHE. EnKF and EnVE approaches for forecasting. ",MAE 290A or consent of instructor,,,,,,,,,
MAE 294A,Introduction to Applied Mathematics,4,(Cross-listed with SIO 203A.) Review of exact methods for ordinary differential equations. Expansions about regular and irregular singular points. Introduction to asymptotic expansions. Approximate methods for nonlinear differential equations. Regular and singular perturbation theory. Additional topics depending upon the interests of the instructor.,,,,,,,,,,
MAE 294B,Introduction to Applied Mathematics II,4,"(Cross-listed with SIO 203B.) Asymptotic methods: method of steepest descent (if not covered in I) WKB, method of multiple scales, boundary layer theory. Elements of complex analysis. ",MAE 294A or SIO 203A or consent of instructor,,,,,,,,,
MAE 294C,Introduction to Applied Mathematics III,4,"(Cross-listed with SIO 203C.) Partial differential equations: characteristics, similarity solutions, Green’s functions, images, wave equation, diffusion equation, Laplace’s equation. Applications to continuum mechanics, potential fields, and transport phenomena such as diffusion, linear and nonlinear waves, Burger’s equation and shocks. Other topics according to the interests of the instructor. ","MAE 294B, or SIO 203B, or SIO 215B, or consent of instructor",,,,,,,,,
MAE 295,Field Study,1–12,Provides field study in industry with faculty supervision. Analysis and problem solving using real world applications. ,,,,,,,,,,Consent of adviser and department; 3.0 GPA.
MAE 296,Independent Study,1–4,Independent reading or research on a problem as arranged by a designated faculty member. Must be taken for a letter grade only. ,,,,,,,,,,Consent of instructor.
MAE 298,Directed Group Study,1–4,"Directed group study on a topic or in a field not included in regular department curriculum, by special arrangement with a faculty member. ",,,,,,,,,,Consent of instructor. (S/U grades permitted.)
