course_code,name,units,desc,prereq1,prereq2,prereq3,prereq4,prereq5,prereq6,prereq7,prereq8,prereq9,misc_prereq
MAE 02,Introduction to Aerospace Engineering,4,"An introduction to topics in aeronautical and astronautical engineering including aerodynamics, propulsion, flight mechanics, structures, materials, orbital mechanics, design, mission planning, and environments. General topics include historical background, career opportunities, engineering ethics, and professionalism. ",,,,,,,,,,
MAE 03,Introduction to Mechanical Design,4,"Introduction to design process through hands-on individual and team projects. Topics include 2D/3D CAD (drawing projections/isometrics, dimensioning), design problem identification, prototype fabrication techniques (shop skills, rapid prototyping), design process (concept generation/selection, risk reduction strategies, scheduling), learning from hardware performance (problem solving/redesign), teamwork. Use of components: fasteners, couplings, DC motors, oral/written communication with graphics. Program or materials fees may apply. ",PHYS 2A or 4A,,,,,,,,,"Enrollment restricted to BE 25, MC 25, MC 27, MC 29, and MC 30–37 majors only."
MAE 05,Quantitative Computer Skills,4,"Introductory course for nonengineering majors. Use of computers in solving problems; applications from life sciences, physical sciences, and engineering. Students run existing computer programs and complete some programming in BASIC. ",,,,,,,,,,
MAE 07,Spatial Visualization,1,"(Cross-listed with SE 7.) Spatial visualization is the ability to manipulate 2-D and 3-D shapes in one’s mind. In this course, students will perform exercises that increase their spatial visualization skills. P/NP grades only. Students may not receive credit for SE 7 and MAE 7. ",,,,,,,,,,
MAE 08,MATLAB Programming for Engineering Analysis,4,"Computer programming in MATLAB with elementary numerical analysis of engineering problems. Arithmetic and logical operations, arrays, graphical presentation of computations, symbolic mathematics, solutions of equations, and introduction to data structures. ",MATH 20A,20B or consent of instructor,,,,,,,,
MAE 11,Thermodynamics,4,"Fundamentals of engineering thermodynamics: energy, work, heat, properties of pure substances, first and second laws for closed systems and control volumes, gas mixtures. Application to engineering systems, power and refrigeration cycles, combustion. Renumbered from MAE 110A. Students may not receive credit for MAE 11 and MAE 110A. ",PHYS 2C,CHEM 6A,,,,,,,,Enrollment restricted to engineering majors only.
MAE 20,Elements of Materials Science,4,"The structure of materials: metals, ceramics, glasses, semiconductors, superconductors, and polymers to produce desired, useful properties. Atomic structures. Defects in materials, phase diagrams, microstructural control. Mechanical and electrical properties are discussed. Time temperature transformation diagrams. Diffusion. ","PHYS 2A or 4A, CHEM 6A or CHEM 6AH,",MATH 20C,,,,,,,,
MAE 21,Aerospace Materials Science,4,"Atomic structure and physical properties of engineering materials including metals, ceramics, glasses, polymers, and composite materials. Defects and phase diagram of materials. Material testing and processing. Program or materials fees may apply. ","PHYS 2A or 4A, CHEM 6A or CHEM 6AH,",MATH 20B,,,,,,,,Enrollment restricted to MC 25 majors only.
MAE 30A,Statics and Introduction to Dynamics,4,"Statics: statics of particles and rigid bodies in 3-D. Free body diagrams. Moment of a force, couples, equivalent systems of forces. Distributed forces, centroids, and centers of gravity. Introduction to dynamics: 3-D relative motion, kinematics, and kinetics of particles. Newton’s equations of motion. Equilibrium problems with friction. Enrollment restricted to engineering majors MC 25, MC 27, MC 29, MC 30–34, and SE 27. ",PHYS 2A,MATH 31BH or MATH 20C,,,,,,,,
MAE 30B,Dynamics and Vibrations,4,"Dynamics: energy methods for motion of particles and rigid bodies, including virtual work, power, and Lagrange’s equations. Impact and impulses. Systems of particles. Introduction to 3-D dynamics of rigid bodies. Introduction to vibrations: free and harmonically forced vibrations of undamped and damped single degree of freedom systems. Enrollment restricted to engineering majors only MC 25, MC 27, MC 29, MC 30–34, and SE 27. ",MAE 30A,,,,,,,,,
MAE 40,Linear Circuits,4,"Steady-state and dynamic behavior of linear, lumped-parameter electrical circuits. Kirchhoff’s laws. RLC circuits. Node and mesh analysis. Operational amplifiers. Signal acquisition and conditioning. Electric motors. Design applications in engineering. ",MATH 20D,"MATH 31AH or MATH 18 or MATH 20F,",PHYS 2B,,,,,,,
MAE 87,First-year Student Seminar,1,"The First-year Student Seminar program is designed to provide new students with the opportunity to explore an intellectual topic with a faculty member in a small seminar setting. First-year student seminars are offered in all campus departments and undergraduate colleges. Topics vary from quarter to quarter. Enrollment is limited to fifteen to twenty students, with preference given to entering first-year students. ",,,,,,,,,,
MAE 92A,"Design Competition—Design, Build, and Fly Aircraft",1,"(Cross-listed with SE 10A.) Student teams design, build, and fly unmanned aircraft for a national student competition. Students concentrate on vehicle system design including aerodynamics, structures, propulsion, and performance. Teams engineering, fabricate the aircraft, submit a design report, and prep aircraft for competition. ",,,,,,,,,,Consent of instructor.
MAE 93,"Design Competition—Design, Build, and Test Race Car",1,"Student teams design, build, and test a formula-style racing car for an international student competition. Students concentrate on vehicle system analysis and design, manufacturability and performance. Teams engineer, fabricate car, submit a design report and prep car for competition. ",,,,,,,,,,Department approval.
MAE 94,Rocketry Competitions—Design and Build Rockets and Space Systems,1,"Student teams design, build, and test different components of rockets and cubesats for national level competitions. Students will be involved in planning, designing, manufacturing, and testing various systems. Team engineers will focus on the feasibility of manufacturing and performance for the targeted competitions. Final design reports will be prepared by the teams.",,,,,,,,,,
MAE 98,Directed Group Study,2,"Directed group study on a topic or in a field not included in the regular departmental curriculum. P/NP grades only. May be taken for credit two times. Credit may not be received for a course numbered 97, 98, or 99 subsequent to receiving credit for a course numbered 197, 198, or 199. ",,,,,,,,,,Department approval. 
MAE 99H,Independent Study,1,Independent study or research under direction of a member of the faculty. ,,,,,,,,,,Student must be of first-year standing and a Regent’s Scholar; approved Special Studies form.
MAE 101A,Introductory Fluid Mechanics,4,"Fluid statics; fluid kinematics; integral and differential forms of the conservation laws for mass, momentum, and energy; Bernoulli equation; potential flows; dimensional analysis and similitude. ",PHYS 2A or 4A,MATH 20D,"MATH 20E or MATH 31CH, or consent of instructor",,,,,,,"Enrollment restricted to MC 25, MC 27, MC 29, and MC 30–34 majors only."
MAE 101B,Advanced Fluid Mechanics,4,"Laminar and turbulent flow. Pipe flow including friction factor. Boundary layers, separation, drag, and lift. Compressible flow including shock waves. ","MAE 101A or CENG 101A,","MAE 11 or MAE 110A or CENG 102, or consent of instructor",,,,,,,,
MAE 101C,Heat Transfer,4,"Extension of fluid mechanics in MAE 101A–B to viscous, heat-conducting flows. Application of the energy conservation equation to heat transfer in ducts and external boundary layers. Heat conduction and radiation transfer. Heat transfer coefficients in forced and free convection. Design applications. ","MAE 101A or CENG 101A, MAE 101B,",MAE 105,,,,,,,,
MAE 101D,Intermediate Heat Transfer,4,"Course builds on the MAE fluids sequence, offering more advanced concepts in conduction, convection, radiation, and heat exchanger design. This course covers numerical methods in conduction, boiling, condensation and evaporation analysis, natural and turbulent convection, spectral and directional radiative transfer, heatpipes, thermal design of spacecraft, heat exchanger analysis and design. ",,,,,,,,,,"Senior standing and MAE 101C, or consent of instructor."
MAE 104,Aerodynamics,4,Basic relations describing flow field around wings and bodies at subsonic and supersonic speed. Thin-wing theory. Slender-body theory. Formulation of theories for evaluating forces and moments on airplane geometries. Application to the design of high-speed aircraft. ,MAE 101A,"101B, or consent of instructor",,,,,,,,"Enrollment restricted to MC 25, MC 27, MC 29, MC 30–34, and SE 27 majors only."
MAE 105,Introduction to Mathematical Physics,4,"Fourier series, Sturm Liouville theory, elementary partial differential equations, integral transforms with applications to problems in vibration, wave motion, and heat conduction. ",PHYS 2A,"B,",MATH 20D or 21D,,,,,,,Enrollment restricted to engineering majors only.
MAE 107,Computational Methods in Engineering,4,"Introduction to scientific computing and algorithms; iterative methods, systems of linear equations with applications; nonlinear algebraic equations; function interpolation and differentiation and optimal procedures; data fitting and least-squares; numerical solution of ordinary differential equations. ","MAE 8 or 9,",MATH 18 or 20F or 31AH,,,,,,,,
MAE 108,Probability and Statistical Methods for Mechanical Engineering,4,"Probability theory, conditional probability, Bayes theorem, random variables, densities, expected values, characteristic functions, central limit theorem. Engineering reliability, elements of estimation, random sampling, sampling distributions, hypothesis testing, confidence intervals. Curve fitting and data analysis. Students cannot receive credit for MAE 108 and ECE 109, ECON 120A, MATH 180A, MATH 183, MATH 186, or SE 125. ",MATH 18 or 20F,,,,,,,,,
MAE 110,Thermodynamic Systems,4,"Thermodynamic analysis of power cycles with application to combustion driven engines: internal combustion, diesel, and gas turbines. Thermodynamics of mixtures and chemical and phase equilibrium. Computational methods for calculating chemical equilibrium. Renumbered from MAE 110B. Students may not receive credit for MAE 110 and MAE 110B. ",MAE 11 or 110A,,,,,,,,,(Course not offered every year.)
MAE 113,Fundamentals of Propulsion,4,"Compressible flow, thermodynamics, and combustion relevant to aircraft and space vehicle propulsion. Analysis and design of components for gas turbines, including turbines, inlets, combustion chambers and nozzles. Fundamentals of rocket propulsion. ","MAE 11 or MAE 110A or CENG 102,","MAE 101A or CENG 101A,",MAE 101B or CENG 101C,,,,,,,"Enrollment restricted to MC 25, MC 27, MC 29, and MC 30–34 majors only."
MAE 114,Space Propulsion,4,"This course covers the fundamentals of rocket propulsion and discusses advanced concepts in space propulsion. Topics include liquid and solid propellant rocket engines, electrical rocket propulsion, nuclear propulsion devices, solar-powered vehicles, and current challenges and opportunities in launch vehicle technologies. ",MAE 113,,,,,,,,,
MAE 117A,Elementary Plasma Physics,4,"(Cross-listed with Physics 151.) Particle motions, plasmas as fluids, waves, diffusion, equilibrium and stability, nonlinear effects, controlled fusion. Recommended preparation: PHYS 100B–C or ECE 107. ","MATH 20D or 21D, or consent of instructor",,,,,,,,,
MAE 118,Introduction to Energy and Environment,4,"Overview of present-day primary energy sources and availability: fossil fuel, renewable, and nuclear; heat engines; energy conservation, transportation, air pollution, and climate change. Students may not receive credit for both MAE 118 and MAE 118A. ","MAE 101A or CENG 101A, or consent of instructor",,,,,,,,,
MAE 119,Introduction to Renewable Energy: Solar and Wind,4,"Basic principles of solar radiation—diffuse and direct radiation; elementary solar energy engineering—solar thermal and solar photovoltaic; basic principles of wind dynamics—hydrodynamic laws, wind intermittency, Betz’s law; elementary wind energy engineering; solar and wind energy perspectives; operating the California power grid with 33 percent renewable energy sources. Students may not receive credit for both MAE 118B and MAE 119. ",PHYS 2C or consent of instructor,,,,,,,,,
MAE 120,Introduction to Nuclear Energy,4,Overview of basic fission and fusion processes. Elementary fission reactor physics and engineering; environmental and waste disposal issues. Survey of fusion technology issues and perspectives. May not receive credit for both MAE 118C and MAE 120. ,"MAE 101A or CENG 101A, or consent of instructor",,,,,,,,,
MAE 121,Air Pollution Transport and Dispersion Modeling,4,Overview of air pollution and wastes and their impact. Characteristics of air pollutants. Air pollution transport. Atmospheric stability. Plume rise and dispersion. Meteorological data. Selecting the appropriate air quality model and case studies. Modeling complex terrain situations. Current air quality modeling issues. Laws and regulations to control air pollution. ,MAE 122,,,,,,,,,
MAE 122,Flow and Transport in the Environment,4,"Introduction to the air and aquatic environments. Buoyancy, stratification, and rotation. Earth surface energy balance. Introduction to the atmospheric boundary layer. Advection and diffusion. Turbulent diffusion and dispersion in rivers and in the atmospheric boundary layer. Surface waves and internal gravity waves. ","MAE 101A or CENG 101A, or consent of instructor",,,,,,,,,
MAE 123,Introduction to Transport in Porous Media,4,Introduction to groundwater flow. Pollution transport through the water table. Fundamentals of flow. Single- and multi-phase flow. Darcy law. Well hydraulics. Diffusion and dispersion. Gravity currents and plumes in porous media. Chemistry of fluid-solid interactions. Fundamentals of adsorption and surface reactions. ,"MAE 105, or consent of instructor",,,,,,,,,
MAE 125,Building Energy Efficiency,4,"Physical building performance including building thermodynamics, daylighting, and solar control. Heat transfer through building envelope, solar geometry, and shading. Heating, ventilation, and air conditioning system design, water heating, microclimates, passive system design, energy efficient design, applicant energy use, cost estimating. Building energy codes and standards. Building design project with whole building energy simulation software. ",,,,,,,,,,Upper-division standing.
MAE 126A,Environmental Engineering Laboratory,4,"Analysis of experiments in Environmental Engineering: Drag in a water tunnel, shading effects on solar photovoltaic, buoyant plume dispersion in a water tank, atmospheric turbulence, and others. Use of sensors and data acquisition. Laboratory report writing; error analysis; engineering ethics. ",MAE 101A or CENG 101A,,,,,,,,,MAE 170.
MAE 126B,Environmental Engineering Design,4,"Fundamental principles of environmental design. Building a working prototype or computer model for an environmental engineering application. Work in teams to propose and design experiments and components, obtain data, complete engineering analysis, and write a report. Engineering ethics and professionalism. ",MAE 126A,,,,,,,,,
MAE 130,Advanced Vibrations,4,"Harmonically excited vibrations. Vibration of multiple degree-of-freedom systems. Observations, including beat frequencies, static and dynamic coupling, traveling, and standing wave phenomena. Vibration of continuous systems. Hamilton’s equations. Distributed and point forces and moments in continuous systems and the generalized Dirac distribution. Response to impact and impulse excitation. Modeling continuous systems with approximate discrete models. Restricted to engineering majors only MC 25, MC 27, MC 29, MC 30–34, MO 21, SE 27. ",MATH 18 or MATH 20F or MATH 31AH,MAE 30B or MAE 130B,,,,,,,,
MAE 131A,Solid Mechanics I,4,Concepts of stress and strain. Hooke’s Law. Axial loading of bars. Torsion of circular shafts. Shearing and normal stresses in beam bending. Deflections in beams. Statically determinate and indeterminate problems. Combined loading. Principal stresses and design criteria. Buckling of columns. ,MATH 20D,MAE 30A or MAE 130A or SE 101A,,,,,,,,
MAE 131B,Fundamentals of Solid Mechanics II,4,Analysis of 3-D states of stress and strain. Governing equations of linear elasticity. Solution of elasticity problems in rectangular and polar coordinates. Stress concentration. Failure criteria. Torsion of noncircular and thin walled members. Energy methods. Plastic collapse and limit analysis. ,MAE 131A or SE 110A,MAE 105,,,,,,,,Enrollment restricted to engineering majors only.
MAE 133,Finite Element Methods in Mechanical and Aerospace Engineering,4,"Development of stiffness and mass matrices based upon variational principles and application to static, dynamic, and design problems in structural and solid mechanics. Architecture of computer codes for linear and nonlinear finite element analysis. The use of general-purpose finite element codes. ",MAE 131A or SE 110A,,,,,,,,,(Not offered every year.)
MAE 142,Dynamics and Control of Aerospace Vehicles,4,"The dynamics of vehicles in space or air are derived for analysis of the stability properties of spacecraft and aircraft. The theory of flight, lift, drag, Dutch roll and phugoid modes of aircraft are discussed. Optimal state space control theory for the design of analog and digital controllers (autopilots). ",MAE 104,"MAE 143B or ECE 171A, or consent of instructor",,,,,,,,Enrollment restricted to engineering majors only.
MAE 143A,Signals and Systems,4,"Dynamic modeling and vector differential equations. Concepts of state, input, output. Linearization around equilibria. Laplace transform, solutions to ODEs. Transfer functions and convolution representation of dynamic systems. Discrete signals, difference equations, z-transform. Continuous and discrete Fourier transform. ","MATH 20D or 21D, MATH 20E, MATH 18 or 20F or 31AH, or consent of instructor",,,,,,,,,
MAE 143B,Linear Control,4,"Analysis and design of feedback systems in the frequency domain. Transfer functions. Time response specifications. PID controllers and Ziegler-Nichols tuning. Stability via Routh-Hurwitz test. Root locus method. Frequence response: Bode and Nyquist diagrams. Dynamic compensators, phase-lead and phase-lag. Actuator saturation and integrator wind-up. ",MAE 143A or consent of instructor,,,,,,,,,
MAE 144,Embedded Control and Robotics,4,"Each student builds, models, programs, and controls an unstable robotic system built around a small Linux computer. Review/synthesis of: A) modern physical and electrical CAD. B) dynamics, signals and systems, linear circuits; PWMs, H-bridges, quadrature encoders. C) embedded Linux, C, graphical programming; multithreaded applications; bus communication to supporting ICs. D) classical control theory in both continuous-time (CT) and discrete-time (DT); interconnection of CT and DT elements. Program or materials fees may apply. ",,,,,,,,,,"Upper-division standing or graduate student, and MAE 143B or BENG 122A or ECE 171A, or consent of instructor."
MAE 145,Introduction to Robotic Planning and Estimation,4,"This course is an introduction to robotic planning algorithms and programming. Topics include sensor-based planning (bug algorithms), motion planning via decomposition and search (basic search algorithms on graphs, A*), the configuration-space concept, free configuration spaces via sampling, collision detection algorithms, (optimal) planning via sampling (probabilistic trees), environment roadmaps, and filtering for robot localization and environment mapping (SLAM). ","MAE 8, MAE 108,",senior standing or consent of instructor,,,,,,,,
MAE 146,Introduction to Machine Learning Algorithms,4,"An introduction to the principles used to design and implement machine learning algorithms, as well as an understanding of their advantages and limitations. The topics covered are python review, supervised learning (linear, logistic/sigmoid regression, generalized linear models, nonlinear regression via Kernels), neural network types (convolutional, recurrent, deep NN), unsupervised learning (k-means clustering). Application of ML in different examples. Recommended preparation: ECE 143 and/or python programming knowledge. ",(MATH 31AH or MATH 18),(MATH 20C or MATH 31BH),MAE 8,(MAE 108 or ECE 109 or SE 125 or MATH 186 or MATH 183 or MATH 180A or ECON 120A),,,,,,
MAE 148,Introduction to Autonomous Vehicles,4,"(Cross-listed with ECE 148.) Fundamentals of autonomous vehicles. Working in small teams, students will develop 1/8-scale autonomous cars that must perform on a simulated city track. Topics include robotics system integration, computer vision, algorithms for navigation, on-vehicle vs. off-vehicle computation, computer learning systems such as neural networks, locomotion systems, vehicle steering, dead reckoning, odometry, sensor fusion, GPS autopilot limitations, wiring, and power distribution and management. ",ECE 15 or ECE 35 or MAE 2 or MAE 3,department approval,,,,,,,,
MAE 149,Sensor Networks,4,"(Cross-listed with ECE 156.) Characteristics of chemical, biological, seismic, and other physical sensors; signal processing techniques supporting distributed detection of salient events; wireless communication and networking protocols supporting formation of robust censor fabrics; current experience with low power, low-cost sensor deployments. Students may not receive credit for both MAE 149 and ECE 156. May be coscheduled with SIOC 238. ",,,,,,,,,,Upper-division standing. (Not offered every year.)
MAE 150,Computational Methods for Design,4,"Computer-aided analysis and design. Design methodology, tolerance analysis, Monte Carlo analysis, kinematics and computer-aided design of linkages, design of cams and cam dynamics, design optimization, finite element analysis fundamentals, design using commercially available CAD and analysis software. ","MAE 30A or MAE 130A or SE 101A or BENG 110, MAE 107 or SE 121, MAE 3 or MAE 2,","senior standing in engineering major, or consent of instructor",,,,,,,,
MAE 152,Introductions to Manual and CNC Machining,1,"In this class, students are introduced to precision machining. Students will learn the proper safe operating procedures of a manual mill and lathe, band saws, and hand tools. Other topics include the basics of tolerancing, design (Fusion 360), and operation of CNC milling and turning. Program or materials fees may apply. Recommended preparation: It is recommended that students take introduction to design process through a hands-on design project course or some other introduction to shop course. ",MAE 3,,,,,,,,,
MAE 154,Product Design and Entrepreneurship,4,"This course will teach teams of students how to develop concepts and business plans in the design of new and innovative products. Emphasis will be placed on identifying user needs, concept generation, and prototype fabrication. ",,,,,,,,,,Upper-division standing and consent of instructor.
MAE 155A,Aerospace Engineering Design I,4,"Fundamental principles of aerospace vehicle design including the conceptual, preliminary, and detailed design phases. Aeronautical or astronautical design project that integrates all appropriate engineering disciplines as well as issues associated with optimization, teamwork, manufacturability, reporting, and professionalism. ","MAE 2, MAE 21, or SE 2 or SE 104, MAE 104, MAE 30B or MAE 130C,","SE 160A, or consent of instructor",,,,,,,,
MAE 155B,Aerospace Engineering Design II,4,"The principles of aerospace vehicle design including the conceptual, preliminary, and detailed design phases. Aeronautical or astronautical design project that integrates all appropriate engineering disciplines as well as issues associated with optimization, teamwork, manufacturability, reporting, and professionalism. Program or materials fees may apply. ","MAE 113, MAE 142, MAE 155A,","MAE 170, or consent of instructor",,,,,,,,
MAE 156A,Fundamental Principles of Mechanical Design I,4,Fundamental principles of mechanical design and the design process. Application of engineering science to the design and analysis of mechanical components. Initiation of team design projects that culminate in MAE 156B with a working prototype designed for a real engineering application. Professional ethics discussed. Program or materials fees may apply. ,"MAE 3, MAE 30B, MAE 131A, MAE 150,","MAE 170, or consent of instructor",,,,,,,,Open to major codes MC 27 and MC 30–34 only.
MAE 156B,Fundamental Principles of Mechanical Design II,4,Fundamental principles of mechanical design and the design process. Culmination of a team design project initiated in MAE 156A which results in a working prototype designed for a real engineering application. ,"MAE 156A in the immediately preceding quarter, MAE 101C, MAE 143B,",MAE 160 or MAE 131B,,,,,,,,Open to major codes MC 27 and MC 30–34 only.
MAE 160,Mechanical Behavior of Materials,4,"Elasticity and inelasticity, dislocations and plasticity of crystals, creep, and strengthening mechanisms. Mechanical behavior of ceramics, composites, and polymers. Fracture: mechanical and microstructural. Fatigue. Laboratory demonstrations of selected topics. ","MAE 20, MAE 30A or MAE 130A or SE 101A,","MAE 131A, or consent of instructor",,,,,,,,
