course_code,name,units,desc,prereq1,prereq2,prereq3,prereq4,prereq5,prereq6,prereq7,prereq8,prereq9,misc_prereq
MUS 150,Jazz and the Music of the African Diaspora: Special Topics Seminar,4,An in-depth writing and listening intensive investigation into a jazz or diaspora-related music history topic. Topics vary from year to year. May be repeated once for credit. ,"MUS 126/ETHN 178, or MUS 127/ETHN 179, or consent of instructor",,,,,,,,,
MUS 151,"Race, Culture, and Social Change",4,Aggrieved groups generate distinctive cultural expressions by turning negative ascription into positive affirmation and by transforming segregation into congregation. This course examines the role of cultural expressions in struggles for social change by these communities inside and outside the United States. (Cross-listed with ETHN 108.) ,,,,,,,,,,Upper-division standing or consent of instructor.
MUS 152,Hip Hop: The Politics of Culture,4,"Examination of hip hop’s music, technology, lyrics, and its influence in graffiti, film, music video, fiction, advertising, gender, corporate investment, government, and censorship with a critical focus on race, gender, popular culture, and the politics of creative expression. (Cross-listed with ETHN 128.) ",,,,,,,,,,Upper-division standing or consent of instructor.
MUS 153,African Americans and the Mass Media,4,"Examination of media representations of African Americans from slavery to the present focusing on emergence and transmission of enduring stereotypes, their relationship to changing social, political, and economic frameworks, and African Americans’ responses to and interpretations of these mediated images. (Cross-listed with ETHN 164.) ",,,,,,,,,,Upper-division standing or consent of instructor.
MUS 160A,Senior Project in Computing Arts I,4,"Students pursue projects of their own design over two quarters with support from faculty in a seminar environment. Project proposals are developed, informed by project development guidelines from real world examples. Collaborations are possible. Two production-course limitation. Renumber from ICAM 160A. Students may receive credit for only one of the following: MUS 160A, VIS 160A, ICAM 160A. ",VIS 141B or VIS 145B or VIS 147B or MUS 172,,,,,,,,,Open to music and ICAM majors only. Department stamp required.
MUS 160B,Senior Project in Computing Arts II,4,"Continuation of MUS 160A or VIS 160A. Completion and presentation of independent projects along with documentation. Two production-course limitation. Renumbered from ICAM 160B. Students may receive credit for only one of the following: MUS 160B, VIS 160B, ICAM 160B. ",MUS 160A or VIS 160A,,,,,,,,,Open to music and ICAM majors only. Department stamp required.
MUS 170,Musical Acoustics,4,(Formerly MUS 160A.) An introduction to the acoustics of music with particular emphasis on contemporary digital techniques for understanding and manipulating sound. ,"MUS 1A, 2A, or 4",,,,,,,,,
MUS 171,Computer Music I,4,"(Formerly MUS 160C.) A practical introduction to computer techniques for desktop audio editing, MIDI control, and real-time music algorithms using the MAX programming environment. Recommended preparation: completion of MUS 170. ",,,,,,,,,,"Upper-division standing; restricted to music majors, ICAM-music and ICAM-visual arts majors and minors, or consent of instructor."
MUS 172,Computer Music II,4,"(Formerly MUS 161.) Computer synthesis techniques including wavetable and additive synthesis, waveshaping, and sampling. Transformation of musical sounds using filters, modulation, and delay effects. Fourier analysis of sounds. ",MUS 171 (formerly MUS 160C),,,,,,,,,"Music majors, ICAM-music and ICAM-visual arts majors and minors, or consent of instructor."
MUS 173,Electronic Music Production and Composition,4,"(Formerly MUS 162.) Creative music production using digital audio workstations (DAWs), emphasizing hands-on composition projects including tempo warping, beat and tonality matching, virtual drum kits, chord progressions, sound processing and effects, arrangement, and remixing in the context of both popular and experimental genres. Existing works are analyzed and dissected for aesthetic value and production technique. ",,,,,,,,,,"Upper-division standing; restricted to music, ICAM-music, and ICAM-visual arts majors and minors, or consent of instructor."
MUS 174A,Audio/MlDI Studio Techniques I,4,"First class in a yearlong sequence. Surveys hardware and software resources in an advanced analog/digital and media studio. Required course for use of the studio. Topics include: electronic and computer music, digital and analog audio signal mixing and manipulation, studio devices, interfacing, compositional applications, MIDI synchronization, performance and student projects. 174A focuses on signals, mics, device-based recording, mixing, monitoring. ",MUS 170,,,,,,,,,"Restricted to music, ICAM-music, and ICAM-visual arts majors and minors, or consent of instructor."
MUS 174B,Audio/MlDI Studio Techniques II,4,"Second class in a yearlong sequence. Surveys hardware and software resources in an advanced analog/digital and media studio. Required course for use of the studio. Topics include: electronic and computer music, digital and analog audio signal mixing and manipulation, studio devices, interfacing, compositional applications, MIDI synchronization, performance and studio techniques, and student projects. 174B focuses on digital audio workstations, computer-based mixing and editing, sound file transformation. ","MUS 170, MUS 174A",,,,,,,,,"Restricted to music, ICAM-music, and ICAM-visual arts majors and minors, or consent of instructor."
MUS 174C,Audio/MlDI Studio Techniques III,4,"Third class in a yearlong sequence. Surveys hardware and software resources in an advanced analog/digital and media studio. Required course for use of the studio. Topics include: electronic and computer music, digital and analog audio signal mixing and manipulation, studio devices, interfacing, compositional applications, MIDI synchronization, performance and studio techniques, and student projects. 174C focuses on MIDI, synchronization, and sound-for-picture. ","MUS 170, MUS 174B",,,,,,,,,"Restricted to music, ICAM-music, and ICAM-visual arts majors and minors, or consent of instructor."
MUS 175,Musical Psychoacoustics,4,"Survey of psychoacoustical phenomena, theories of hearing, and their relation to musical perception and cognition. Techniques of psychoacoustical experimentation. ",MUS 170 recommended,,,,,,,,,
MUS 176,Music Technology Seminar,4,(Formerly MUS 163.) Selected topics in music technology and its application to composition and/or performance. Offerings vary according to faculty availability and interest. May be repeated for credit. ,MUS 172 (formerly MUS 161),consent of instructor,,,,,,,,
MUS 177,Music Programming,4,"Fundamentals of programming music software in C and C++. DSP implementation of oscillators, filters, delay, reverb and spectral processing; programming techniques specific to audio and MIDI and simple GUI design for parameter control and signal display. Implementation using a plug-in or external programming interface such as for VST, Audio Unit, PD, or Max/MSP. May be taken for credit two times. ",MUS 172 (formerly MUS 161),,,,,,,,,"Restricted to music, ICAM-music, and ICAM-visual arts majors and minors, or consent of instructor."
MUS 192,Senior Seminar in Music,1,"The Senior Seminar Program is designed to allow senior undergraduates to meet with faculty members in a small group setting to explore an intellectual topic in music (at the upper-division level). Topics will vary from quarter to quarter. Senior Seminars may be taken for credit up to four times, with a change in topic, and permission of the department. Enrollment is limited to twenty students, with preference given to seniors. ",,,,,,,,,,Upper-division standing; department stamp and/or consent of instructor required.
MUS 195,Instructional Assistance,2,Assisting in the instruction of an undergraduate music class under the direct and constant supervision of a faculty member. May be taken for credit three times. ,,,,,,,,,,Consent of instructor and department approval.
MUS 198,Directed Group Study,1–4,Concentrated inquiry into various problems not covered in the usual undergraduate courses. ,,,,,,,,,,Consent of instructor and department chair approval. Pass/Not Pass grade only.
MUS 199,Independent Study,1–4,"Independent reading, research, or creative work under the direction of a faculty member, provided no course covering the material to be studied already exists, and the study area derives from previous course work. ",,,,,,,,,,Consent of instructor and department chair approval. Department stamp required. Pass/Not Pass grade only. May be taken for credit two times.
MUS 200,Contemporary Chamber Opera Performance,4,Students will collaborate with faculty and guest artists in the preparation and performance of a fully staged contemporary chamber opera. The opera will be presented in multiple public performances. ,,,,,,,,,,"Graduate standing in music, MU75/MU76, or consent of instructor."
MUS 201A-B-C-D-E-F,Projects in New Music Performance,"1–4, 1–4, 1–4, 1–4, 1–4, 1–4",Performance of contemporary music. Different sections represent active performance ensembles. A core requirement for music graduate students as outlined in the curriculum.,,,,,,,,,,
MUS 202,Advanced Projects in Performance,1–4,Advanced performance of new music with members of the performance faculty (SONOR). Students taking this course do not need to take MUS 201 that quarter. Enrollment by consent of instructor/director of SONOR. ,,,,,,,,,,Graduate standing in music; others by written consent of instructor and department stamp.
MUS 203A,Advanced Projects in Composition,6,Meetings and laboratory sessions devoted to the study of composition in small groups. Consent of instructor required.,,,,,,,,,,
MUS 203B,Advanced Projects in Composition,6,Meetings and laboratory sessions devoted to the study of composition in small groups. Consent of instructor required.,,,,,,,,,,
MUS 203C,Advanced Projects in Composition,6,Meetings and laboratory sessions devoted to the study of composition in small groups. Consent of instructor required.,,,,,,,,,,
MUS 203D,Advanced Projects in Composition,1–4,Meetings on group basis with faculty composer in sessions devoted to the study of composition. ,,,,,,,,,,203A-B-C and consent of instructor.
MUS 204,Focus on Composition,2,"The purpose of this seminar is to bring in the entire population of the graduate composition program (all students and faculty) for in-depth discussion of critical issues in music theory and composition. Each meeting will feature a formal presentation by either a student, faculty member, or visitor, followed by lively and challenging debate on relevant issues. ",,,,,,,,,,Consent of instructor.
MUS 205,Focus on Integrative Studies,2,"Meets on a biweekly basis to facilitate presentations by advanced students and invited guests and to encourage in-depth discussion between students, faculty, and visitors about theoretical and artistic issues of interest. Participation is required of all enrolled IS students until advanced to candidacy. Others are welcome to participate. ",,,,,,,,,,Graduate standing in music.
MUS 206,Experimental Studies Seminar,4,"Seminars growing out of current faculty interests. The approach tends to be speculative and includes individual projects or papers as well as assigned readings. In the past, such areas as new instrumental and vocal resources, mixed media, and compositional linguistics have been offered. ",,,,,,,,,,Graduate standing in music; others by written consent of instructor and department stamp.
MUS 207,Theoretical Studies Seminar,4,"Seminars on subject areas relating to the established dimensions of music and in which theoreticians have produced a substantial body of work. These include studies in analysis, timbre, rhythm, notation, and psychoacoustics. Offerings vary depending on faculty availability and interest. Analytical paper required. ",,,,,,,,,,Graduate standing in music; others by written consent of instructor and department stamp.
MUS 209,Advanced Music Theory and Practice,4,Advanced integrated studies in music theory; composition and styles study through analysis and performance. This course is intended primarily for doctoral students and may be taken by MA students only with special approval of MA adviser and course instructor. A major research or analytical publishable paper required. ,,,,,,,,,,Graduate standing in music; others by written consent of instructor and department stamp.
MUS 210,Musical Analysis,4,"The analysis of complex music. The course will assume that the student has a background in traditional music analysis. The goal of the course is to investigate and develop analytical procedures that yield significant information about specific works of music, old and new. Reading, projects, and analytical papers. ",,,,,,,,,,Graduate standing in music; others by written consent of instructor and department stamp.
MUS 211,Introduction to Ethnomusicology,2,"Introduces the field of ethnomusicology by highlighting important thinkers, concepts, and issues and by orienting students toward work of an anthropological, ethnographic, or comparative nature. Students who have taken and passed MUS 208A may not get credit for MUS 211. ",,,,,,,,,,Graduate standing in music
MUS 212,Introduction to System Inquiry,2,"Introduces the network of concepts and approaches that comprise systems inquiry and explores the theoretical, philosophical, and methodological implications of systems thinking for musical research and practice. Students who have taken MUS 208B for credit may not take MUS 212 for credit. ",,,,,,,,,,Graduate standing in music.
MUS 213,Introduction to Critical Studies,2,"Introduces important themes and thinkers from the fields of critical theory and cultural studies and explores how musical behaviors and phenomena relate to matters of ideology, nationality, ethnicity, social class, race, and gender. Students who have taken MUS 208C for credit may not take MUS 213 for credit. ",,,,,,,,,,Graduate standing in music.
MUS 214,Introduction to Creative Practices,2,"Surveys the terrain of contemporary creative music and investigates the social, cultural, historical, and technological dimensions of its manifestations and practice. Students who have taken MUS 208D for credit may not take MUS 214 for credit. ",,,,,,,,,,Graduate standing in music.
MUS 228,Conducting,4,"This course will give practical experience in conducting a variety of works from various eras of instrumental and/or vocal music. Students will study problems of instrumental or vocal techniques, formal and expressive analysis of the music, and manners of rehearsal. Required of all graduate students. ",,,,,,,,,,Graduate standing in music; others by written consent of instructor and department stamp. (Offered in selected years.)
MUS 229,Seminar in Orchestration,4,"A seminar to give practical experience in orchestration. Students will study works from various eras of instrumental music and will demonstrate their knowledge by orchestrating works in the styles of these various eras, learning the capabilities, timbre, and articulation of all the instruments in the orchestra. ",,,,,,,,,,Graduate standing. (Offered in selected years.)
MUS 230,Chamber Music Performance,4,"Performance of representative chamber music literature, instrumental and/or vocal, through coached rehearsal and seminar studies. Course may be repeated for credit since the literature studied varies from quarter to quarter. ",,,,,,,,,,Consent of instructor.
MUS 232,Proseminar in Music Performance,1–4,Individual or master class instruction in advanced instrumental/vocal performance. ,,,,,,,,,,Consent of instructor through audition.
MUS 234,Symphonic Orchestra,4,"Repertoire is drawn from the classic symphonic literature of the eighteenth, nineteenth, and twentieth centuries with a strong emphasis on recently composed and new music. Distinguished soloists, as well as The La Jolla Symphony Chorus, frequently appear with the orchestra. The La Jolla Symphony Orchestra performs two full-length programs each quarter, each program being performed twice. May be repeated six times for credit. ",,,,,,,,,,Audition required.
MUS 245,Focus on Performance,2,"The purpose of this seminar is to bring together performance students, faculty, and guests for discussion, presentation of student and faculty projects, performances by guest artists, and master classes with different members of the performance faculty. ",,,,,,,,,,Consent of instructor. (S/U grade option only.)
MUS 251,Integrative Studies Seminar in Ethnomusicology,4,"Provides an in-depth look at the shifting definitions, methods, and scope of ethnomusicology and explores contemporary writings and issues that are shaping the field today. ",,,,,,,,,,Graduate standing in music.
MUS 252,Integrative Studies Seminar in Systems Inquiry,4,"Traces the development of systems thinking and encourages work of a transdisciplinary nature, integrating models, strategies, methods, and tools from natural, human, social, and technological realms. ",,,,,,,,,,Graduate standing in music.
MUS 253,Integrative Studies Seminar in Critical Studies,4,"Develops critical thinking and self-reflexive inquiry through in-depth study of a diverse range of critical and scholarly traditions as they relate to music. Students are encouraged to investigate their own sense of identity and voice, as embodied in their creative and/or scholarly work. ",,,,,,,,,,Graduate standing in music.
MUS 254,Integrative Studies Seminar in Creative Practice,4,Students will explore a variety of approaches to collaborative work and will be challenged to develop a personal aesthetic in experimental art and new media and design original work for presentation at faculty juries. ,,,,,,,,,,Graduate standing in music.
MUS 267,Advanced Music Technology Seminar,4,Advanced topics in music technology and its application to composition and/or performance. Offerings vary according to faculty availability and interest. May be repeated for credit. ,MUS 173 or equivalent,consent of instructor,,,,,,,,
MUS 270A,Digital Audio Processing,4,"Digital techniques for analysis, synthesis, and processing of musical sounds. Sampling theory. Software synthesis techniques. Digital filter design. The short-time Fourier transform. Numerical accuracy considerations. ",,,,,,,,,,Consent of instructor.
MUS 270B,Musical Cognitive Science,4,"Theoretical bases for analyzing musical sound. Approaches to perception and cognition, including psychoacoustics and information processing, both ecological and computational. Models of audition including Helmholtz’s consonance/dissonance theory and Bregman’s streaming model. Musical cognition theories of Lerdahl and Narmour. Neural network models of music perception and cognition. Models of rhythm. The problem of timbre and timbre perception. ",,,,,,,,,,Consent of instructor.
MUS 270C,Compositional Algorithms,4,Transformations in musical composition; series and intervallic structures; serial approaches to rhythm and dynamic. The stochastic music of Xenakis and Cage. Hiller’s automatic composition. Improvisational models. Computer analysis of musical style. Neurally inspired and other quasiparallel algorithms. ,,,,,,,,,,Consent of instructor.
MUS 270D,Advanced Projects in Computer Music,4,Meetings on group basis with computer music faculty in support of individual student research projects. ,,,,,,,,,,Consent of instructor and completion of MUS 270A-B-C.
MUS 271A,Survey of Electronic Music Techniques I,4,"A hands-on encounter with several important works from the classic electronic repertory, showing a representative subset of the electronic techniques available to musicians. Students who have taken MUS 271 for credit may not take MUS 271A for credit. ",,,,,,,,,,Graduate standing in music.
MUS 271B,Survey of Electronic Music Techniques II,4,"A continuation of 271A, with emphasis on live interactive techniques (e.g., audio processing; analysis/resynthesis; score following). ",MUS 271A,graduate standing in music,,,,,,,,
MUS 271C,Survey of Electronic Music Techniques III,4,"A continuation of 271A and B, with emphasis on compositional techniques (e.g., computer-aided composition, production, spatialization). ",MUS 271B,graduate standing in music,,,,,,,,
MUS 272,Seminar in Live Computer Music,4,Group projects to create new pieces of live electronic music involving research in electronic music and/or instrumental techniques. May be repeated for credit.,,,,,,,,,,
MUS 291,Music Research Methods,2,Consideration and development of research methods appropriate to graduate-level scholarship and practice-based research. ,,,,,,,,,,Graduate standing. (Letter grade option only.)
MUS 296,Directed Group Research in Performance,4,"This group research seminar involves the investigation and exploration of new and experimental performance concerns. Areas could include: improvisation, graphic notation, performance electronics, and working with combined media (such as dance, poetry, and theatre). ",,,,,,,,,,Graduate standing. (S/U grade option only.)
MUS 298,Directed Research,1–4,Individual research. (S/U grades permitted.) May be repeated for credit. Enrollment by consent of instructor only.,,,,,,,,,,
MUS 299,Advanced Research Projects and Independent Study,1–12,Individual research projects relevant to the student’s selected area of graduate interest conducted in continuing relationship with a faculty adviser in preparation of the master’s thesis or doctoral dissertation. ,,,,,,,,,,Graduate standing in music; others by written consent of instructor and department stamp. (S/U grades permitted.)
MUS 500,Apprentice Teaching,1–4,Participation in the undergraduate teaching program is required of all graduate students at the equivalent of twenty-five percent time for three quarters (six units is required for all graduate students). ,,,,,,,,,,Graduate standing in music; others by written consent of instructor and department stamp. (S/U grade option only.)
MUS 501,Apprentice Teaching—Nondepartmental,4,Consideration and development of pedagogical methods appropriate to undergraduate teaching. ,,,,,,,,,,Graduate standing and consent of instructor. (S/U grade option only.)
