course_code,name,units,desc,prereq1,prereq2,prereq3,prereq4,prereq5,prereq6,prereq7,prereq8,prereq9,misc_prereq
NANO 247C,BioNanotechnology,4,"Bionanotechnology is defined as science and engineering that involves working with biomolecules on the nanoscale. DNA and protein-based nanostructures, or even entire microorganisms, are subject of study and development of nanomachines. Another avenue is the nanoscale bio-mimicry in which synthetic systems are engineered to mimic what nature has already achieved. Bionanotechnology finds utility in medicine, materials, the environment. Cross-listed with BENG 247C and ECE 247C. Students may receive credit for one of the following: NANO 247C, BENG 247C, or ECE 247C. ",,,,,,,,,,Graduate standing.
NANO 250,Mechanics of Nanomaterials,4,"Elements of continuum mechanics; quantum and statistical mechanics; interatomic forces and intermolecular interactions; thermodynamics and diffusion materials; nanomechanics of self-assembly, pattern formation, and hierarchical ordering, defects, thin films, surfaces, and interfaces; plasticity, creep, fracture, and fatigue, nanomechanics, nanorheology, and nanotribology. ",,,,,,,,,,Department approval required.
NANO 251A,Magnetic Materials: Principles and Applications,4,"The basis of magnetism: classical and quantum mechanical points of view. Different kinds of magnetic materials. Magnetic phenomena including anisotropy, magnetostriction, domains, and magnetization dynamics. Current frontiers of nanomagnetics research, including thin films and particles. Optical, data storage, and biomedical engineering applications of soft and hard magnetic materials. Cross-listed with ECE 221, MAE 265B, and MATS 251B. Students may not receive credit for ECE 221 and MAE 265B and MATS 251B and NANO 251A. ",,,,,,,,,,Department approval required and graduate standing.
NANO 252,Biomaterials and Biomimetics,4,Fundamentals of materials science as applied to bioengineering design. Hierarchical structures. Cells and tissues. Natural and synthetic polymeric materials. Biomineralized materials. Biological composites. Cellular materials (foams). Functional biological materials. Biomaterials and implants. Bioinspired design and materials. Cross-listed with CENG 256. Students may not receive credit for both NANO 252 and CENG 256. ,,,,,,,,,,Graduate standing.
NANO 253,Nanomaterials and Properties,4,"This course discusses synthesis techniques, processes, microstructural control, and unique physical properties of materials in nanodimensions. Topics include nanowires, quantum dots, thin films, electrical transport, electron emission properties, optical behavior, mechanical behavior, and technical applications of nanomaterials. Cross-listed with MAE 267. ",,,,,,,,,,Consent of instructor.
NANO 255,Electrochemistry,4,"Application of electrochemical techniques to chemistry research. Basic electrochemical theory and instrumentation: the diffusion equations, controlled potential, and current methods. Electrochemical kinetics, Butler-Volmer, Marcus-Hush theories, preparative electrochemistry, analytical electrochemistry, solid and polymer electrolytes, semiconductor photoelectrochemistry. Cross-listed with CHEM 240. ",,,,,,,,,,Consent of instructor.
NANO 256,Microfluids,4,"This course covers the design, microfabrication, operational principles, basic transport processes and diverse applications of microfluidic and nanofluidic (lab-on-a-chip) systems. ",,,,,,,,,,Graduate standing.
NANO 257,Polymer Science and Engineering,4,"Quantitative basic understanding of different branches of polymer science varying from polymer chemistry, characterization, thermodynamics, rheological properties, smart materials, self-assembly in biopolymers (natural) and synthetic polymers, and applications of polymers ranging from medicine to structure. Cross-listed with MATS 257 and BENG 242. Restricted to BE 75, MS 76, CE 75, and NA 75 majors. ",,,,,,,,,,Graduate standing.
NANO 258,Nanoscale Transport Phenomenon,4,"Various nanoscale systems where macroscopic laws of mass, heat, and momentum transfer break down; nonequilibrium statistical mechanics concepts such as transition state and Green-Kubo theories, and molecular simulations for modeling nanoscale transport issues will be introduced. ",,,,,,,,,,Department approval required.
NANO 259,Heterogeneous Catalysis,4,"Physics and chemistry of heterogeneous catalysis; adsorption-desorption kinetics, chemical bonding, isotherms, kinetic models, selection of catalysts, poisoning, experimental techniques. Cross-listed with CENG 253. Students may not receive credit for both NANO 259 and CENG 253. ",,,,,,,,,,Consent of instructor.
NANO 260,Nanofabrication Reaction Engineering,4,"Chemical reaction kinetics coupled with material and energy transport processes for fabrication of nanostructured materials and devices. Chemical vapor deposition, etching, and patterning of films. Nanoparticle, nanofiber, and nanotube growth. Theory, simulation, and reactor design. ",,,,,,,,,,Department approval required.
NANO 261,Nanoscale Energy Technology,4,"Examines the role nanotechnology will play in addressing the many scientific and engineering challenges for new energy production. Topics include nanotechnology’s role in improving photovoltaics, fuel-cells, batteries, energy transmission, and conversion of renewable (green) and nonrenewable sources. ",,,,,,,,,,Consent of instructor.
NANO 262,Nanosensors,4,"This course illustrates how the ability to tailor the properties of nanomaterials can be used for designing powerful sensing and biosensing devices. Nanosensors based on metal nanoparticles, semiconductor nanowires and nanocrystals, and carbon nanotubes will be covered. ",,,,,,,,,,Department approval required.
NANO 263,Magnetic Nanodevices,4,"The basis of magnetism: classical and quantum mechanical points of view. Introduction to thin film and nanomagnetism, including interfacial magnetism, coupling and magneto-transport. Application of nanomagnetism in devices including magnetic recording, MRAM, magnetic processing, and biomedical engineering. ",,,,,,,,,,Department approval required.
NANO 264,Solid-State and Nanochemistry,4,"Course covers concept in nano and solid-state chemistry for graduate students, with the objective of understanding nanomaterials from a chemical perspective. Topics include descriptive crystal chemistry, structure determination, free electron gas and dimensional solids, tight-binding approximation, band structure. Recommended preparation: Background equivalent to NANO 203. ",,,,,,,,,,Department approval required and graduate standing.
NANO 265,Thermodynamics of Solids,4,"The thermodynamics and statistical mechanics of solids. Basic concepts, equilibrium properties of alloy systems, thermodynamic information from phase diagrams, surfaces and interfaces, crystalline defects. Cross-listed with MATS 201A, MAE 271A, and ECE 238A. Students may receive credit for one of the following: NANO 265, MATS 201A, MAE 271A, ECE 238A. ",,,,,,,,,,Graduate standing.
NANO 266,Quantum Mechanical Modeling of Materials and Nanostructures,4,"Application of quantum mechanical modeling methods (both solid state and computational chemistry) in the study of materials and nanostructures; density functional theory (DFT) and approximations; Hartree-Fock and beyond HF approximations; hybrid density functional theory; beyond DFT (GW, TDDFT); ab initio molecular dynamics; materials properties (mechanical, electrochemical, electronic, transport, nano-scale effects on properties) from quantum mechanical simulations; high-throughput computation. ",,,,,,,,,,Consent of instructor.
NANO 267,"Environmental Nanotechnology, Sustainable Nanotechnology, and Nanotoxicity",4,"This course explores the potential impacts of nanoscience and nanotechnology on environmental processes and human health as well as the sustainable design, development, and use of nanotechnologies. The course addresses questions and issues arising from the expected increases in the development of nanotechnology-based consumer products and their potential effects on the environment. Cross-listed with CHEM 267. Students may not receive credit for CHEM 267 and NANO 267. ",,,,,,,,,,Graduate standing.
NANO 268,DNA Nanotechnology,4,"Introduction to DNA nanotechnology. Topics include basic design principles for DNA nano structures and DNA origami, DNA nano motors, computing, and the use of DNA nanotechnology in organizing other materials, nano fabrication, biosensing, and drug delivery. ",,,,,,,,,,Graduate standing.
NANO 269,Engineering Solar Cells at the Nanoscale,4,"Fundamentals of photovoltaic energy conversion; limiting efficiencies, loss mechanisms. Nanoscale effects in semiconductor, thin film, and organic photovoltaics. Emphasis on emerging nanotechnologies including nanowires, heterostructures, hybrid materials, quantum dots, transparent conducting materials, and plasmonics. ",,,,,,,,,,Graduate standing.
NANO 271,Nanophotonics,4,"This course will introduce a background in optics and photonics for nanoscale materials and devices and explore light-matter interactions on the nanoscale. Fundamentals of light absorption, emission, lasing, and waveguiding in nanoscale structures, optical resonances in metallic (plasmonic) and semiconductor (excitonic) nanomaterials. ",,,,,,,,,,Graduate standing.
NANO 272,Soft Electronics,4,"General overview of flexible/stretchable electronic devices, with a focus on the enabling nanomaterials and structures that lead to the tolerance to extreme physical deformations. Relevant nanofabrication techniques and manufacturing approaches will also be included. ",,,,,,,,,,Graduate standing.
NANO 273,Principles of Immune Engineering,4,"The course will emphasize the principles underlying the development of engineering tools to quantitatively measure complex information about the immune system that has fueled or inspired strategies for manufacturing immune cells, developing analytical methods for measuring immunity, and developing immunotherapies. Cross-listed with CENG 273. Students may not receive credit for both NANO 273 and CENG 273. ",,,,,,,,,,Graduate standing.
NANO 275,"Two-Dimensional Materials: Properties, Applications, and Practice",4,"Overview of graphene and other 2-D materials fundamental properties, applications, and experimental practice. Theory covers band structure, Dirac cone, mobility, and Fermi level tuning. Applications cover electronics and optoelectronics. Lab sessions include graphene and other 2-D materials manipulation and measurement. ",,,,,,,,,,Graduate standing.
NANO 279,Advanced Electrochemical Energy Engineering,4,"Electrochemistry and electrochemical engineering for energy applications. Thermodynamics and kinetics of electrochemical reactions; fundamental principles of batteries, super capacitors, fuel cells, and electrochemical synthesis systems; electrochemical analysis of these systems, engineering design considerations, and modeling. Practical device design and fabrication will be covered in greater detail. ",,,,,,,,,,Graduate standing.
NANO 280,Colloids and Nanoparticles,4,"This course will cover fundamental concepts and laboratory techniques to study the chemical and physical properties of colloids and nanoparticles. Topics covered include colloid and surface forces, Brownian motion, aggregation, steric stabilization, optical characterization techniques, and self-assembly. Recent developments in colloids and nanotechnology will be discussed throughout the course. ",,,,,,,,,,Graduate standing.
NANO 281,Data Science in Materials Science,4,"Comprehensive introduction into the application of data science to materials science. Introduction to broad array of machine learning techniques (e.g., supervised, unsupervised) and applications (e.g., regression, dimensionality reduction, classification), with a focus on practical examples in materials science. ",,,,,,,,,,Graduate standing.
NANO 282,Professional Development,4,"Professional development topics include navigating the virtual library, scientific writing, individual development plan, time and project management, responsible conduct of research, grant writing (NSF fellowships, NIH F grants), plagiarism, prepping a CV (résumé, biosketch), networking, and communication skills. ",,,,,,,,,,Department approval required and graduate standing.
NANO 296,Independent Study in NanoEngineering,4,Independent reading or research on a problem as arranged by a faculty member. Must be taken for a letter grade only. ,,,,,,,,,,Consent of instructor and graduate standing.
NANO 299,Graduate Research in NanoEngineering,1–12,Graduate research in NanoEngineering. S/U grades only. May be taken for credit four times for a maximum of twelve units. ,,,,,,,,,,Consent of instructor and graduate standing.
CENG 4,Experience Chemical Engineering,1,"Hands-on, team-based laboratory activities to demonstrate modern applications of chemical engineering, and the role of the chemical engineer in academia and industry. Emphasis on teamwork, safe laboratory practices, and student-directed problem solving. (P/NP grading only; for incoming CENG first-year students and transfers. CENG 4 is mandatory.) ",,,,,,,,,,
CENG 15,Engineering Computation Using MATLAB,4,"Introduction to solution of engineering problems using computational methods. Formulating problem statements, selecting algorithms, writing computer programs, and analyzing output using MATLAB. Computational problems from NanoEngineering, chemical engineering, and materials science are introduced. The course requires no prior programming skills. Cross-listed with NANO 15. Students may only receive credit for one of the following: CENG 15, CENG 15R, NANO 15, or NANO 15R.",,,,,,,,,,
CENG 15R,Engineering Computation Using MATLAB Online,4,"(Cross-listed with NANO 15R.) Introduction to solution of engineering problems using computational methods. Formulating problem statements, selecting algorithms, writing computer programs, and analyzing output using MATLAB. Computational problems from NanoEngineering, chemical engineering, and materials science are introduced. This is a fully online, self-paced course that utilizes multi-platform instructional techniques (video, text, and instructional coding environments). The course requires no prior programming skills. Students may only receive credit for one of the following: CENG 15R, CENG 15R, NANO 15R, or NANO 15R.",,,,,,,,,,
CENG 100,Material and Energy Balances,4,"Introduction to steady and time-dependent material and energy balances using a variety of problem-solving strategies. Concepts include degrees-of-freedom analysis, unit operations, multiunit systems, chemical reaction kinetics and equilibrium, and phase equilibrium. ",CENG 4,CHEM 6B,,,,,,,,
CENG 101A,Introductory Fluid Mechanics,4,"Kinematics and equation of motion; hydrostatics; Bernoulli’s equation; viscous flows; turbulence, pipe flow; boundary layers and drag in external flows; applications to chemical, structural, and bioengineering. Students may not receive credit for both MAE 101A and CENG 101A. ",,,,,,,,,,"Admission to the major and grades of C– or better in PHYS 2A, MATH 20D, and MATH 20E, or consent of instructor."
CENG 101B,Heat Transfer,4,"Conduction, convection, radiation heat transfer; design of heat exchangers. Students may not receive credit for both MAE 101C and CENG 101B. ",,,,,,,,,,Admission to the major and a grade of C– or better in CENG 101A.
CENG 101C,Mass Transfer,4,"Diffusive and convective mass transfer in solids, liquids, and gases; steady and unsteady state; mass transfer coefficients; applications to chemical engineering and bioengineering. ",,,,,,,,,,Admission to the major and grade of C– or better in CENG 101A.
CENG 102,Chemical Engineering Thermodynamics,4,"Thermodynamic behavior of pure substances and mixtures. Properties of solutions, phase equilibria. Thermodynamic cycles. Chemical equilibria for homogeneous and heterogeneous systems. ","CENG 100, CHEM 6C,",MATH 20C,,,,,,,,
CENG 113,Chemical Reaction Engineering,4,"Principles of chemical reactor analysis and design. Experimental determination of rate equations, design of batch and continuous reactors, optimization of selectivity in multiple reactions, consideration of thermal effects and residence time distribution. Introduction to multi-phase reactors. ","CENG 15, CENG 100",MATH 20D,,,,,,,,
CENG 114,Probability and Statistical Methods for Engineers,4,"Probability theory, conditional probability, Bayes theorem, discrete random variables, continuous random variables, expectation and variance, central limit theorem, graphical and numerical presentation of data, least squares estimation and regression, confidence intervals, testing hypotheses. Cross-listed with NANO 114. Students may not receive credit for both CENG 114 and NANO 114. ","MATH 20F or MATH 18,",CENG 15 or MAE 8 or NANO 15,,,,,,,,
CENG 120,Chemical Process Dynamics and Control,4,"Examination of dynamic linear and linearized models of chemical processes. Stability analysis. Design of PID controllers. Selection of control and manipulated variables. Root locus, Bode, and Nyquist plots. Cascade, feed-forward and ratio controls. ",,,,,,,,,,"Admission to the major; CENG 15 or MAE 8 or NANO 15, and CENG 100, CENG 101B, CENG 113, and MATH 20D. Restricted to majors CE 25, NA 25, MC 25, MC 27, MC 28, MC 29."
CENG 122,Separation Processes,4,"Principles of analysis and design of systems for separation of components from a mixture. Topics will include staged operations (distillation, liquid-liquid extraction), and continuous operations (gas absorption, membrane separation) under equilibrium and nonequilibrium conditions. ",,,,,,,,,,"Admission to the major and grades of C– or better in CENG 100, CENG 102, and CENG 101C."
CENG 124A,Chemical Plant and Process Design I,4,"Principles of chemical process design and economics. Process flow diagrams and cost estimation. Computer-aided design and analysis. Representation of the structure of complex, interconnected chemical processes with recycle streams. Ethics and professionalism. Health, safety, and the environmental issues. ",,,,,,,,,,"Admission to chemical engineering major and grades of C– or better in CENG 113 and CENG 122, or consent of instructor."
CENG 124B,Chemical Plant and Process Design II,4,"Engineering and economic analysis of integrated chemical processes, equipment, and systems. Cost estimation, heat and mass transfer equipment design and costs. Comprehensive integrated plant design. Optimal design. Profitability. ",,,,,,,,,,Admission to chemical engineering major and grade of C– or better in CENG 124A.
CENG 134,Polymeric Materials,4,"Foundations of polymeric materials. Topics: structure of polymers; mechanisms of polymer synthesis; characterization methods using calorimetric, mechanical, rheological, and X-ray-based techniques; and electronic, mechanical, and thermodynamic properties. Special classes of polymers: engineering plastics, semiconducting polymers, photoresists, and polymers for medicine. Cross-listed with NANO 134 and CHEM 134. Students may only receive credit for one of the following: CENG 134, CHEM 134, NANO 134. ",CHEM 6C,PHYS 2C,,,,,,,,
CENG 157,Process Technology in the Semiconductor Industry,4,"Brief introduction to solid-state materials and devices. Crystal growth and purification. Thin film technology. Application of chemical processing to the manufacture of semiconductor devices. Topics to be covered: physics of solids, unit operations of solid state materials (bulk crystal growth, oxidation, vacuum science, chemical and physical vapor deposition, epitaxy, doping, etching). ","CENG 101A, CENG 101B,",CENG 101C,,,,,,,,
CENG 170,Experimental Methods for Chemical Engineers,4,"Principles and practice of measurement and control, design and conduct of experiments, and technical report writing. Specific topics include dimensional analysis, error analysis, data acquisition and data reduction, as well as background of experiments and statistical analysis. Program or materials fees may apply. Restricted to NanoEngineering majors. ",CENG 100,CENG 102,,,,,,,,
CENG 175,NanoEngineering in Medicine,4,"Introduction to nanomedicine. Topics include nanoscale material, biological system vs. synthetic vs. bio-inspired systems, drug and gene delivery, molecular imaging, vaccines, immunoengineering, pharmacology, clinical application in cancer, cardiovascular disease, infectious disease, immune diseases, genetic disorders, skin diseases, and regenerative medicine. Cross-listed with NANO 175. Students may not receive credit for both CENG 175 and NANO 175. ",,,,,,,,,,Upper-division standing.
CENG 176A,Chemical Engineering Process Laboratory I,4,Laboratory projects in the areas of applied chemical research and unit operations. Emphasis on applications of engineering concepts and fundamentals to solution of practical and research problems. ,"CENG 113, CENG 122,","MAE 170, or consent of instructor",,,,,,,,
CENG 176B,Chemical Engineering Process Laboratory II,4,"Training in planning research projects, execution of experimental work, and articulation (both oral and written) of the research plan and results in the areas of applied chemical technology and engineering operations related to mass, momentum, and heat transfer. ",CENG 176A,,,,,,,,,
CENG 199,Independent Study for Undergraduates,4–4,Research project as equivalent to a “senior thesis” can be approved for two technical elective courses (eight units total). This course is taken as an elective on a P/NP basis. It must be done in consecutive quarters and the student must find a faculty member who will oversee the research project. Eligible students must have completed at least ninety units and must have a UC San Diego cumulative GPA of 3.0 or better. Detailed policy and procedures may be obtained from the Student Affairs Office. ,,,,,,,,,,Consent of instructor.
CENG 205,Graduate Seminar in Chemical Engineering,1,"Each graduate student in chemical engineering is expected to attend one seminar per quarter, of his or her choice, dealing with current topics in chemical engineering. Topics will vary. P/NP grades only. May be taken for credit four times.",,,,,,,,,,
CENG 207,Nanomedicine,4,"Introduction to nanomedicine; diffusion and drug dispersion; diffusion in biological systems; drug permeation through biological barriers; drug transport by fluid motion; pharmacokinetics of drug distribution; drug delivery systems; nanomedicine in practice: cancers, cardiovascular diseases, immune diseases, and skin diseases. Cross-listed with NANO 243. Students may not receive credit for both CENG 207 and NANO 243.",,,,,,,,,,
CENG 208,Nanofabrication,4,"Basic engineering principles of nanofabrication. Topics include photo, electron beam, and nanoimprint lithography, block copolymers and self-assembled monolayers, colloidal assembly, biological nanofabrication. Cross-listed with NANO 208. Students may not receive credit for both CENG 208 and NANO 208.",,,,,,,,,,
CENG 210A,Fluid Mechanics I,4,"Advanced subject in fluid and continuum mechanics. Content will cover macroscopic balances for linear and angular momentum, kinematics, the stress tenor, Navier-Stokes equations for Newtonian fluids, viscous and creeping flows and the lubrication approximation, inertial (inviscid) and irrotational flows, generalization of Bernoulli’s equation, the boundary layer approximation, and electrokinetic phenomena. ",,,,,,,,,,"Department approval required, CENG 101A or consent of instructor."
CENG 211,Introduction to NanoEngineering,4,"Understanding nanotechnology, broad implications; miniaturization: scaling laws; nanoscale physics; types and properties of nanomaterials; nanomechanical oscillators, nano(bio)electronics, nanoscale heat transfer; fluids at nanoscale; machinery cell; applications of nanobiotechnology and nanobiotechnology. Cross-listed with NANO 201. Students may not receive credit for both CENG 211 and NANO 201. ",,,,,,,,,,Graduate standing.
CENG 212,Intermolecular and Surface Forces,4,"Development of quantitative understanding of the different intermolecular forces between atoms and molecules and how these forces give rise to interesting phenomena at the nanoscale, such as flocculation, wetting, and self-assembly in biological (natural) and synthetic systems. Cross-listed with NANO 202. Students may not receive credit for both CENG 212 and NANO 202.",,,,,,,,,,
CENG 213,Nanoscale Synthesis and Characterization,4,"Examination of nanoscale synthesis—top-down and bottom-up; physical deposition; chemical vapor deposition; plasma processes; sol-gel processing; soft-lithography; self-assembly and layer-by-layer; molecular synthesis. Nanoscale characterization; microscopy (optical and electron: SEM, TEM); scanning probe microscopes (SEM, AFM); profilometry; reflectometry, and ellipsometry; X-ray diffraction; spectroscopies (EDX, SIMS, Mass spec, Raman, XPS); particle size analysis; electrical, optical, magnetic, mechanical, thermal. Cross-listed with NANO 203. Students may not receive credit for both CENG 213 and NANO 203.",,,,,,,,,,
CENG 214,Nanoscale Physics and Modeling,4,"Expanded mathematical analysis of topics introduced in CENG 212. Introduction of both analytical and numerical methods through application to problems in NanoEngineering. Nanoscale systems of interest include colloidal systems, block-copolymer based self-assembled materials, molecular motors made out of DNA, RNA, or proteins, etc. Nanoscale phenomena including self-assembly at the nanoscale, phase separation within confined spaces, diffusion through nanopores and nanoslits, etc. Modeling techniques include quantum mechanics, diffusion and kinetics theories, molecular dynamics, etc. Cross-listed with NANO 204. Students may not receive credit for both CENG 214 and NANO 204. ",CENG 212 or consent of instructor,,,,,,,,,
