course_code,name,units,desc,prereq1,prereq2,prereq3,prereq4,prereq5,prereq6,prereq7,prereq8,prereq9,misc_prereq
NANO 4,Experience NanoEngineering,1,"Introduction to NanoEngineering lab-based skills. Hands-on training and experimentation with nanofabrication techniques, integration, and analytical tools. This class is for NANO majors who are incoming first-year students, to be taken their first year. P/NP grades only. ",,,,,,,,,,Department approval required.
NANO 11,Introduction to NanoEngineering,4,"Introduction to NanoEngineering, including fundamental scaling laws, and an overview of nanomaterials synthesis, properties, and relevant technological applications with focus in the area of nanomedicine, energy, and advanced materials. ",NANO 4,,,,,,,,,
NANO 15,Engineering Computation Using MATLAB,4,"Introduction to the solution of engineering problems using computational methods. Formulating problem statements, selecting algorithms, writing computer programs, and analyzing output using MATLAB. Computational problems from NanoEngineering, chemical engineering, and materials science are introduced. The course requires no prior programming skills. Cross-listed with CENG 15. Students may only receive credit for one of the following: NANO 15, NANO 15R, CENG 15, or CENG 15R.",,,,,,,,,,
NANO 15R,Engineering Computation Using MATLAB Online,4,"Introduction to solution of engineering problems using computational methods. Formulating problem statements, selecting algorithms, writing computer programs, and analyzing output using MATLAB. Computational problems from NanoEngineering, chemical engineering, and materials science are introduced. This is a fully online, self-paced course that utilizes multi-platform instructional techniques (video, text, and instructional coding environments). The course requires no prior programming skills. Cross-listed with CENG 15R. Students may only receive credit for one of the following: NANO 15, NANO 15R, CENG 15, or CENG 15R.",,,,,,,,,,
NANO 20L,Introduction to Nanomaterials Synthesis Lab,1,Lab-based course to introduce the chemical synthesis of nanomaterials. Hands-on training in chemical synthesis and basic characterization tools. Program or materials fees may apply. ,NANO 4,,,,,,,,,
NANO 100L,Physical Properties of Materials Lab,4,"Experimental investigation of physical properties of materials such as: thermal expansion coefficient, thermal conductivity, glass transitions in polymers, resonant vibrational response, longitudinal and shear acoustic wave speeds, Curie temperatures, UV-VIS absorption and reflection. ",NANO 108,,,,,,,,,
NANO 101,Introduction to NanoEngineering,4,"Introduction to NanoEngineering; nanoscale fabrication: nanolithography and self-assembly; characterization tools; nanomaterials and nanostructures: nanotubes, nanowires, nanoparticles, and nanocomposites; nanoscale and molecular electronics; nanotechnology in magnetic systems; nanotechnology in integrative systems; nanoscale optoelectronics; nanobiotechnology: biomimetic systems, nanomotors, nanofluidics, and nanomedicine. Priority enrollment given to NanoEngineering majors. ","NANO 4, CHEM 6B, PHYS 2B, MATH 20C,",CENG 15 or CENG 15R or NANO 15 or NANO 15R or MAE 8,,,,,,,,Restricted to major code NA25.
NANO 102,Foundations in NanoEngineering: Chemical Principles,4,"Chemical and biochemical principles tailored to nanotechnologies. Chemical interactions, classical and statistical thermodynamics of small systems, diffusion, carbon-based nanomaterials, supramolecular chemistry, colloid and polymer chemistry, lipid vesicles, surface functionalization, catalysis, biomolecular interactions, and signal pathways. Priority enrollment given to NanoEngineering majors. ",CHEM 6C,,,,,,,,,Restricted to NanoEngineering majors or by department approval.
NANO 103,Foundations in NanoEngineering: Biochemical Principles,4,Principles of biochemistry tailored to nanotechnologies. The structure and function of biomolecules and their specific roles in molecular interactions and signal pathways. Detection methods at the micro and nano scales. ,"BILD 1, CHEM 6C, NANO 101,",NANO 102. Department approval required,,,,,,,,Priority given to NA25 majors.
NANO 104,Foundations in NanoEngineering: Physical Principles,4,"Introduction to quantum mechanics and nanoelectronics. Wave mechanics, the Schrödinger equation, free and confined electrons, band theory of solids. Nanosolids in 0D, 1D, and 2D. Application to nanoelectronic devices. Priority enrollment given to NanoEngineering majors. ",MATH 20D,NANO 101,,,,,,,,Department approval required.
NANO 106,Crystallography of Materials,4,"Fundamentals of crystallography, and practice of methods to study material structure and symmetry. Curie symmetries. Tensors as mathematical description of material properties and symmetry restrictions. Introduction to diffraction methods, including X-ray, neutron, and electron diffraction. Close-packed and other common structures of real-world materials. Derivative and superlattice structures. ",MATH 20F or MATH 18,,,,,,,,,
NANO 107,Electronic Devices and Circuits for NanoEngineers,4,"Overview of electrical devices and CMOS integrated circuits emphasizing fabrication processes, and scaling behavior. Design, and simulation of submicron CMOS circuits including amplifiers active filters digital logic, and memory circuits. Limitations of current technologies and possible impact of nanoelectronic technologies. ","NANO 15, NANO 101, MATH 20B or MATH 20D,",PHYS 2B,,,,,,,,
NANO 108,Materials Science and Engineering,4,"Structure and control of materials: metals, ceramics, glasses, semiconductors, polymers to produce useful properties. Atomic structures. Defects in materials, phase diagrams, micro structural control. Mechanical, rheological, electrical, optical and magnetic properties discussed. Time temperature transformation diagrams. Diffusion. Scale dependent material properties. ",,,,,,,,,,Upper-division standing.
NANO 110,Molecular Modeling of Nanoscale Systems,4,"Principles and applications of molecular modeling and simulations toward NanoEngineering. Topics covered include molecular mechanics, energy minimization, statistical mechanics, molecular dynamics simulations, and Monte Carlo simulations. Students will get hands-on training in running simulations and analyzing simulation results. ","MATH 20F or MATH 18, NANO 102, NANO 104,",NANO 15 or CENG 15 or MAE 8,,,,,,,,Restricted to NanoEngineering majors or by department approval.
NANO 111,Characterization of NanoEngineering Systems,4,"Fundamentals and hands-on practice of methods to image, measure, and analyze materials and devices that are structured on the nanometer scale. Optical and electron microscopy; scanning probe methods; photon, ion, and electron probe methods; spectroscopic, magnetic, electrochemical, and thermal methods. ",NANO 102,,,,,,,,,
NANO 112,Synthesis and Fabrication of NanoEngineering Systems,4,"Introduction to methods for fabricating materials and devices in NanoEngineering. Nano-particle, -vesicle, -tube, and -wire synthesis. Top-down methods including chemical vapor deposition, conventional and advanced lithography, doping, and etching. Bottom-up methods including self-assembly. Integration of heterogeneous structures into functioning devices. ",NANO 102,NANO 104,,,,,,,,
NANO 114,Probability and Statistical Methods for Engineers,4,"Probability theory, conditional probability, Bayes theorem, discrete random variables, continuous random variables, expectation and variance, central limit theorem, graphical and numerical presentation of data, least squares estimation and regression, confidence intervals, testing hypotheses. Cross-listed with CENG 114. Students may not receive credit for both NANO 114 and CENG 114. ",MATH 20F or MATH 18,NANO 15 or CENG 15 or MAE 8,,,,,,,,
NANO 115L,Nanoengineering Laboratory,4,"Laboratory experiments in the design, production, and integration of nanoscale components. Emphasis will be on solution phase synthesis, microfabrication tools, analytical characterization, and nanodevice fabrication. Program or materials fees may apply. ",NANO 111,,,,,,,,,
NANO 117,Multiscale Transport,4,"Introduction to basic transport phenomena relevant to nanoscale and general materials systems, including engineering units and pressure, heat conduction and convection, momentum transport and laminar flow, and diffusion in solids and fluids. ",,,,,,,,,,Upper-division standing.
NANO 119,NanoEngineering System Design Seminar,1,Seminar series focused on strategies in system design and solving engineering problems. ,NANO 115L,,,,,,,,,
NANO 120A,NanoEngineering System Design I,4,Principles of product design and the design process. Application and integration of technologies in the design and production of nanoscale components. Engineering economics. Initiation of team design projects to be completed in NANO 120B. ,NANO 110,,,,,,,,,
NANO 120B,NanoEngineering System Design II,4,Principles of product quality assurance in design and production. Professional ethics. Safety and design for the environment. Culmination of team design projects initiated in NANO 120A with a working prototype designed for a real engineering application. ,NANO 120A,,,,,,,,,
NANO 134,Polymeric Materials,4,"Foundations of polymeric materials. Topics: structure of polymers; mechanisms of polymer synthesis; characterization methods using calorimetric, mechanical, rheological, and X-ray-based techniques; and electronic, mechanical, and thermodynamic properties. Special classes of polymers: engineering plastics, semiconducting polymers, photoresists, and polymers for medicine. Cross-listed with CENG 134 and CHEM 134. Students may only receive credit for one of the following: CENG 134, CHEM 134, NANO 134. ",CHEM 6C,PHYS 2C,,,,,,,,
NANO 141A,Engineering Mechanics I: Analysis of Equilibrium,4,"Newton’s laws. Concepts of force and moment vector. Free body diagrams. Internal and external forces. Equilibrium of concurrent, coplanar, and three-dimensional system of forces. Equilibrium analysis of structural systems, including beams, trusses, and frames. Equilibrium problems with friction. ",MATH 20C,PHYS 2A,,,,,,,,
NANO 141B,Engineering Mechanics II: Analysis of Motion,4,Newton’s laws of motion. Kinematic and kinetic description of particle motion. Angular momentum. Energy and work principles. Motion of the system of interconnected particles. Mass center. Degrees of freedom. Equations of planar motion of rigid bodies. Energy methods. Lagrange’s equations of motion. Introduction to vibration. Free and forced vibrations of a single degree of freedom system. Undamped and damped vibrations. Application to NanoEngineering problems. ,MATH 20D,NANO 141A,,,,,,,,
NANO 146,Nanoscale Optical Microscopy and Spectroscopy,4,"Fundamentals in optical imaging and spectroscopy at the nanometer scale. Diffraction-limited techniques, near-field methods, multi-photon imaging and spectroscopy, Raman techniques, Plasmon-enhanced methods, scan-probe techniques, novel sub-diffraction-limit imaging techniques, and energy transfer methods. ",NANO 104,,,,,,,,,
NANO 148,Thermodynamics of Materials,4,Fundamental laws of thermodynamics for simple substances; application to flow processes and to nonreacting mixtures; statistical thermodynamics of ideal gases and crystalline solids; chemical and materials thermodynamics; multiphase and multicomponent equilibria in reacting systems; electrochemistry. ,,,,,,,,,,Upper-division standing.
NANO 150,Mechanics of Nanomaterials,4,"Introduction to mechanics of rigid and deformable bodies. Continuum and atomistic models, interatomic forces and intermolecular interactions. Nanomechanics, material defects, elasticity, plasticity, creep, and fracture. Composite materials, nanomaterials, biological materials. ",NANO 108,,,,,,,,,
NANO 156,Modern Concepts in Nanotechnology,4,"This course offers a worm’s eye perspective on recent developments on nanomaterials through case studies building on basic principles of synthesis techniques, processing, microstructural control, and unique physical properties of materials in nanoscale dimensions. Particular focus will be given to physical properties and technological applications of nanowires, quantum dots, and thin films. Cross-listed with MAE 166. Students may not receive credit for both NANO 156 and MAE 166. ",,,,,,,,,,Upper-division standing.
NANO 158,Phase Transformations and Kinetics,4,"Materials and microstructures changes. Understanding of diffusion to enable changes in the chemical distribution and microstructure of materials, rates of diffusion. Phase transformations, effects of temperature and driving force on transformations and microstructure. ",NANO 108,NANO 148,,,,,,,,
NANO 158L,Materials Processing Laboratory,4,"Metal casting processes, solidification, deformation processing, thermal processing: solutionizing, aging, and tempering, joining processes such as welding and brazing. The effect of processing route on microstructure and its effect on mechanical and physical properties will be explored. NanoEngineering majors have priority enrollment. ",NANO 158,,,,,,,,,
NANO 159,Electrochemistry: Fundamentals and Applications,4,"Introduce fundamentals of electrochemical processes and electrode reactions to the principles of electrochemical techniques, instrumental requirements, and their diverse real-life applications in the energy, environmental, and diagnostics areas. ","CHEM 6A or 6AH, CHEM 6B or 6BH, CHEM 6C or 6CH, CHEM 7L or 7LM",,,,,,,,,
NANO 161,Material Selection in Engineering,4,"Selection of materials for engineering systems, based on constitutive analyses of functional requirements and material properties. The role and implications of processing on material selection. Optimizing material selection in a quantitative methodology. Priority enrollment given to NanoEngineering majors. ",NANO 108,,,,,,,,,Department approval required. Restricted to major code NA25 or by department approval.
NANO 164,Advanced Micro- and Nano-materials for Energy Storage and Conversion,4,"Materials for energy storage and conversion in existing and future power systems, including fuel cells and batteries, photovoltaic cells, thermoelectric cells, and hybrids. ","NANO 101, NANO 102,",upper-division standing,,,,,,,,
NANO 168,"Electrical, Dielectric, and Magnetic Properties of Engineering Materials",4,"Introduction to physical principles of electrical, dielectric, and magnetic properties. Semiconductors, control of defects, thin film, and nanocrystal growth, electronic and optoelectronic devices. Processing-microstructure-property relations of dielectric materials, including piezoelectric, pyroelectric and ferroelectric, and magnetic materials. ",NANO 102,NANO 104,,,,,,,,
NANO 174,Mechanical Behavior of Materials,4,"Microscopic and macroscopic aspects of the mechanical behavior of engineering materials, with emphasis on recent development in materials characterization by mechanical methods. The fundamental aspects of plasticity in engineering materials, strengthening mechanisms, and mechanical failure modes of materials systems. ",NANO 108,,,,,,,,,
NANO 174L,Mechanical Behavior Laboratory,4,"Experimental investigation of mechanical behavior of engineering materials. Laboratory exercises emphasize the fundamental relationship between microstructure and mechanical properties, and the evolution of the microstructure as a consequence of rate process. ",NANO 174,,,,,,,,,
NANO 175,NanoEngineering in Medicine,4,"Introduction to nanomedicine. Topics include nanoscale material, biological systems vs. synthetic vs. bio-inspired systems, drug and gene delivery, molecular imaging, vaccines, immunoengineering, pharmacology, clinical application in cancer, cardiovascular disease, infectious disease, immune diseases, genetic disorders, skin diseases, and regenerative medicine. Students will not receive credit for both NANO 175 and CENG 175. ",,,,,,,,,,Upper-division standing.
NANO 181,Data Science in Materials Science,4,"Comprehensive introduction into the application of data science to materials science. Introduction to broad array of machine learning techniques (e.g., supervised, unsupervised, etc.) and applications (e.g., regression, dimensionality reduction, classification), with a focus on practical examples in materials science. ",NANO 114 or CENG 114,,,,,,,,,
NANO 199,Independent Study for Undergraduates,4–4,Research project as equivalent to a “senior thesis” can be approved for two NanoEngineering elective courses (eight units total). This course is taken as an elective on a P/NP basis. It must be done in consecutive quarters and the student must find a faculty member who will oversee the research project. Eligible students must have completed at least ninety units and must have a UC San Diego cumulative GPA of 3.0 or better. Detailed policy and procedures may be obtained from the Student Affairs Office. ,,,,,,,,,,Consent of instructor.
NANO 200,Graduate Seminar in Chemical Engineering,1,"Each graduate student in NANO is expected to attend three seminars per quarter, of his or her choice, dealing with current topics in chemical engineering. Topics will vary. Cross-listed with CENG 205. S/U grades only. May be taken for credit four times. ",,,,,,,,,,Graduate standing.
NANO 201,Introduction to NanoEngineering,4,"Understanding nanotechnology, broad implications, miniaturization: scaling laws; nanoscale physics; types and properties of nanomaterials; nanomechanical oscillators, nano(bio)electronics, nanoscale heat transfer; fluids at the nanoscale; machinery cell; applications of nanotechnology and nanobiotechnology. Students may not receive credit for both NANO 201 and CENG 211. ",,,,,,,,,,Graduate standing.
NANO 202,Intermolecular and Surface Forces,4,"Development of quantitative understanding of the different intermolecular forces between atoms and molecules and how these forces give rise to interesting phenomena at the nanoscale, such as flocculation, wetting, self-assembly in biological (natural) and synthetic systems. Cross-listed with CENG 212. Students may not receive credit for both NANO 202 and CENG 212. ",,,,,,,,,,Consent of instructor.
NANO 203,Nanoscale Characterization,4,"Examination of nanoscale characterization approaches including imaging, scattering, and spectroscopic techniques and their physical operating mechanisms. Microscopy (optical and electron: SEM, TEM); scattering and diffraction; spectroscopies (EDX, SIMS, mass spec, Raman, XPS, XAS); scanning probe microscopes (SPM, AFM); particle size analysis. ",,,,,,,,,,Graduate standing.
NANO 204,Nanoscale Physics and Modeling,4,"This course will introduce students to analytical and numerical methods such as statistical mechanisms, molecular simulations, and finite differences and finite element modeling through their application to NanoEngineering problems involving polymer and colloid self-assembly, absorption, phase separation, and diffusion. Cross-listed with CENG 214. Students may not receive credit for both NANO 204 and CENG 214. ",NANO 202 or consent of instructor,,,,,,,,,
NANO 205,Nanosystems Integration,4,Scaling issues and hierarchical assembly of nanoscale components into higher order structures which retain desired properties at microscale and macroscale levels. Novel ways to combine top-down and bottom-up processes for integration of heterogeneous components into higher order structures. Cross-listed with CENG 215. Students may not receive credit for both NANO 205 and CENG 215. ,,,,,,,,,,Consent of instructor.
NANO 208,Nanofabrication,4,"Basic engineering principles of nanofabrication. Topics include photo-electronbeam and nanoimprint lithography, block copolymers and self-assembled monolayers, colloidal assembly, biological nanofabrication. Cross-listed with CENG 208. Students may not receive credit for both NANO 208 and CENG 208. ",,,,,,,,,,Consent of instructor.
NANO 210,Molecular Modeling and Simulations of Nanoscale Systems,4,"Molecular and modeling and simulation techniques like molecular dynamics, Monte Carlo, and Brownian dynamics to model nanoscale systems and phenomena like molecular motors, self-assembly, protein-ligand binding, RNA, folding. Valuable hands-on experience with different simulators. ",,,,,,,,,,Department approval required.
NANO 212,Computational Modeling of Nanosystems,4,"Various modeling techniques like finite elements, finite differences, and simulation techniques like molecular dynamics and Monte Carlo to model fluid flow, mechanical properties, self-assembly at the nanoscale, and protein, RNA and DNA folding. ",,,,,,,,,,Department approval required.
NANO 227,Structure and Analysis of Solids,4,"Key concepts in the atomic structure and bonding of solids such as metals, ceramics, and semiconductors. Symmetry operations, point groups, lattice types, space groups, simple and complex inorganic compounds, structure/property comparisons, structure determination with X-ray diffraction. Ionic, covalent, metallic bonding compared with physical properties. Atomic and molecular orbitals, bands verses bonds, free electron theory. Cross-listed with MATS 227, MAE 251 and CHEM 222. Students may only receive credit for one of the following: CHEM 222, MAE 251, MATS 227, or NANO 227. ",,,,,,,,,,Graduate standing.
NANO 230,Synchrotron Characterization of Nanomaterials,4,"Advanced topics in characterizing nanomaterials using synchrotron X-ray sources. Introduction to synchrotron sources, X-ray interaction with matter, spectroscopic determination of electronic properties of nanomagnetic, structural determination using scattering techniques and X-ray imaging techniques. Cross-listed with CENG 230. Students may not receive credit for both NANO 230 and CENG 230. ",,,,,,,,,,Consent of instructor.
NANO 234,Advanced Nanoscale Fabrication,4,"Engineering principles of nanofabrication. Topics include photo-, electron beam, and nanoimprint lithography, block copolymers and self-assembled monolayers, colloidal assembly, biological nanofabrication. Relevance to applications in energy, electronics, and medicine will be discussed. ",,,,,,,,,,Department approval required.
NANO 238,Scanning Probe Microscopy,4,"Scanning electron microscopy (SEM) detectors, imaging, image interpretation, and artifacts, introduction to lenses, electron beam-specimen interactions. Operating principles and capabilities for atomic force microscopy and scanning tunneling microscopy, scanning optical microscopy and scanning transmission electron microscopy. ",,,,,,,,,,Consent of instructor.
NANO 241,Organic Nanomaterials,4,"This course will provide an introduction to the physics and chemistry of soft matter, followed by a literature-based critical examination of several ubiquitous classes of organic nano materials and their technological applications. Topics include self-assembled monolayers, block copolymers, liquid crystals, photoresists, organic electronic materials, micelles and vesicles, soft lithography, organic colloids, organic nano composites, and applications in biomedicine and food science. Cross-listed with CHEM 241. ",,,,,,,,,,Graduate standing.
NANO 242,Biochemistry and Molecular Biology,4,"Course is designed to give NanoEngineering students from a variety of backgrounds a working knowledge of biochemistry and molecular biology. While the course offers biochemistry basics and key themes in molecular biology, it will emphasize the role of engineering innovations. ",,,,,,,,,,Department approval required.
NANO 243,Nanomedicine,4,"Introduction to nanomedicine; diffusion and drug dispersion; diffusion in biological systems; drug permeation through biological barriers; drug transport by fluid motion; pharmacokinetics of drug distribution; drug delivery systems; nanomedicine in practice: cancers, cardiovascular diseases, immune diseases, and skin diseases. Cross-listed with CENG 207. Students may not receive credit for both NANO 243 and CENG 207. ",,,,,,,,,,Graduate standing.
NANO 244,Nanomachines and Nanorobots,4,"The structure and operational principles of different nature biomotors will be discussed. Related bio-inspired efforts aimed at developing artificial nanomotors will also be covered, along with the prospects of using biomotors and synthetic nanomotors in engineering environments. ",,,,,,,,,,Graduate standing.
NANO 245,Nanoelectronics,4,"An introduction to the nano electronics and nanospintronics; fundamentals of semiconductors; electronic band structure theory, electron transport in semiconductors and nano structures, nano devices. ",NANO 201,,,,,,,,,
NANO 247A,Advanced BioPhotonics,4,"Basic physics and chemistry of interaction of photons with matter; photonic radiation pressure; advanced optoelectronic detection systems, devices, methods, time-resolved fluorescent, chemiluminescent methods, fluorescent energy transfer techniques, quantum dots, near-field optical techniques, mechanisms of light sensitive biological systems including chloroplasts for photosynthetic energy conversion and basis of vision processes. Cross-listed with BENG 247A and ECE 247A. ",,,,,,,,,,Consent of instructor and graduate standing.
NANO 247B,BioElectronics,4,"Topics include photolithographic techniques for high-density DNA microarray production, incorporation of CMOS control into electronic DNA microarrays, direct electronic detection technology, bio-fuel cells, highly integrated devices (lab-on-a-chip, in vivo biosensors, etc.) Form heterogeneous materials and components. Cross-listed with BENG 247B and ECE 247B. ",,,,,,,,,,Consent of instructor and graduate standing.
