course_code,name,units,desc,prereq1,prereq2,prereq3,prereq4,prereq5,prereq6,prereq7,prereq8,prereq9,misc_prereq
CENG 215,Nanosystems Integration,4,"Discussion of scaling issues and how to carry out the effective hierarchical assembly of diverse molecular and nanoscale components into higher order structures that retain the desired electronic/photonic, structural, mechanical, or catalytic properties at the microscale and macroscale levels. Novel ways to combine the best aspects of both top-down and bottom-up processes to create a totally unique paradigm change for the integration of heterogeneous molecules and nanocomponents into higher order structures. Cross-listed with NANO 205. Students may not receive credit for both CENG 215 and NANO 205. ",,,,,,,,,,
CENG 221A,Heat Transfer,4,"Conduction, convection, and radiation heat transfer development of energy conservation equations. Analytical and numerical solutions to heat transport problems. Specific topics and applications vary. ",,,,,,,,,,Graduate standing.
CENG 221B,Mass Transfer,4,Fundamentals of diffusive and convective mass transfer and mass transfer with chemical reaction. Development of mass conservation equations. Analytical and numerical solutions to mass transport problems. Specific topics and applications will vary. ,,,,,,,,,,Graduate standing.
CENG 230,Synchrotron Characterization of Nanomaterials,4,"Advanced topics in characterizing nanomaterials using synchrotron X-ray sources. Introduction to synchrotron sources, X-ray interaction with matter, spectroscopic determination of electronic properties of nanomagnetic, structural determination using scattering techniques and X-ray imaging techniques. Cross-listed with NANO 230. Students may not receive credit for both CENG 230 and NANO 230. ",,,,,,,,,,Consent of instructor.
CENG 251,Thermodynamics,4,"Principles of thermodynamics of single and multicomponent systems. Phase equilibria. Estimation, calculation, and correlation of properties of liquids and gases. ",,,,,,,,,,Graduate standing.
CENG 252,Chemical Reaction Engineering,4,Analysis of chemical rate processes; complex kinetic systems. Chemical reactor properties in steady state and transient operations; optimal design policies. The interaction of chemical and physical transport processes in affecting reactor design and operating characteristics. Uniqueness/multiplicity and stability in reactor systems. Applications of the heterogeneous reactor systems. ,,,,,,,,,,Consent of instructor.
CENG 253,Heterogeneous Catalysis,4,"Physics and chemistry of heterogeneous catalysis. Adsorption/desorption kinetics, chemical bonding, isotherms, kinetic models, selection of catalysts, poisoning, experimental techniques. Cross-listed with NANO 259. Students may not receive credit for both CENG 253 and NANO 259. ",,,,,,,,,,Consent of instructor.
CENG 254,Biochemical Engineering Fundamentals,4,"Introduction to microbiology as relevant to the main topic, biological reactor analysis. Fermentation and enzyme technology. ",,,,,,,,,,Graduate standing.
CENG 255,Electrochemical Engineering,4,"Fundamentals of electrochemistry and electrochemical engineering. Structure of the double layer, cell potential and electrochemical thermodynamics, charge transfer kinetics, electrochemical transport phenomena, and introduction to colloidal chemistry. Applications such as corrosion prevention, electroplating, reactor design, batteries, and fuel cells. ",,,,,,,,,,Consent of instructor.
CENG 256,Biomaterials and Biomimetics,4,Fundamentals of materials science as applied to bioengineering design. Hierarchical structures. Cells and tissues. Natural and synthetic polymeric materials. Biomineralized materials. Biological composites. Cellular materials (foams). Functional biological materials. Biomaterials and implants. Bioinspired design and materials. Cross-listed with NANO 252 and MATS 255. Students may not receive credit for both CENG 256 and NANO 252 and MATS 255. ,,,,,,,,,,Graduate standing.
CENG 257,Process Technology in the Semiconductor Industry,4,"Brief introduction to solid-state materials and devices. Crystal growth and purification. Thin film technology. Application of chemical processing to the manufacture of semiconductor devices. Topics to be covered: physics of solids, unit operations of solid-state materials (bulk crystal growth, oxidation, vacuum science, chemical and physical vapor deposition, epitaxy, doping, etching). ",,,,,,,,,,Graduate standing. Open to chemical engineering and NanoEngineering majors.
CENG 273,Principles of Immune Engineering,4,"The course will emphasize the principles underlying the development of engineering tools to quantitatively measure complex information about the immune system that has fueled or inspired strategies for manufacturing immune cells, developing analytical methods for measuring immunity, and developing immunotherapies. Cross-listed with NANO 273. Students may not receive credit for CENG 273 and NANO 273. ",,,,,,,,,,Graduate standing.
CENG 296,Independent Study in Chemical Engineering,4,Independent reading or research on a problem as arranged by a faculty member. Must be taken for a letter grade only. ,,,,,,,,,,Consent of instructor.
CENG 299,Graduate Research in Chemical Engineering,1–12,S/U grades only. ,,,,,,,,,,Consent of instructor.
CENG 501,Teaching Experience,2,Teaching experience in an appropriate CENG undergraduate course under the direction of the faculty member in charge of the course. Lecturing one hour per week in either a problem-solving section or regular lecture. (S/U grades only.) ,,,,,,,,,,Consent of instructor and department approval. 
